root@lamp-ubuntu-s-1vcpu-1gb-tor1-01:~#  tcpdump -i eth0 tcp
tcpdump: verbose output suppressed, use -v or -vv for full protocol decode
listening on eth0, link-type EN10MB (Ethernet), capture size 262144 bytes
23:06:10.412871 IP 142.93.146.161.ssh > bras-base-toroon2638w-grc-51-142-114-112-45.dsl.bell.ca.49727: Flags [P.], seq 543513119:543513227, ack 2132241407, win 501, length 108
23:06:10.412949 IP 142.93.146.161.ssh > bras-base-toroon2638w-grc-51-142-114-112-45.dsl.bell.ca.49727: Flags [P.], seq 108:144, ack 1, win 501, length 36
23:06:10.412982 IP 142.93.146.161.ssh > bras-base-toroon2638w-grc-51-142-114-112-45.dsl.bell.ca.49727: Flags [P.], seq 144:252, ack 1, win 501, length 108
23:06:10.413025 IP 142.93.146.161.ssh > bras-base-toroon2638w-grc-51-142-114-112-45.dsl.bell.ca.49727: Flags [P.], seq 252:288, ack 1, win 501, length 36
23:06:10.416647 IP bras-base-toroon2638w-grc-51-142-114-112-45.dsl.bell.ca.49727 > 142.93.146.161.ssh: Flags [.], ack 288, win 2481, length 0
23:06:10.431763 IP 142.93.146.161.ssh > bras-base-toroon2638w-grc-51-142-114-112-45.dsl.bell.ca.49727: Flags [P.], seq 288:500, ack 1, win 501, length 212
23:06:10.431856 IP 142.93.146.161.ssh > bras-base-toroon2638w-grc-51-142-114-112-45.dsl.bell.ca.49727: Flags [P.], seq 500:536, ack 1, win 501, length 36
23:06:10.431923 IP 142.93.146.161.ssh > bras-base-toroon2638w-grc-51-142-114-112-45.dsl.bell.ca.49727: Flags [P.], seq 536:724, ack 1, win 501, length 188
23:06:10.431988 IP 142.93.146.161.ssh > bras-base-toroon2638w-grc-51-142-114-112-45.dsl.bell.ca.49727: Flags [P.], seq 724:760, ack 1, win 501, length 36
23:06:10.432047 IP 142.93.146.161.ssh > bras-base-toroon2638w-grc-51-142-114-112-45.dsl.bell.ca.49727: Flags [P.], seq 760:948, ack 1, win 501, length 188
23:06:10.432088 IP 142.93.146.161.ssh > bras-base-toroon2638w-grc-51-142-114-112-45.dsl.bell.ca.49727: Flags [P.], seq 948:984, ack 1, win 501, length 36
23:06:10.432141 IP 142.93.146.161.ssh > bras-base-toroon2638w-grc-51-142-114-112-45.dsl.bell.ca.49727: Flags [P.], seq 984:1172, ack 1, win 501, length 188
23:06:10.432182 IP 142.93.146.161.ssh > bras-base-toroon2638w-grc-51-142-114-112-45.dsl.bell.ca.49727: Flags [P.], seq 1172:1208, ack 1, win 501, length 36
23:06:10.432233 IP 142.93.146.161.ssh > bras-base-toroon2638w-grc-51-142-114-112-45.dsl.bell.ca.49727: Flags [P.], seq 1208:1388, ack 1, win 501, length 180
23:06:10.432273 IP 142.93.146.161.ssh > bras-base-toroon2638w-grc-51-142-114-112-45.dsl.bell.ca.49727: Flags [P.], seq 1388:1424, ack 1, win 501, length 36
23:06:10.435541 IP bras-base-toroon2638w-grc-51-142-114-112-45.dsl.bell.ca.49727 > 142.93.146.161.ssh: Flags [.], ack 948, win 2478, length 0
23:06:10.435570 IP 142.93.146.161.ssh > bras-base-toroon2638w-grc-51-142-114-112-45.dsl.bell.ca.49727: Flags [P.], seq 1424:3696, ack 1, win 501, length 2272
23:06:10.435652 IP 142.93.146.161.ssh > bras-base-toroon2638w-grc-51-142-114-112-45.dsl.bell.ca.49727: Flags [P.], seq 3696:3876, ack 1, win 501, length 180
23:06:10.435699 IP 142.93.146.161.ssh > bras-base-toroon2638w-grc-51-142-114-112-45.dsl.bell.ca.49727: Flags [P.], seq 3876:3912, ack 1, win 501, length 36
23:06:10.435751 IP 142.93.146.161.ssh > bras-base-toroon2638w-grc-51-142-114-112-45.dsl.bell.ca.49727: Flags [P.], seq 3912:4108, ack 1, win 501, length 196
23:06:10.435791 IP 142.93.146.161.ssh > bras-base-toroon2638w-grc-51-142-114-112-45.dsl.bell.ca.49727: Flags [P.], seq 4108:4144, ack 1, win 501, length 36
23:06:10.435839 IP 142.93.146.161.ssh > bras-base-toroon2638w-grc-51-142-114-112-45.dsl.bell.ca.49727: Flags [P.], seq 4144:4340, ack 1, win 501, length 196
23:06:10.435919 IP 142.93.146.161.ssh > bras-base-toroon2638w-grc-51-142-114-112-45.dsl.bell.ca.49727: Flags [P.], seq 4340:4572, ack 1, win 501, length 232
23:06:10.435999 IP 142.93.146.161.ssh > bras-base-toroon2638w-grc-51-142-114-112-45.dsl.bell.ca.49727: Flags [P.], seq 4572:4608, ack 1, win 501, length 36
23:06:10.436064 IP 142.93.146.161.ssh > bras-base-toroon2638w-grc-51-142-114-112-45.dsl.bell.ca.49727: Flags [P.], seq 4608:4804, ack 1, win 501, length 196
23:06:10.436637 IP bras-base-toroon2638w-grc-51-142-114-112-45.dsl.bell.ca.49727 > 142.93.146.161.ssh: Flags [.], ack 1424, win 2484, length 0
23:06:10.436656 IP 142.93.146.161.ssh > bras-base-toroon2638w-grc-51-142-114-112-45.dsl.bell.ca.49727: Flags [P.], seq 4804:6000, ack 1, win 501, length 1196
23:06:10.436723 IP 142.93.146.161.ssh > bras-base-toroon2638w-grc-51-142-114-112-45.dsl.bell.ca.49727: Flags [P.], seq 6000:6180, ack 1, win 501, length 180
23:06:10.436767 IP 142.93.146.161.ssh > bras-base-toroon2638w-grc-51-142-114-112-45.dsl.bell.ca.49727: Flags [P.], seq 6180:6216, ack 1, win 501, length 36
23:06:10.436845 IP 142.93.146.161.ssh > bras-base-toroon2638w-grc-51-142-114-112-45.dsl.bell.ca.49727: Flags [P.], seq 6216:6412, ack 1, win 501, length 196
23:06:10.436887 IP 142.93.146.161.ssh > bras-base-toroon2638w-grc-51-142-114-112-45.dsl.bell.ca.49727: Flags [P.], seq 6412:6448, ack 1, win 501, length 36
23:06:10.436937 IP 142.93.146.161.ssh > bras-base-toroon2638w-grc-51-142-114-112-45.dsl.bell.ca.49727: Flags [P.], seq 6448:6644, ack 1, win 501, length 196
23:06:10.436977 IP 142.93.146.161.ssh > bras-base-toroon2638w-grc-51-142-114-112-45.dsl.bell.ca.49727: Flags [P.], seq 6644:6680, ack 1, win 501, length 36
23:06:10.437044 IP 142.93.146.161.ssh > bras-base-toroon2638w-grc-51-142-114-112-45.dsl.bell.ca.49727: Flags [P.], seq 6680:6876, ack 1, win 501, length 196
23:06:10.437088 IP 142.93.146.161.ssh > bras-base-toroon2638w-grc-51-142-114-112-45.dsl.bell.ca.49727: Flags [P.], seq 6876:6912, ack 1, win 501, length 36
23:06:10.437142 IP 142.93.146.161.ssh > bras-base-toroon2638w-grc-51-142-114-112-45.dsl.bell.ca.49727: Flags [P.], seq 6912:7108, ack 1, win 501, length 196
23:06:10.445413 IP bras-base-toroon2638w-grc-51-142-114-112-45.dsl.bell.ca.49727 > 142.93.146.161.ssh: Flags [.], ack 1424, win 2484, options [nop,nop,sack 1 {2876:3696}], length 0
23:06:10.445458 IP 142.93.146.161.ssh > bras-base-toroon2638w-grc-51-142-114-112-45.dsl.bell.ca.49727: Flags [P.], seq 7108:8536, ack 1, win 501, length 1428
23:06:10.445477 IP bras-base-toroon2638w-grc-51-142-114-112-45.dsl.bell.ca.49727 > 142.93.146.161.ssh: Flags [.], ack 3696, win 2484, length 0
23:06:10.445513 IP bras-base-toroon2638w-grc-51-142-114-112-45.dsl.bell.ca.49727 > 142.93.146.161.ssh: Flags [.], ack 7108, win 2484, length 0
23:06:10.445647 IP 142.93.146.161.ssh > bras-base-toroon2638w-grc-51-142-114-112-45.dsl.bell.ca.49727: Flags [P.], seq 8536:8756, ack 1, win 501, length 220
23:06:10.445709 IP 142.93.146.161.ssh > bras-base-toroon2638w-grc-51-142-114-112-45.dsl.bell.ca.49727: Flags [P.], seq 8756:8792, ack 1, win 501, length 36
23:06:10.445771 IP 142.93.146.161.ssh > bras-base-toroon2638w-grc-51-142-114-112-45.dsl.bell.ca.49727: Flags [P.], seq 8792:8988, ack 1, win 501, length 196
23:06:10.445824 IP 142.93.146.161.ssh > bras-base-toroon2638w-grc-51-142-114-112-45.dsl.bell.ca.49727: Flags [P.], seq 8988:9024, ack 1, win 501, length 36
23:06:10.445920 IP 142.93.146.161.ssh > bras-base-toroon2638w-grc-51-142-114-112-45.dsl.bell.ca.49727: Flags [P.], seq 9024:9204, ack 1, win 501, length 180
23:06:10.445968 IP 142.93.146.161.ssh > bras-base-toroon2638w-grc-51-142-114-112-45.dsl.bell.ca.49727: Flags [P.], seq 9204:9240, ack 1, win 501, length 36
23:06:10.446020 IP 142.93.146.161.ssh > bras-base-toroon2638w-grc-51-142-114-112-45.dsl.bell.ca.49727: Flags [P.], seq 9240:9420, ack 1, win 501, length 180
23:06:10.446060 IP 142.93.146.161.ssh > bras-base-toroon2638w-grc-51-142-114-112-45.dsl.bell.ca.49727: Flags [P.], seq 9420:9456, ack 1, win 501, length 36
23:06:10.446111 IP 142.93.146.161.ssh > bras-base-toroon2638w-grc-51-142-114-112-45.dsl.bell.ca.49727: Flags [P.], seq 9456:9652, ack 1, win 501, length 196
23:06:10.446152 IP 142.93.146.161.ssh > bras-base-toroon2638w-grc-51-142-114-112-45.dsl.bell.ca.49727: Flags [P.], seq 9652:9688, ack 1, win 501, length 36
23:06:10.446210 IP 142.93.146.161.ssh > bras-base-toroon2638w-grc-51-142-114-112-45.dsl.bell.ca.49727: Flags [P.], seq 9688:9884, ack 1, win 501, length 196
23:06:10.446250 IP 142.93.146.161.ssh > bras-base-toroon2638w-grc-51-142-114-112-45.dsl.bell.ca.49727: Flags [P.], seq 9884:9920, ack 1, win 501, length 36
23:06:10.446299 IP 142.93.146.161.ssh > bras-base-toroon2638w-grc-51-142-114-112-45.dsl.bell.ca.49727: Flags [P.], seq 9920:10116, ack 1, win 501, length 196
23:06:10.446338 IP 142.93.146.161.ssh > bras-base-toroon2638w-grc-51-142-114-112-45.dsl.bell.ca.49727: Flags [P.], seq 10116:10152, ack 1, win 501, length 36
23:06:10.446388 IP 142.93.146.161.ssh > bras-base-toroon2638w-grc-51-142-114-112-45.dsl.bell.ca.49727: Flags [P.], seq 10152:10348, ack 1, win 501, length 196
23:06:10.446427 IP 142.93.146.161.ssh > bras-base-toroon2638w-grc-51-142-114-112-45.dsl.bell.ca.49727: Flags [P.], seq 10348:10384, ack 1, win 501, length 36
23:06:10.446475 IP 142.93.146.161.ssh > bras-base-toroon2638w-grc-51-142-114-112-45.dsl.bell.ca.49727: Flags [P.], seq 10384:10580, ack 1, win 501, length 196
23:06:10.446515 IP 142.93.146.161.ssh > bras-base-toroon2638w-grc-51-142-114-112-45.dsl.bell.ca.49727: Flags [P.], seq 10580:10616, ack 1, win 501, length 36
23:06:10.446576 IP 142.93.146.161.ssh > bras-base-toroon2638w-grc-51-142-114-112-45.dsl.bell.ca.49727: Flags [P.], seq 10616:10812, ack 1, win 501, length 196
23:06:10.446613 IP 142.93.146.161.ssh > bras-base-toroon2638w-grc-51-142-114-112-45.dsl.bell.ca.49727: Flags [P.], seq 10812:10848, ack 1, win 501, length 36
23:06:10.446661 IP 142.93.146.161.ssh > bras-base-toroon2638w-grc-51-142-114-112-45.dsl.bell.ca.49727: Flags [P.], seq 10848:11044, ack 1, win 501, length 196
23:06:10.446701 IP 142.93.146.161.ssh > bras-base-toroon2638w-grc-51-142-114-112-45.dsl.bell.ca.49727: Flags [P.], seq 11044:11080, ack 1, win 501, length 36
23:06:10.446759 IP 142.93.146.161.ssh > bras-base-toroon2638w-grc-51-142-114-112-45.dsl.bell.ca.49727: Flags [P.], seq 11080:11276, ack 1, win 501, length 196
23:06:10.446797 IP 142.93.146.161.ssh > bras-base-toroon2638w-grc-51-142-114-112-45.dsl.bell.ca.49727: Flags [P.], seq 11276:11312, ack 1, win 501, length 36
23:06:10.446846 IP 142.93.146.161.ssh > bras-base-toroon2638w-grc-51-142-114-112-45.dsl.bell.ca.49727: Flags [P.], seq 11312:11508, ack 1, win 501, length 196
23:06:10.446886 IP 142.93.146.161.ssh > bras-base-toroon2638w-grc-51-142-114-112-45.dsl.bell.ca.49727: Flags [P.], seq 11508:11544, ack 1, win 501, length 36
23:06:10.446934 IP 142.93.146.161.ssh > bras-base-toroon2638w-grc-51-142-114-112-45.dsl.bell.ca.49727: Flags [P.], seq 11544:11740, ack 1, win 501, length 196
23:06:10.446974 IP 142.93.146.161.ssh > bras-base-toroon2638w-grc-51-142-114-112-45.dsl.bell.ca.49727: Flags [P.], seq 11740:11776, ack 1, win 501, length 36
23:06:10.447037 IP 142.93.146.161.ssh > bras-base-toroon2638w-grc-51-142-114-112-45.dsl.bell.ca.49727: Flags [P.], seq 11776:11972, ack 1, win 501, length 196
23:06:10.447105 IP 142.93.146.161.ssh > bras-base-toroon2638w-grc-51-142-114-112-45.dsl.bell.ca.49727: Flags [P.], seq 11972:12008, ack 1, win 501, length 36
23:06:10.447197 IP 142.93.146.161.ssh > bras-base-toroon2638w-grc-51-142-114-112-45.dsl.bell.ca.49727: Flags [P.], seq 12008:12204, ack 1, win 501, length 196
23:06:10.447252 IP 142.93.146.161.ssh > bras-base-toroon2638w-grc-51-142-114-112-45.dsl.bell.ca.49727: Flags [P.], seq 12204:12240, ack 1, win 501, length 36
23:06:10.447307 IP 142.93.146.161.ssh > bras-base-toroon2638w-grc-51-142-114-112-45.dsl.bell.ca.49727: Flags [P.], seq 12240:12436, ack 1, win 501, length 196
23:06:10.447389 IP 142.93.146.161.ssh > bras-base-toroon2638w-grc-51-142-114-112-45.dsl.bell.ca.49727: Flags [P.], seq 12436:12472, ack 1, win 501, length 36
23:06:10.447462 IP 142.93.146.161.ssh > bras-base-toroon2638w-grc-51-142-114-112-45.dsl.bell.ca.49727: Flags [P.], seq 12472:12668, ack 1, win 501, length 196
23:06:10.447504 IP 142.93.146.161.ssh > bras-base-toroon2638w-grc-51-142-114-112-45.dsl.bell.ca.49727: Flags [P.], seq 12668:12704, ack 1, win 501, length 36
23:06:10.447555 IP 142.93.146.161.ssh > bras-base-toroon2638w-grc-51-142-114-112-45.dsl.bell.ca.49727: Flags [P.], seq 12704:12900, ack 1, win 501, length 196
23:06:10.447596 IP 142.93.146.161.ssh > bras-base-toroon2638w-grc-51-142-114-112-45.dsl.bell.ca.49727: Flags [P.], seq 12900:12936, ack 1, win 501, length 36
23:06:10.447644 IP 142.93.146.161.ssh > bras-base-toroon2638w-grc-51-142-114-112-45.dsl.bell.ca.49727: Flags [P.], seq 12936:13132, ack 1, win 501, length 196
23:06:10.451638 IP bras-base-toroon2638w-grc-51-142-114-112-45.dsl.bell.ca.49727 > 142.93.146.161.ssh: Flags [.], ack 11544, win 2484, length 0
23:06:10.451674 IP 142.93.146.161.ssh > bras-base-toroon2638w-grc-51-142-114-112-45.dsl.bell.ca.49727: Flags [P.], seq 13132:18504, ack 1, win 501, length 5372
23:06:10.451766 IP 142.93.146.161.ssh > bras-base-toroon2638w-grc-51-142-114-112-45.dsl.bell.ca.49727: Flags [P.], seq 18504:18684, ack 1, win 501, length 180
23:06:10.451812 IP 142.93.146.161.ssh > bras-base-toroon2638w-grc-51-142-114-112-45.dsl.bell.ca.49727: Flags [P.], seq 18684:18720, ack 1, win 501, length 36
23:06:10.451875 IP 142.93.146.161.ssh > bras-base-toroon2638w-grc-51-142-114-112-45.dsl.bell.ca.49727: Flags [P.], seq 18720:18916, ack 1, win 501, length 196
23:06:10.451916 IP 142.93.146.161.ssh > bras-base-toroon2638w-grc-51-142-114-112-45.dsl.bell.ca.49727: Flags [P.], seq 18916:18952, ack 1, win 501, length 36
23:06:10.451967 IP 142.93.146.161.ssh > bras-base-toroon2638w-grc-51-142-114-112-45.dsl.bell.ca.49727: Flags [P.], seq 18952:19148, ack 1, win 501, length 196
23:06:10.452006 IP 142.93.146.161.ssh > bras-base-toroon2638w-grc-51-142-114-112-45.dsl.bell.ca.49727: Flags [P.], seq 19148:19184, ack 1, win 501, length 36
23:06:10.452055 IP 142.93.146.161.ssh > bras-base-toroon2638w-grc-51-142-114-112-45.dsl.bell.ca.49727: Flags [P.], seq 19184:19380, ack 1, win 501, length 196
23:06:10.452094 IP 142.93.146.161.ssh > bras-base-toroon2638w-grc-51-142-114-112-45.dsl.bell.ca.49727: Flags [P.], seq 19380:19416, ack 1, win 501, length 36
23:06:10.452142 IP 142.93.146.161.ssh > bras-base-toroon2638w-grc-51-142-114-112-45.dsl.bell.ca.49727: Flags [P.], seq 19416:19612, ack 1, win 501, length 196
23:06:10.452182 IP 142.93.146.161.ssh > bras-base-toroon2638w-grc-51-142-114-112-45.dsl.bell.ca.49727: Flags [P.], seq 19612:19648, ack 1, win 501, length 36
23:06:10.452231 IP 142.93.146.161.ssh > bras-base-toroon2638w-grc-51-142-114-112-45.dsl.bell.ca.49727: Flags [P.], seq 19648:19844, ack 1, win 501, length 196
23:06:10.452269 IP 142.93.146.161.ssh > bras-base-toroon2638w-grc-51-142-114-112-45.dsl.bell.ca.49727: Flags [P.], seq 19844:19880, ack 1, win 501, length 36
23:06:10.452319 IP 142.93.146.161.ssh > bras-base-toroon2638w-grc-51-142-114-112-45.dsl.bell.ca.49727: Flags [P.], seq 19880:20076, ack 1, win 501, length 196
23:06:10.452358 IP 142.93.146.161.ssh > bras-base-toroon2638w-grc-51-142-114-112-45.dsl.bell.ca.49727: Flags [P.], seq 20076:20112, ack 1, win 501, length 36
23:06:10.452407 IP 142.93.146.161.ssh > bras-base-toroon2638w-grc-51-142-114-112-45.dsl.bell.ca.49727: Flags [P.], seq 20112:20308, ack 1, win 501, length 196
23:06:10.452446 IP 142.93.146.161.ssh > bras-base-toroon2638w-grc-51-142-114-112-45.dsl.bell.ca.49727: Flags [P.], seq 20308:20344, ack 1, win 501, length 36
23:06:10.452464 IP bras-base-toroon2638w-grc-51-142-114-112-45.dsl.bell.ca.49727 > 142.93.146.161.ssh: Flags [.], ack 13132, win 2484, length 0
23:06:10.452528 IP 142.93.146.161.ssh > bras-base-toroon2638w-grc-51-142-114-112-45.dsl.bell.ca.49727: Flags [P.], seq 20344:20540, ack 1, win 501, length 196
23:06:10.452572 IP 142.93.146.161.ssh > bras-base-toroon2638w-grc-51-142-114-112-45.dsl.bell.ca.49727: Flags [P.], seq 20540:20576, ack 1, win 501, length 36
23:06:10.452638 IP 142.93.146.161.ssh > bras-base-toroon2638w-grc-51-142-114-112-45.dsl.bell.ca.49727: Flags [P.], seq 20576:20772, ack 1, win 501, length 196
23:06:10.452680 IP 142.93.146.161.ssh > bras-base-toroon2638w-grc-51-142-114-112-45.dsl.bell.ca.49727: Flags [P.], seq 20772:20808, ack 1, win 501, length 36
23:06:10.452755 IP 142.93.146.161.ssh > bras-base-toroon2638w-grc-51-142-114-112-45.dsl.bell.ca.49727: Flags [P.], seq 20808:21004, ack 1, win 501, length 196
23:06:10.452833 IP 142.93.146.161.ssh > bras-base-toroon2638w-grc-51-142-114-112-45.dsl.bell.ca.49727: Flags [P.], seq 21004:21040, ack 1, win 501, length 36
23:06:10.452912 IP 142.93.146.161.ssh > bras-base-toroon2638w-grc-51-142-114-112-45.dsl.bell.ca.49727: Flags [P.], seq 21040:21236, ack 1, win 501, length 196
23:06:10.452953 IP 142.93.146.161.ssh > bras-base-toroon2638w-grc-51-142-114-112-45.dsl.bell.ca.49727: Flags [P.], seq 21236:21272, ack 1, win 501, length 36
23:06:10.453022 IP 142.93.146.161.ssh > bras-base-toroon2638w-grc-51-142-114-112-45.dsl.bell.ca.49727: Flags [P.], seq 21272:21468, ack 1, win 501, length 196
23:06:10.453082 IP 142.93.146.161.ssh > bras-base-toroon2638w-grc-51-142-114-112-45.dsl.bell.ca.49727: Flags [P.], seq 21468:21504, ack 1, win 501, length 36
23:06:10.453144 IP 142.93.146.161.ssh > bras-base-toroon2638w-grc-51-142-114-112-45.dsl.bell.ca.49727: Flags [P.], seq 21504:21700, ack 1, win 501, length 196
23:06:10.453185 IP 142.93.146.161.ssh > bras-base-toroon2638w-grc-51-142-114-112-45.dsl.bell.ca.49727: Flags [P.], seq 21700:21736, ack 1, win 501, length 36
23:06:10.453234 IP 142.93.146.161.ssh > bras-base-toroon2638w-grc-51-142-114-112-45.dsl.bell.ca.49727: Flags [P.], seq 21736:21932, ack 1, win 501, length 196
23:06:10.453274 IP 142.93.146.161.ssh > bras-base-toroon2638w-grc-51-142-114-112-45.dsl.bell.ca.49727: Flags [P.], seq 21932:21968, ack 1, win 501, length 36
23:06:10.453333 IP 142.93.146.161.ssh > bras-base-toroon2638w-grc-51-142-114-112-45.dsl.bell.ca.49727: Flags [P.], seq 21968:22164, ack 1, win 501, length 196
23:06:10.453379 IP 142.93.146.161.ssh > bras-base-toroon2638w-grc-51-142-114-112-45.dsl.bell.ca.49727: Flags [P.], seq 22164:22200, ack 1, win 501, length 36
23:06:10.453430 IP 142.93.146.161.ssh > bras-base-toroon2638w-grc-51-142-114-112-45.dsl.bell.ca.49727: Flags [P.], seq 22200:22396, ack 1, win 501, length 196
23:06:10.453470 IP 142.93.146.161.ssh > bras-base-toroon2638w-grc-51-142-114-112-45.dsl.bell.ca.49727: Flags [P.], seq 22396:22432, ack 1, win 501, length 36
23:06:10.453518 IP 142.93.146.161.ssh > bras-base-toroon2638w-grc-51-142-114-112-45.dsl.bell.ca.49727: Flags [P.], seq 22432:22628, ack 1, win 501, length 196
23:06:10.453557 IP 142.93.146.161.ssh > bras-base-toroon2638w-grc-51-142-114-112-45.dsl.bell.ca.49727: Flags [P.], seq 22628:22664, ack 1, win 501, length 36
23:06:10.453614 IP 142.93.146.161.ssh > bras-base-toroon2638w-grc-51-142-114-112-45.dsl.bell.ca.49727: Flags [P.], seq 22664:22844, ack 1, win 501, length 180
23:06:10.453680 IP 142.93.146.161.ssh > bras-base-toroon2638w-grc-51-142-114-112-45.dsl.bell.ca.49727: Flags [P.], seq 22844:22880, ack 1, win 501, length 36
23:06:10.453701 IP 142.93.146.161.ssh > bras-base-toroon2638w-grc-51-142-114-112-45.dsl.bell.ca.49727: Flags [P.], seq 22880:23076, ack 1, win 501, length 196
23:06:10.453738 IP 142.93.146.161.ssh > bras-base-toroon2638w-grc-51-142-114-112-45.dsl.bell.ca.49727: Flags [P.], seq 23076:23112, ack 1, win 501, length 36
23:06:10.453787 IP 142.93.146.161.ssh > bras-base-toroon2638w-grc-51-142-114-112-45.dsl.bell.ca.49727: Flags [P.], seq 23112:23308, ack 1, win 501, length 196
23:06:10.453827 IP 142.93.146.161.ssh > bras-base-toroon2638w-grc-51-142-114-112-45.dsl.bell.ca.49727: Flags [P.], seq 23308:23344, ack 1, win 501, length 36
23:06:10.453888 IP 142.93.146.161.ssh > bras-base-toroon2638w-grc-51-142-114-112-45.dsl.bell.ca.49727: Flags [P.], seq 23344:23540, ack 1, win 501, length 196
23:06:10.453968 IP 142.93.146.161.ssh > bras-base-toroon2638w-grc-51-142-114-112-45.dsl.bell.ca.49727: Flags [P.], seq 23540:23896, ack 1, win 501, length 356
23:06:10.454091 IP 142.93.146.161.ssh > bras-base-toroon2638w-grc-51-142-114-112-45.dsl.bell.ca.49727: Flags [P.], seq 23896:25212, ack 1, win 501, length 1316
23:06:10.454193 IP 142.93.146.161.ssh > bras-base-toroon2638w-grc-51-142-114-112-45.dsl.bell.ca.49727: Flags [P.], seq 25212:26208, ack 1, win 501, length 996
23:06:10.454280 IP 142.93.146.161.ssh > bras-base-toroon2638w-grc-51-142-114-112-45.dsl.bell.ca.49727: Flags [P.], seq 26208:27044, ack 1, win 501, length 836
23:06:10.454360 IP 142.93.146.161.ssh > bras-base-toroon2638w-grc-51-142-114-112-45.dsl.bell.ca.49727: Flags [P.], seq 27044:27720, ack 1, win 501, length 676
23:06:10.454447 IP 142.93.146.161.ssh > bras-base-toroon2638w-grc-51-142-114-112-45.dsl.bell.ca.49727: Flags [P.], seq 27720:28236, ack 1, win 501, length 516
23:06:10.454523 IP 142.93.146.161.ssh > bras-base-toroon2638w-grc-51-142-114-112-45.dsl.bell.ca.49727: Flags [P.], seq 28236:28592, ack 1, win 501, length 356
23:06:10.454597 IP 142.93.146.161.ssh > bras-base-toroon2638w-grc-51-142-114-112-45.dsl.bell.ca.49727: Flags [P.], seq 28592:28788, ack 1, win 501, length 196
23:06:10.454653 IP 142.93.146.161.ssh > bras-base-toroon2638w-grc-51-142-114-112-45.dsl.bell.ca.49727: Flags [P.], seq 28788:28984, ack 1, win 501, length 196
23:06:10.454713 IP 142.93.146.161.ssh > bras-base-toroon2638w-grc-51-142-114-112-45.dsl.bell.ca.49727: Flags [P.], seq 28984:29180, ack 1, win 501, length 196
23:06:10.454771 IP 142.93.146.161.ssh > bras-base-toroon2638w-grc-51-142-114-112-45.dsl.bell.ca.49727: Flags [P.], seq 29180:29376, ack 1, win 501, length 196
23:06:10.454830 IP 142.93.146.161.ssh > bras-base-toroon2638w-grc-51-142-114-112-45.dsl.bell.ca.49727: Flags [P.], seq 29376:29572, ack 1, win 501, length 196
23:06:10.454897 IP 142.93.146.161.ssh > bras-base-toroon2638w-grc-51-142-114-112-45.dsl.bell.ca.49727: Flags [P.], seq 29572:29768, ack 1, win 501, length 196
23:06:10.454960 IP 142.93.146.161.ssh > bras-base-toroon2638w-grc-51-142-114-112-45.dsl.bell.ca.49727: Flags [P.], seq 29768:29964, ack 1, win 501, length 196
23:06:10.455017 IP 142.93.146.161.ssh > bras-base-toroon2638w-grc-51-142-114-112-45.dsl.bell.ca.49727: Flags [P.], seq 29964:30160, ack 1, win 501, length 196
23:06:10.455072 IP 142.93.146.161.ssh > bras-base-toroon2638w-grc-51-142-114-112-45.dsl.bell.ca.49727: Flags [P.], seq 30160:30356, ack 1, win 501, length 196
23:06:10.455130 IP 142.93.146.161.ssh > bras-base-toroon2638w-grc-51-142-114-112-45.dsl.bell.ca.49727: Flags [P.], seq 30356:30552, ack 1, win 501, length 196
23:06:10.455196 IP 142.93.146.161.ssh > bras-base-toroon2638w-grc-51-142-114-112-45.dsl.bell.ca.49727: Flags [P.], seq 30552:30748, ack 1, win 501, length 196
23:06:10.455283 IP 142.93.146.161.ssh > bras-base-toroon2638w-grc-51-142-114-112-45.dsl.bell.ca.49727: Flags [P.], seq 30748:30944, ack 1, win 501, length 196
23:06:10.455425 IP 142.93.146.161.ssh > bras-base-toroon2638w-grc-51-142-114-112-45.dsl.bell.ca.49727: Flags [P.], seq 30944:31140, ack 1, win 501, length 196
23:06:10.455493 IP 142.93.146.161.ssh > bras-base-toroon2638w-grc-51-142-114-112-45.dsl.bell.ca.49727: Flags [P.], seq 31140:31336, ack 1, win 501, length 196
23:06:10.455550 IP 142.93.146.161.ssh > bras-base-toroon2638w-grc-51-142-114-112-45.dsl.bell.ca.49727: Flags [P.], seq 31336:31532, ack 1, win 501, length 196
23:06:10.455608 IP 142.93.146.161.ssh > bras-base-toroon2638w-grc-51-142-114-112-45.dsl.bell.ca.49727: Flags [P.], seq 31532:31728, ack 1, win 501, length 196
23:06:10.455666 IP 142.93.146.161.ssh > bras-base-toroon2638w-grc-51-142-114-112-45.dsl.bell.ca.49727: Flags [P.], seq 31728:31924, ack 1, win 501, length 196
23:06:10.455724 IP 142.93.146.161.ssh > bras-base-toroon2638w-grc-51-142-114-112-45.dsl.bell.ca.49727: Flags [P.], seq 31924:32120, ack 1, win 501, length 196
23:06:10.455783 IP 142.93.146.161.ssh > bras-base-toroon2638w-grc-51-142-114-112-45.dsl.bell.ca.49727: Flags [P.], seq 32120:32316, ack 1, win 501, length 196
23:06:10.455842 IP 142.93.146.161.ssh > bras-base-toroon2638w-grc-51-142-114-112-45.dsl.bell.ca.49727: Flags [P.], seq 32316:32512, ack 1, win 501, length 196
23:06:10.455899 IP 142.93.146.161.ssh > bras-base-toroon2638w-grc-51-142-114-112-45.dsl.bell.ca.49727: Flags [P.], seq 32512:32708, ack 1, win 501, length 196
23:06:10.455960 IP 142.93.146.161.ssh > bras-base-toroon2638w-grc-51-142-114-112-45.dsl.bell.ca.49727: Flags [P.], seq 32708:32904, ack 1, win 501, length 196
23:06:10.456026 IP 142.93.146.161.ssh > bras-base-toroon2638w-grc-51-142-114-112-45.dsl.bell.ca.49727: Flags [P.], seq 32904:33100, ack 1, win 501, length 196
23:06:10.456085 IP 142.93.146.161.ssh > bras-base-toroon2638w-grc-51-142-114-112-45.dsl.bell.ca.49727: Flags [P.], seq 33100:33296, ack 1, win 501, length 196
23:06:10.456143 IP 142.93.146.161.ssh > bras-base-toroon2638w-grc-51-142-114-112-45.dsl.bell.ca.49727: Flags [P.], seq 33296:33492, ack 1, win 501, length 196
23:06:10.456198 IP 142.93.146.161.ssh > bras-base-toroon2638w-grc-51-142-114-112-45.dsl.bell.ca.49727: Flags [P.], seq 33492:33688, ack 1, win 501, length 196
23:06:10.456771 IP bras-base-toroon2638w-grc-51-142-114-112-45.dsl.bell.ca.49727 > 142.93.146.161.ssh: Flags [.], ack 14584, win 2484, options [nop,nop,sack 1 {16036:17488}], length 0
23:06:10.456831 IP 142.93.146.161.ssh > bras-base-toroon2638w-grc-51-142-114-112-45.dsl.bell.ca.49727: Flags [P.], seq 33688:33884, ack 1, win 501, length 196
23:06:10.456842 IP bras-base-toroon2638w-grc-51-142-114-112-45.dsl.bell.ca.49727 > 142.93.146.161.ssh: Flags [.], ack 17488, win 2484, length 0
23:06:10.456849 IP bras-base-toroon2638w-grc-51-142-114-112-45.dsl.bell.ca.49727 > 142.93.146.161.ssh: Flags [.], ack 20344, win 2484, length 0
23:06:10.456964 IP 142.93.146.161.ssh > bras-base-toroon2638w-grc-51-142-114-112-45.dsl.bell.ca.49727: Flags [P.], seq 33884:34560, ack 1, win 501, length 676
23:06:10.457026 IP 142.93.146.161.ssh > bras-base-toroon2638w-grc-51-142-114-112-45.dsl.bell.ca.49727: Flags [P.], seq 34560:34756, ack 1, win 501, length 196
23:06:10.457088 IP 142.93.146.161.ssh > bras-base-toroon2638w-grc-51-142-114-112-45.dsl.bell.ca.49727: Flags [P.], seq 34756:34952, ack 1, win 501, length 196
23:06:10.457149 IP 142.93.146.161.ssh > bras-base-toroon2638w-grc-51-142-114-112-45.dsl.bell.ca.49727: Flags [P.], seq 34952:35148, ack 1, win 501, length 196
23:06:10.457208 IP 142.93.146.161.ssh > bras-base-toroon2638w-grc-51-142-114-112-45.dsl.bell.ca.49727: Flags [P.], seq 35148:35344, ack 1, win 501, length 196
23:06:10.457267 IP 142.93.146.161.ssh > bras-base-toroon2638w-grc-51-142-114-112-45.dsl.bell.ca.49727: Flags [P.], seq 35344:35540, ack 1, win 501, length 196
23:06:10.457326 IP 142.93.146.161.ssh > bras-base-toroon2638w-grc-51-142-114-112-45.dsl.bell.ca.49727: Flags [P.], seq 35540:35736, ack 1, win 501, length 196
23:06:10.457392 IP 142.93.146.161.ssh > bras-base-toroon2638w-grc-51-142-114-112-45.dsl.bell.ca.49727: Flags [P.], seq 35736:35932, ack 1, win 501, length 196
23:06:10.457451 IP 142.93.146.161.ssh > bras-base-toroon2638w-grc-51-142-114-112-45.dsl.bell.ca.49727: Flags [P.], seq 35932:36128, ack 1, win 501, length 196
23:06:10.457514 IP 142.93.146.161.ssh > bras-base-toroon2638w-grc-51-142-114-112-45.dsl.bell.ca.49727: Flags [P.], seq 36128:36324, ack 1, win 501, length 196
23:06:10.457581 IP 142.93.146.161.ssh > bras-base-toroon2638w-grc-51-142-114-112-45.dsl.bell.ca.49727: Flags [P.], seq 36324:36520, ack 1, win 501, length 196
23:06:10.457642 IP 142.93.146.161.ssh > bras-base-toroon2638w-grc-51-142-114-112-45.dsl.bell.ca.49727: Flags [P.], seq 36520:36716, ack 1, win 501, length 196
23:06:10.457726 IP 142.93.146.161.ssh > bras-base-toroon2638w-grc-51-142-114-112-45.dsl.bell.ca.49727: Flags [P.], seq 36716:36912, ack 1, win 501, length 196
23:06:10.457797 IP 142.93.146.161.ssh > bras-base-toroon2638w-grc-51-142-114-112-45.dsl.bell.ca.49727: Flags [P.], seq 36912:37108, ack 1, win 501, length 196
23:06:10.457857 IP 142.93.146.161.ssh > bras-base-toroon2638w-grc-51-142-114-112-45.dsl.bell.ca.49727: Flags [P.], seq 37108:37304, ack 1, win 501, length 196
23:06:10.457883 IP bras-base-toroon2638w-grc-51-142-114-112-45.dsl.bell.ca.49727 > 142.93.146.161.ssh: Flags [.], ack 22880, win 2484, length 0
23:06:10.457965 IP 142.93.146.161.ssh > bras-base-toroon2638w-grc-51-142-114-112-45.dsl.bell.ca.49727: Flags [P.], seq 37304:37644, ack 1, win 501, length 340
23:06:10.458035 IP 142.93.146.161.ssh > bras-base-toroon2638w-grc-51-142-114-112-45.dsl.bell.ca.49727: Flags [P.], seq 37644:37840, ack 1, win 501, length 196
23:06:10.458111 IP 142.93.146.161.ssh > bras-base-toroon2638w-grc-51-142-114-112-45.dsl.bell.ca.49727: Flags [P.], seq 37840:38036, ack 1, win 501, length 196
23:06:10.458175 IP 142.93.146.161.ssh > bras-base-toroon2638w-grc-51-142-114-112-45.dsl.bell.ca.49727: Flags [P.], seq 38036:38232, ack 1, win 501, length 196
23:06:10.458235 IP 142.93.146.161.ssh > bras-base-toroon2638w-grc-51-142-114-112-45.dsl.bell.ca.49727: Flags [P.], seq 38232:38428, ack 1, win 501, length 196
23:06:10.458293 IP 142.93.146.161.ssh > bras-base-toroon2638w-grc-51-142-114-112-45.dsl.bell.ca.49727: Flags [P.], seq 38428:38624, ack 1, win 501, length 196
23:06:10.458349 IP 142.93.146.161.ssh > bras-base-toroon2638w-grc-51-142-114-112-45.dsl.bell.ca.49727: Flags [P.], seq 38624:38820, ack 1, win 501, length 196
23:06:10.458406 IP 142.93.146.161.ssh > bras-base-toroon2638w-grc-51-142-114-112-45.dsl.bell.ca.49727: Flags [P.], seq 38820:39016, ack 1, win 501, length 196
23:06:10.458462 IP 142.93.146.161.ssh > bras-base-toroon2638w-grc-51-142-114-112-45.dsl.bell.ca.49727: Flags [P.], seq 39016:39212, ack 1, win 501, length 196
23:06:10.458519 IP 142.93.146.161.ssh > bras-base-toroon2638w-grc-51-142-114-112-45.dsl.bell.ca.49727: Flags [P.], seq 39212:39408, ack 1, win 501, length 196
23:06:10.458578 IP 142.93.146.161.ssh > bras-base-toroon2638w-grc-51-142-114-112-45.dsl.bell.ca.49727: Flags [P.], seq 39408:39604, ack 1, win 501, length 196
23:06:10.458635 IP 142.93.146.161.ssh > bras-base-toroon2638w-grc-51-142-114-112-45.dsl.bell.ca.49727: Flags [P.], seq 39604:39800, ack 1, win 501, length 196
23:06:10.458692 IP 142.93.146.161.ssh > bras-base-toroon2638w-grc-51-142-114-112-45.dsl.bell.ca.49727: Flags [P.], seq 39800:39996, ack 1, win 501, length 196
23:06:10.458756 IP bras-base-toroon2638w-grc-51-142-114-112-45.dsl.bell.ca.49727 > 142.93.146.161.ssh: Flags [.], ack 28236, win 2484, length 0
23:06:10.458764 IP 142.93.146.161.ssh > bras-base-toroon2638w-grc-51-142-114-112-45.dsl.bell.ca.49727: Flags [P.], seq 39996:40192, ack 1, win 501, length 196
23:06:10.458835 IP 142.93.146.161.ssh > bras-base-toroon2638w-grc-51-142-114-112-45.dsl.bell.ca.49727: Flags [P.], seq 40192:40532, ack 1, win 501, length 340
23:06:10.458896 IP 142.93.146.161.ssh > bras-base-toroon2638w-grc-51-142-114-112-45.dsl.bell.ca.49727: Flags [P.], seq 40532:40728, ack 1, win 501, length 196
23:06:10.458955 IP 142.93.146.161.ssh > bras-base-toroon2638w-grc-51-142-114-112-45.dsl.bell.ca.49727: Flags [P.], seq 40728:40924, ack 1, win 501, length 196
23:06:10.459031 IP 142.93.146.161.ssh > bras-base-toroon2638w-grc-51-142-114-112-45.dsl.bell.ca.49727: Flags [P.], seq 40924:41120, ack 1, win 501, length 196
23:06:10.459095 IP 142.93.146.161.ssh > bras-base-toroon2638w-grc-51-142-114-112-45.dsl.bell.ca.49727: Flags [P.], seq 41120:41316, ack 1, win 501, length 196
23:06:10.459156 IP 142.93.146.161.ssh > bras-base-toroon2638w-grc-51-142-114-112-45.dsl.bell.ca.49727: Flags [P.], seq 41316:41512, ack 1, win 501, length 196
23:06:10.459212 IP 142.93.146.161.ssh > bras-base-toroon2638w-grc-51-142-114-112-45.dsl.bell.ca.49727: Flags [P.], seq 41512:41708, ack 1, win 501, length 196
23:06:10.459271 IP 142.93.146.161.ssh > bras-base-toroon2638w-grc-51-142-114-112-45.dsl.bell.ca.49727: Flags [P.], seq 41708:41904, ack 1, win 501, length 196
23:06:10.459345 IP 142.93.146.161.ssh > bras-base-toroon2638w-grc-51-142-114-112-45.dsl.bell.ca.49727: Flags [P.], seq 41904:42100, ack 1, win 501, length 196
23:06:10.459440 IP 142.93.146.161.ssh > bras-base-toroon2638w-grc-51-142-114-112-45.dsl.bell.ca.49727: Flags [P.], seq 42100:42296, ack 1, win 501, length 196
23:06:10.459501 IP 142.93.146.161.ssh > bras-base-toroon2638w-grc-51-142-114-112-45.dsl.bell.ca.49727: Flags [P.], seq 42296:42492, ack 1, win 501, length 196
23:06:10.459562 IP 142.93.146.161.ssh > bras-base-toroon2638w-grc-51-142-114-112-45.dsl.bell.ca.49727: Flags [P.], seq 42492:42688, ack 1, win 501, length 196
23:06:10.459633 IP 142.93.146.161.ssh > bras-base-toroon2638w-grc-51-142-114-112-45.dsl.bell.ca.49727: Flags [P.], seq 42688:42884, ack 1, win 501, length 196
23:06:10.459694 IP 142.93.146.161.ssh > bras-base-toroon2638w-grc-51-142-114-112-45.dsl.bell.ca.49727: Flags [P.], seq 42884:43080, ack 1, win 501, length 196
23:06:10.459752 IP 142.93.146.161.ssh > bras-base-toroon2638w-grc-51-142-114-112-45.dsl.bell.ca.49727: Flags [P.], seq 43080:43276, ack 1, win 501, length 196
23:06:10.459823 IP 142.93.146.161.ssh > bras-base-toroon2638w-grc-51-142-114-112-45.dsl.bell.ca.49727: Flags [P.], seq 43276:43472, ack 1, win 501, length 196
23:06:10.459880 IP bras-base-toroon2638w-grc-51-142-114-112-45.dsl.bell.ca.49727 > 142.93.146.161.ssh: Flags [.], ack 32316, win 2484, length 0
23:06:10.459924 IP 142.93.146.161.ssh > bras-base-toroon2638w-grc-51-142-114-112-45.dsl.bell.ca.49727: Flags [P.], seq 43472:43668, ack 1, win 501, length 196
23:06:10.459954 IP 142.93.146.161.ssh > bras-base-toroon2638w-grc-51-142-114-112-45.dsl.bell.ca.49727: Flags [P.], seq 43668:43848, ack 1, win 501, length 180
23:06:10.460005 IP bras-base-toroon2638w-grc-51-142-114-112-45.dsl.bell.ca.49727 > 142.93.146.161.ssh: Flags [.], ack 34952, win 2484, length 0
23:06:10.460054 IP 142.93.146.161.ssh > bras-base-toroon2638w-grc-51-142-114-112-45.dsl.bell.ca.49727: Flags [P.], seq 43848:44348, ack 1, win 501, length 500
23:06:10.460110 IP 142.93.146.161.ssh > bras-base-toroon2638w-grc-51-142-114-112-45.dsl.bell.ca.49727: Flags [P.], seq 44348:44544, ack 1, win 501, length 196
23:06:10.460164 IP 142.93.146.161.ssh > bras-base-toroon2638w-grc-51-142-114-112-45.dsl.bell.ca.49727: Flags [P.], seq 44544:44740, ack 1, win 501, length 196
23:06:10.460218 IP 142.93.146.161.ssh > bras-base-toroon2638w-grc-51-142-114-112-45.dsl.bell.ca.49727: Flags [P.], seq 44740:44936, ack 1, win 501, length 196
23:06:10.460275 IP 142.93.146.161.ssh > bras-base-toroon2638w-grc-51-142-114-112-45.dsl.bell.ca.49727: Flags [P.], seq 44936:45132, ack 1, win 501, length 196
23:06:10.460331 IP 142.93.146.161.ssh > bras-base-toroon2638w-grc-51-142-114-112-45.dsl.bell.ca.49727: Flags [P.], seq 45132:45328, ack 1, win 501, length 196
23:06:10.460383 IP 142.93.146.161.ssh > bras-base-toroon2638w-grc-51-142-114-112-45.dsl.bell.ca.49727: Flags [P.], seq 45328:45524, ack 1, win 501, length 196
23:06:10.460436 IP 142.93.146.161.ssh > bras-base-toroon2638w-grc-51-142-114-112-45.dsl.bell.ca.49727: Flags [P.], seq 45524:45720, ack 1, win 501, length 196
23:06:10.460489 IP 142.93.146.161.ssh > bras-base-toroon2638w-grc-51-142-114-112-45.dsl.bell.ca.49727: Flags [P.], seq 45720:45916, ack 1, win 501, length 196
23:06:10.460545 IP 142.93.146.161.ssh > bras-base-toroon2638w-grc-51-142-114-112-45.dsl.bell.ca.49727: Flags [P.], seq 45916:46112, ack 1, win 501, length 196
23:06:10.460598 IP 142.93.146.161.ssh > bras-base-toroon2638w-grc-51-142-114-112-45.dsl.bell.ca.49727: Flags [P.], seq 46112:46308, ack 1, win 501, length 196
23:06:10.460665 IP 142.93.146.161.ssh > bras-base-toroon2638w-grc-51-142-114-112-45.dsl.bell.ca.49727: Flags [P.], seq 46308:46504, ack 1, win 501, length 196
23:06:10.460737 IP 142.93.146.161.ssh > bras-base-toroon2638w-grc-51-142-114-112-45.dsl.bell.ca.49727: Flags [P.], seq 46504:46700, ack 1, win 501, length 196
23:06:10.460812 IP 142.93.146.161.ssh > bras-base-toroon2638w-grc-51-142-114-112-45.dsl.bell.ca.49727: Flags [P.], seq 46700:46896, ack 1, win 501, length 196
23:06:10.460902 IP 142.93.146.161.ssh > bras-base-toroon2638w-grc-51-142-114-112-45.dsl.bell.ca.49727: Flags [P.], seq 46896:47092, ack 1, win 501, length 196
23:06:10.460976 IP 142.93.146.161.ssh > bras-base-toroon2638w-grc-51-142-114-112-45.dsl.bell.ca.49727: Flags [P.], seq 47092:47288, ack 1, win 501, length 196
23:06:10.461034 IP 142.93.146.161.ssh > bras-base-toroon2638w-grc-51-142-114-112-45.dsl.bell.ca.49727: Flags [P.], seq 47288:47484, ack 1, win 501, length 196
23:06:10.461092 IP 142.93.146.161.ssh > bras-base-toroon2638w-grc-51-142-114-112-45.dsl.bell.ca.49727: Flags [P.], seq 47484:47680, ack 1, win 501, length 196
23:06:10.461146 IP 142.93.146.161.ssh > bras-base-toroon2638w-grc-51-142-114-112-45.dsl.bell.ca.49727: Flags [P.], seq 47680:47876, ack 1, win 501, length 196
23:06:10.461202 IP 142.93.146.161.ssh > bras-base-toroon2638w-grc-51-142-114-112-45.dsl.bell.ca.49727: Flags [P.], seq 47876:48072, ack 1, win 501, length 196
23:06:10.461279 IP 142.93.146.161.ssh > bras-base-toroon2638w-grc-51-142-114-112-45.dsl.bell.ca.49727: Flags [P.], seq 48072:48268, ack 1, win 501, length 196
23:06:10.461355 IP 142.93.146.161.ssh > bras-base-toroon2638w-grc-51-142-114-112-45.dsl.bell.ca.49727: Flags [P.], seq 48268:48464, ack 1, win 501, length 196
23:06:10.461381 IP bras-base-toroon2638w-grc-51-142-114-112-45.dsl.bell.ca.49727 > 142.93.146.161.ssh: Flags [.], ack 37108, win 2484, length 0
23:06:10.461447 IP 142.93.146.161.ssh > bras-base-toroon2638w-grc-51-142-114-112-45.dsl.bell.ca.49727: Flags [P.], seq 48464:48804, ack 1, win 501, length 340
23:06:10.461508 IP 142.93.146.161.ssh > bras-base-toroon2638w-grc-51-142-114-112-45.dsl.bell.ca.49727: Flags [P.], seq 48804:49000, ack 1, win 501, length 196
23:06:10.461567 IP 142.93.146.161.ssh > bras-base-toroon2638w-grc-51-142-114-112-45.dsl.bell.ca.49727: Flags [P.], seq 49000:49196, ack 1, win 501, length 196
23:06:10.461632 IP 142.93.146.161.ssh > bras-base-toroon2638w-grc-51-142-114-112-45.dsl.bell.ca.49727: Flags [P.], seq 49196:49392, ack 1, win 501, length 196
23:06:10.461697 IP 142.93.146.161.ssh > bras-base-toroon2638w-grc-51-142-114-112-45.dsl.bell.ca.49727: Flags [P.], seq 49392:49588, ack 1, win 501, length 196
23:06:10.461755 IP 142.93.146.161.ssh > bras-base-toroon2638w-grc-51-142-114-112-45.dsl.bell.ca.49727: Flags [P.], seq 49588:49784, ack 1, win 501, length 196
23:06:10.461813 IP 142.93.146.161.ssh > bras-base-toroon2638w-grc-51-142-114-112-45.dsl.bell.ca.49727: Flags [P.], seq 49784:49980, ack 1, win 501, length 196
23:06:10.461867 IP 142.93.146.161.ssh > bras-base-toroon2638w-grc-51-142-114-112-45.dsl.bell.ca.49727: Flags [P.], seq 49980:50176, ack 1, win 501, length 196
23:06:10.461925 IP 142.93.146.161.ssh > bras-base-toroon2638w-grc-51-142-114-112-45.dsl.bell.ca.49727: Flags [P.], seq 50176:50372, ack 1, win 501, length 196
23:06:10.462005 IP 142.93.146.161.ssh > bras-base-toroon2638w-grc-51-142-114-112-45.dsl.bell.ca.49727: Flags [P.], seq 50372:50568, ack 1, win 501, length 196
23:06:10.462078 IP 142.93.146.161.ssh > bras-base-toroon2638w-grc-51-142-114-112-45.dsl.bell.ca.49727: Flags [P.], seq 50568:50764, ack 1, win 501, length 196
23:06:10.462139 IP 142.93.146.161.ssh > bras-base-toroon2638w-grc-51-142-114-112-45.dsl.bell.ca.49727: Flags [P.], seq 50764:50960, ack 1, win 501, length 196
23:06:10.462193 IP 142.93.146.161.ssh > bras-base-toroon2638w-grc-51-142-114-112-45.dsl.bell.ca.49727: Flags [P.], seq 50960:51156, ack 1, win 501, length 196
23:06:10.462250 IP 142.93.146.161.ssh > bras-base-toroon2638w-grc-51-142-114-112-45.dsl.bell.ca.49727: Flags [P.], seq 51156:51352, ack 1, win 501, length 196
23:06:10.462305 IP 142.93.146.161.ssh > bras-base-toroon2638w-grc-51-142-114-112-45.dsl.bell.ca.49727: Flags [P.], seq 51352:51548, ack 1, win 501, length 196
23:06:10.462358 IP 142.93.146.161.ssh > bras-base-toroon2638w-grc-51-142-114-112-45.dsl.bell.ca.49727: Flags [P.], seq 51548:51744, ack 1, win 501, length 196
