root@lamp-ubuntu-s-1vcpu-1gb-tor1-01:~# tcpdump -i eth0
tcpdump: verbose output suppressed, use -v or -vv for full protocol decode
listening on eth0, link-type EN10MB (Ethernet), capture size 262144 bytes
22:48:43.690705 IP 142.93.146.161.ssh > bras-base-toroon2638w-grc-51-142-114-112-45.dsl.bell.ca.49727: Flags [P.], seq 523956827:523956935, ack 2132211271, win 501, length 108
22:48:43.690758 IP 142.93.146.161.ssh > bras-base-toroon2638w-grc-51-142-114-112-45.dsl.bell.ca.49727: Flags [P.], seq 108:144, ack 1, win 501, length 36
22:48:43.690809 IP 142.93.146.161.ssh > bras-base-toroon2638w-grc-51-142-114-112-45.dsl.bell.ca.49727: Flags [P.], seq 144:252, ack 1, win 501, length 108
22:48:43.690857 IP 142.93.146.161.ssh > bras-base-toroon2638w-grc-51-142-114-112-45.dsl.bell.ca.49727: Flags [P.], seq 252:288, ack 1, win 501, length 36
22:48:43.691250 IP 142.93.146.161.51402 > dns.google.domain: 45221+ PTR? 45.112.114.142.in-addr.arpa. (45)
22:48:43.694924 IP bras-base-toroon2638w-grc-51-142-114-112-45.dsl.bell.ca.49727 > 142.93.146.161.ssh: Flags [.], ack 288, win 512, length 0
22:48:43.700862 IP dns.google.domain > 142.93.146.161.51402: 45221 1/0/0 PTR bras-base-toroon2638w-grc-51-142-114-112-45.dsl.bell.ca. (114)
22:48:43.701039 IP 142.93.146.161.39935 > dns.google.domain: 60034+ PTR? 161.146.93.142.in-addr.arpa. (45)
22:48:43.708831 IP dns.google.domain > 142.93.146.161.39935: 60034 NXDomain 0/1/0 (112)
22:48:43.708984 IP 142.93.146.161.ssh > bras-base-toroon2638w-grc-51-142-114-112-45.dsl.bell.ca.49727: Flags [P.], seq 288:500, ack 1, win 501, length 212
22:48:43.709066 IP 142.93.146.161.ssh > bras-base-toroon2638w-grc-51-142-114-112-45.dsl.bell.ca.49727: Flags [P.], seq 500:536, ack 1, win 501, length 36
22:48:43.709104 IP 142.93.146.161.ssh > bras-base-toroon2638w-grc-51-142-114-112-45.dsl.bell.ca.49727: Flags [P.], seq 536:724, ack 1, win 501, length 188
22:48:43.709148 IP 142.93.146.161.ssh > bras-base-toroon2638w-grc-51-142-114-112-45.dsl.bell.ca.49727: Flags [P.], seq 724:760, ack 1, win 501, length 36
22:48:43.709203 IP 142.93.146.161.ssh > bras-base-toroon2638w-grc-51-142-114-112-45.dsl.bell.ca.49727: Flags [P.], seq 760:948, ack 1, win 501, length 188
22:48:43.709243 IP 142.93.146.161.ssh > bras-base-toroon2638w-grc-51-142-114-112-45.dsl.bell.ca.49727: Flags [P.], seq 948:984, ack 1, win 501, length 36
22:48:43.709294 IP 142.93.146.161.ssh > bras-base-toroon2638w-grc-51-142-114-112-45.dsl.bell.ca.49727: Flags [P.], seq 984:1172, ack 1, win 501, length 188
22:48:43.709334 IP 142.93.146.161.ssh > bras-base-toroon2638w-grc-51-142-114-112-45.dsl.bell.ca.49727: Flags [P.], seq 1172:1208, ack 1, win 501, length 36
22:48:43.709428 IP 142.93.146.161.59342 > dns.google.domain: 9327+ PTR? 8.8.8.8.in-addr.arpa. (38)
22:48:43.710001 IP dns.google.domain > 142.93.146.161.59342: 9327 1/0/0 PTR dns.google. (62)
22:48:43.710092 IP 142.93.146.161.ssh > bras-base-toroon2638w-grc-51-142-114-112-45.dsl.bell.ca.49727: Flags [P.], seq 1208:1348, ack 1, win 501, length 140
22:48:43.710139 IP 142.93.146.161.ssh > bras-base-toroon2638w-grc-51-142-114-112-45.dsl.bell.ca.49727: Flags [P.], seq 1348:1384, ack 1, win 501, length 36
22:48:43.715339 IP bras-base-toroon2638w-grc-51-142-114-112-45.dsl.bell.ca.49727 > 142.93.146.161.ssh: Flags [.], ack 1384, win 516, length 0
22:48:43.715384 IP 142.93.146.161.ssh > bras-base-toroon2638w-grc-51-142-114-112-45.dsl.bell.ca.49727: Flags [P.], seq 1384:4288, ack 1, win 501, length 2904
22:48:43.715423 IP 142.93.146.161.ssh > bras-base-toroon2638w-grc-51-142-114-112-45.dsl.bell.ca.49727: Flags [P.], seq 4288:4760, ack 1, win 501, length 472
22:48:43.715486 IP 142.93.146.161.ssh > bras-base-toroon2638w-grc-51-142-114-112-45.dsl.bell.ca.49727: Flags [P.], seq 4760:4940, ack 1, win 501, length 180
22:48:43.715530 IP 142.93.146.161.ssh > bras-base-toroon2638w-grc-51-142-114-112-45.dsl.bell.ca.49727: Flags [P.], seq 4940:4976, ack 1, win 501, length 36
22:48:43.715582 IP 142.93.146.161.ssh > bras-base-toroon2638w-grc-51-142-114-112-45.dsl.bell.ca.49727: Flags [P.], seq 4976:5172, ack 1, win 501, length 196
22:48:43.715642 IP 142.93.146.161.ssh > bras-base-toroon2638w-grc-51-142-114-112-45.dsl.bell.ca.49727: Flags [P.], seq 5172:5404, ack 1, win 501, length 232
22:48:43.715676 IP 142.93.146.161.ssh > bras-base-toroon2638w-grc-51-142-114-112-45.dsl.bell.ca.49727: Flags [P.], seq 5404:5440, ack 1, win 501, length 36
22:48:43.715726 IP 142.93.146.161.ssh > bras-base-toroon2638w-grc-51-142-114-112-45.dsl.bell.ca.49727: Flags [P.], seq 5440:5636, ack 1, win 501, length 196
22:48:43.715776 IP 142.93.146.161.ssh > bras-base-toroon2638w-grc-51-142-114-112-45.dsl.bell.ca.49727: Flags [P.], seq 5636:5672, ack 1, win 501, length 36
22:48:43.715837 IP 142.93.146.161.ssh > bras-base-toroon2638w-grc-51-142-114-112-45.dsl.bell.ca.49727: Flags [P.], seq 5672:5868, ack 1, win 501, length 196
22:48:43.715882 IP 142.93.146.161.ssh > bras-base-toroon2638w-grc-51-142-114-112-45.dsl.bell.ca.49727: Flags [P.], seq 5868:5904, ack 1, win 501, length 36
22:48:43.715933 IP 142.93.146.161.ssh > bras-base-toroon2638w-grc-51-142-114-112-45.dsl.bell.ca.49727: Flags [P.], seq 5904:6100, ack 1, win 501, length 196
22:48:43.715971 IP 142.93.146.161.ssh > bras-base-toroon2638w-grc-51-142-114-112-45.dsl.bell.ca.49727: Flags [P.], seq 6100:6136, ack 1, win 501, length 36
22:48:43.716018 IP 142.93.146.161.ssh > bras-base-toroon2638w-grc-51-142-114-112-45.dsl.bell.ca.49727: Flags [P.], seq 6136:6332, ack 1, win 501, length 196
22:48:43.716061 IP 142.93.146.161.ssh > bras-base-toroon2638w-grc-51-142-114-112-45.dsl.bell.ca.49727: Flags [P.], seq 6332:6368, ack 1, win 501, length 36
22:48:43.716120 IP 142.93.146.161.ssh > bras-base-toroon2638w-grc-51-142-114-112-45.dsl.bell.ca.49727: Flags [P.], seq 6368:6564, ack 1, win 501, length 196
22:48:43.716172 IP 142.93.146.161.ssh > bras-base-toroon2638w-grc-51-142-114-112-45.dsl.bell.ca.49727: Flags [P.], seq 6564:6600, ack 1, win 501, length 36
22:48:43.716223 IP 142.93.146.161.ssh > bras-base-toroon2638w-grc-51-142-114-112-45.dsl.bell.ca.49727: Flags [P.], seq 6600:6796, ack 1, win 501, length 196
22:48:43.716262 IP 142.93.146.161.ssh > bras-base-toroon2638w-grc-51-142-114-112-45.dsl.bell.ca.49727: Flags [P.], seq 6796:6832, ack 1, win 501, length 36
22:48:43.724558 IP bras-base-toroon2638w-grc-51-142-114-112-45.dsl.bell.ca.49727 > 142.93.146.161.ssh: Flags [.], ack 1384, win 516, options [nop,nop,sack 1 {2836:4288}], length 0
22:48:43.724583 IP 142.93.146.161.ssh > bras-base-toroon2638w-grc-51-142-114-112-45.dsl.bell.ca.49727: Flags [P.], seq 6832:9384, ack 1, win 501, length 2552
22:48:43.724598 IP bras-base-toroon2638w-grc-51-142-114-112-45.dsl.bell.ca.49727 > 142.93.146.161.ssh: Flags [.], ack 4288, win 516, length 0
22:48:43.724607 IP bras-base-toroon2638w-grc-51-142-114-112-45.dsl.bell.ca.49727 > 142.93.146.161.ssh: Flags [.], ack 6332, win 516, length 0
22:48:43.724663 IP bras-base-toroon2638w-grc-51-142-114-112-45.dsl.bell.ca.49727 > 142.93.146.161.ssh: Flags [.], ack 6832, win 514, length 0
22:48:43.724708 IP 142.93.146.161.ssh > bras-base-toroon2638w-grc-51-142-114-112-45.dsl.bell.ca.49727: Flags [P.], seq 9384:9604, ack 1, win 501, length 220
22:48:43.724757 IP 142.93.146.161.ssh > bras-base-toroon2638w-grc-51-142-114-112-45.dsl.bell.ca.49727: Flags [P.], seq 9604:9640, ack 1, win 501, length 36
22:48:43.724813 IP 142.93.146.161.ssh > bras-base-toroon2638w-grc-51-142-114-112-45.dsl.bell.ca.49727: Flags [P.], seq 9640:9836, ack 1, win 501, length 196
22:48:43.724869 IP 142.93.146.161.ssh > bras-base-toroon2638w-grc-51-142-114-112-45.dsl.bell.ca.49727: Flags [P.], seq 9836:9872, ack 1, win 501, length 36
22:48:43.724921 IP 142.93.146.161.ssh > bras-base-toroon2638w-grc-51-142-114-112-45.dsl.bell.ca.49727: Flags [P.], seq 9872:10052, ack 1, win 501, length 180
22:48:43.724975 IP 142.93.146.161.ssh > bras-base-toroon2638w-grc-51-142-114-112-45.dsl.bell.ca.49727: Flags [P.], seq 10052:10088, ack 1, win 501, length 36
22:48:43.725027 IP 142.93.146.161.ssh > bras-base-toroon2638w-grc-51-142-114-112-45.dsl.bell.ca.49727: Flags [P.], seq 10088:10268, ack 1, win 501, length 180
22:48:43.725084 IP 142.93.146.161.ssh > bras-base-toroon2638w-grc-51-142-114-112-45.dsl.bell.ca.49727: Flags [P.], seq 10268:10484, ack 1, win 501, length 216
22:48:43.725124 IP 142.93.146.161.ssh > bras-base-toroon2638w-grc-51-142-114-112-45.dsl.bell.ca.49727: Flags [P.], seq 10484:10520, ack 1, win 501, length 36
22:48:43.725173 IP 142.93.146.161.ssh > bras-base-toroon2638w-grc-51-142-114-112-45.dsl.bell.ca.49727: Flags [P.], seq 10520:10716, ack 1, win 501, length 196
22:48:43.725212 IP 142.93.146.161.ssh > bras-base-toroon2638w-grc-51-142-114-112-45.dsl.bell.ca.49727: Flags [P.], seq 10716:10752, ack 1, win 501, length 36
22:48:43.725261 IP 142.93.146.161.ssh > bras-base-toroon2638w-grc-51-142-114-112-45.dsl.bell.ca.49727: Flags [P.], seq 10752:10948, ack 1, win 501, length 196
22:48:43.725300 IP 142.93.146.161.ssh > bras-base-toroon2638w-grc-51-142-114-112-45.dsl.bell.ca.49727: Flags [P.], seq 10948:10984, ack 1, win 501, length 36
22:48:43.725347 IP 142.93.146.161.ssh > bras-base-toroon2638w-grc-51-142-114-112-45.dsl.bell.ca.49727: Flags [P.], seq 10984:11180, ack 1, win 501, length 196
22:48:43.725386 IP 142.93.146.161.ssh > bras-base-toroon2638w-grc-51-142-114-112-45.dsl.bell.ca.49727: Flags [P.], seq 11180:11216, ack 1, win 501, length 36
22:48:43.725433 IP 142.93.146.161.ssh > bras-base-toroon2638w-grc-51-142-114-112-45.dsl.bell.ca.49727: Flags [P.], seq 11216:11412, ack 1, win 501, length 196
22:48:43.725481 IP 142.93.146.161.ssh > bras-base-toroon2638w-grc-51-142-114-112-45.dsl.bell.ca.49727: Flags [P.], seq 11412:11448, ack 1, win 501, length 36
22:48:43.725528 IP 142.93.146.161.ssh > bras-base-toroon2638w-grc-51-142-114-112-45.dsl.bell.ca.49727: Flags [P.], seq 11448:11644, ack 1, win 501, length 196
22:48:43.725568 IP 142.93.146.161.ssh > bras-base-toroon2638w-grc-51-142-114-112-45.dsl.bell.ca.49727: Flags [P.], seq 11644:11680, ack 1, win 501, length 36
22:48:43.725616 IP 142.93.146.161.ssh > bras-base-toroon2638w-grc-51-142-114-112-45.dsl.bell.ca.49727: Flags [P.], seq 11680:11876, ack 1, win 501, length 196
22:48:43.725664 IP 142.93.146.161.ssh > bras-base-toroon2638w-grc-51-142-114-112-45.dsl.bell.ca.49727: Flags [P.], seq 11876:11912, ack 1, win 501, length 36
22:48:43.725712 IP 142.93.146.161.ssh > bras-base-toroon2638w-grc-51-142-114-112-45.dsl.bell.ca.49727: Flags [P.], seq 11912:12108, ack 1, win 501, length 196
22:48:43.725750 IP 142.93.146.161.ssh > bras-base-toroon2638w-grc-51-142-114-112-45.dsl.bell.ca.49727: Flags [P.], seq 12108:12144, ack 1, win 501, length 36
22:48:43.725807 IP 142.93.146.161.ssh > bras-base-toroon2638w-grc-51-142-114-112-45.dsl.bell.ca.49727: Flags [P.], seq 12144:12340, ack 1, win 501, length 196
22:48:43.725845 IP 142.93.146.161.ssh > bras-base-toroon2638w-grc-51-142-114-112-45.dsl.bell.ca.49727: Flags [P.], seq 12340:12376, ack 1, win 501, length 36
22:48:43.725915 IP 142.93.146.161.ssh > bras-base-toroon2638w-grc-51-142-114-112-45.dsl.bell.ca.49727: Flags [P.], seq 12376:12572, ack 1, win 501, length 196
22:48:43.725979 IP 142.93.146.161.ssh > bras-base-toroon2638w-grc-51-142-114-112-45.dsl.bell.ca.49727: Flags [P.], seq 12572:12608, ack 1, win 501, length 36
22:48:43.726052 IP 142.93.146.161.ssh > bras-base-toroon2638w-grc-51-142-114-112-45.dsl.bell.ca.49727: Flags [P.], seq 12608:12804, ack 1, win 501, length 196
22:48:43.726090 IP 142.93.146.161.ssh > bras-base-toroon2638w-grc-51-142-114-112-45.dsl.bell.ca.49727: Flags [P.], seq 12804:12840, ack 1, win 501, length 36
22:48:43.726139 IP 142.93.146.161.ssh > bras-base-toroon2638w-grc-51-142-114-112-45.dsl.bell.ca.49727: Flags [P.], seq 12840:13036, ack 1, win 501, length 196
22:48:43.726178 IP 142.93.146.161.ssh > bras-base-toroon2638w-grc-51-142-114-112-45.dsl.bell.ca.49727: Flags [P.], seq 13036:13072, ack 1, win 501, length 36
22:48:43.726226 IP 142.93.146.161.ssh > bras-base-toroon2638w-grc-51-142-114-112-45.dsl.bell.ca.49727: Flags [P.], seq 13072:13268, ack 1, win 501, length 196
22:48:43.726264 IP 142.93.146.161.ssh > bras-base-toroon2638w-grc-51-142-114-112-45.dsl.bell.ca.49727: Flags [P.], seq 13268:13304, ack 1, win 501, length 36
22:48:43.726311 IP 142.93.146.161.ssh > bras-base-toroon2638w-grc-51-142-114-112-45.dsl.bell.ca.49727: Flags [P.], seq 13304:13500, ack 1, win 501, length 196
22:48:43.726349 IP 142.93.146.161.ssh > bras-base-toroon2638w-grc-51-142-114-112-45.dsl.bell.ca.49727: Flags [P.], seq 13500:13536, ack 1, win 501, length 36
22:48:43.726397 IP 142.93.146.161.ssh > bras-base-toroon2638w-grc-51-142-114-112-45.dsl.bell.ca.49727: Flags [P.], seq 13536:13732, ack 1, win 501, length 196
22:48:43.726435 IP 142.93.146.161.ssh > bras-base-toroon2638w-grc-51-142-114-112-45.dsl.bell.ca.49727: Flags [P.], seq 13732:13768, ack 1, win 501, length 36
22:48:43.726482 IP 142.93.146.161.ssh > bras-base-toroon2638w-grc-51-142-114-112-45.dsl.bell.ca.49727: Flags [P.], seq 13768:13964, ack 1, win 501, length 196
22:48:43.729192 IP bras-base-toroon2638w-grc-51-142-114-112-45.dsl.bell.ca.49727 > 142.93.146.161.ssh: Flags [.], ack 11876, win 516, length 0
22:48:43.729222 IP 142.93.146.161.ssh > bras-base-toroon2638w-grc-51-142-114-112-45.dsl.bell.ca.49727: Flags [P.], seq 13964:19336, ack 1, win 501, length 5372
22:48:43.729317 IP 142.93.146.161.ssh > bras-base-toroon2638w-grc-51-142-114-112-45.dsl.bell.ca.49727: Flags [P.], seq 19336:19516, ack 1, win 501, length 180
22:48:43.729365 IP 142.93.146.161.ssh > bras-base-toroon2638w-grc-51-142-114-112-45.dsl.bell.ca.49727: Flags [P.], seq 19516:19552, ack 1, win 501, length 36
22:48:43.729422 IP 142.93.146.161.ssh > bras-base-toroon2638w-grc-51-142-114-112-45.dsl.bell.ca.49727: Flags [P.], seq 19552:19748, ack 1, win 501, length 196
22:48:43.729461 IP 142.93.146.161.ssh > bras-base-toroon2638w-grc-51-142-114-112-45.dsl.bell.ca.49727: Flags [P.], seq 19748:19784, ack 1, win 501, length 36
22:48:43.729511 IP 142.93.146.161.ssh > bras-base-toroon2638w-grc-51-142-114-112-45.dsl.bell.ca.49727: Flags [P.], seq 19784:19980, ack 1, win 501, length 196
22:48:43.729549 IP 142.93.146.161.ssh > bras-base-toroon2638w-grc-51-142-114-112-45.dsl.bell.ca.49727: Flags [P.], seq 19980:20016, ack 1, win 501, length 36
22:48:43.729599 IP 142.93.146.161.ssh > bras-base-toroon2638w-grc-51-142-114-112-45.dsl.bell.ca.49727: Flags [P.], seq 20016:20212, ack 1, win 501, length 196
22:48:43.729638 IP 142.93.146.161.ssh > bras-base-toroon2638w-grc-51-142-114-112-45.dsl.bell.ca.49727: Flags [P.], seq 20212:20248, ack 1, win 501, length 36
22:48:43.729685 IP 142.93.146.161.ssh > bras-base-toroon2638w-grc-51-142-114-112-45.dsl.bell.ca.49727: Flags [P.], seq 20248:20444, ack 1, win 501, length 196
22:48:43.729724 IP 142.93.146.161.ssh > bras-base-toroon2638w-grc-51-142-114-112-45.dsl.bell.ca.49727: Flags [P.], seq 20444:20480, ack 1, win 501, length 36
22:48:43.729772 IP 142.93.146.161.ssh > bras-base-toroon2638w-grc-51-142-114-112-45.dsl.bell.ca.49727: Flags [P.], seq 20480:20676, ack 1, win 501, length 196
22:48:43.729811 IP 142.93.146.161.ssh > bras-base-toroon2638w-grc-51-142-114-112-45.dsl.bell.ca.49727: Flags [P.], seq 20676:20712, ack 1, win 501, length 36
22:48:43.729858 IP 142.93.146.161.ssh > bras-base-toroon2638w-grc-51-142-114-112-45.dsl.bell.ca.49727: Flags [P.], seq 20712:20908, ack 1, win 501, length 196
22:48:43.729896 IP 142.93.146.161.ssh > bras-base-toroon2638w-grc-51-142-114-112-45.dsl.bell.ca.49727: Flags [P.], seq 20908:20944, ack 1, win 501, length 36
22:48:43.729954 IP bras-base-toroon2638w-grc-51-142-114-112-45.dsl.bell.ca.49727 > 142.93.146.161.ssh: Flags [.], ack 13964, win 516, length 0
22:48:43.729987 IP 142.93.146.161.ssh > bras-base-toroon2638w-grc-51-142-114-112-45.dsl.bell.ca.49727: Flags [P.], seq 20944:21140, ack 1, win 501, length 196
22:48:43.730036 IP 142.93.146.161.ssh > bras-base-toroon2638w-grc-51-142-114-112-45.dsl.bell.ca.49727: Flags [P.], seq 21140:21176, ack 1, win 501, length 36
22:48:43.730088 IP 142.93.146.161.ssh > bras-base-toroon2638w-grc-51-142-114-112-45.dsl.bell.ca.49727: Flags [P.], seq 21176:21372, ack 1, win 501, length 196
22:48:43.730127 IP 142.93.146.161.ssh > bras-base-toroon2638w-grc-51-142-114-112-45.dsl.bell.ca.49727: Flags [P.], seq 21372:21408, ack 1, win 501, length 36
22:48:43.730174 IP 142.93.146.161.ssh > bras-base-toroon2638w-grc-51-142-114-112-45.dsl.bell.ca.49727: Flags [P.], seq 21408:21604, ack 1, win 501, length 196
22:48:43.730211 IP 142.93.146.161.ssh > bras-base-toroon2638w-grc-51-142-114-112-45.dsl.bell.ca.49727: Flags [P.], seq 21604:21640, ack 1, win 501, length 36
22:48:43.730257 IP 142.93.146.161.ssh > bras-base-toroon2638w-grc-51-142-114-112-45.dsl.bell.ca.49727: Flags [P.], seq 21640:21836, ack 1, win 501, length 196
22:48:43.730293 IP 142.93.146.161.ssh > bras-base-toroon2638w-grc-51-142-114-112-45.dsl.bell.ca.49727: Flags [P.], seq 21836:21872, ack 1, win 501, length 36
22:48:43.730339 IP 142.93.146.161.ssh > bras-base-toroon2638w-grc-51-142-114-112-45.dsl.bell.ca.49727: Flags [P.], seq 21872:22068, ack 1, win 501, length 196
22:48:43.730376 IP 142.93.146.161.ssh > bras-base-toroon2638w-grc-51-142-114-112-45.dsl.bell.ca.49727: Flags [P.], seq 22068:22104, ack 1, win 501, length 36
22:48:43.730422 IP 142.93.146.161.ssh > bras-base-toroon2638w-grc-51-142-114-112-45.dsl.bell.ca.49727: Flags [P.], seq 22104:22300, ack 1, win 501, length 196
22:48:43.730475 IP 142.93.146.161.ssh > bras-base-toroon2638w-grc-51-142-114-112-45.dsl.bell.ca.49727: Flags [P.], seq 22300:22336, ack 1, win 501, length 36
22:48:43.730523 IP 142.93.146.161.ssh > bras-base-toroon2638w-grc-51-142-114-112-45.dsl.bell.ca.49727: Flags [P.], seq 22336:22532, ack 1, win 501, length 196
22:48:43.730561 IP 142.93.146.161.ssh > bras-base-toroon2638w-grc-51-142-114-112-45.dsl.bell.ca.49727: Flags [P.], seq 22532:22568, ack 1, win 501, length 36
22:48:43.730610 IP 142.93.146.161.ssh > bras-base-toroon2638w-grc-51-142-114-112-45.dsl.bell.ca.49727: Flags [P.], seq 22568:22764, ack 1, win 501, length 196
22:48:43.730681 IP 142.93.146.161.ssh > bras-base-toroon2638w-grc-51-142-114-112-45.dsl.bell.ca.49727: Flags [P.], seq 22764:22800, ack 1, win 501, length 36
22:48:43.730746 IP 142.93.146.161.ssh > bras-base-toroon2638w-grc-51-142-114-112-45.dsl.bell.ca.49727: Flags [P.], seq 22800:22996, ack 1, win 501, length 196
22:48:43.730785 IP 142.93.146.161.ssh > bras-base-toroon2638w-grc-51-142-114-112-45.dsl.bell.ca.49727: Flags [P.], seq 22996:23032, ack 1, win 501, length 36
22:48:43.730855 IP 142.93.146.161.ssh > bras-base-toroon2638w-grc-51-142-114-112-45.dsl.bell.ca.49727: Flags [P.], seq 23032:23212, ack 1, win 501, length 180
22:48:43.730915 IP 142.93.146.161.ssh > bras-base-toroon2638w-grc-51-142-114-112-45.dsl.bell.ca.49727: Flags [P.], seq 23212:23248, ack 1, win 501, length 36
22:48:43.730967 IP 142.93.146.161.ssh > bras-base-toroon2638w-grc-51-142-114-112-45.dsl.bell.ca.49727: Flags [P.], seq 23248:23444, ack 1, win 501, length 196
22:48:43.731007 IP 142.93.146.161.ssh > bras-base-toroon2638w-grc-51-142-114-112-45.dsl.bell.ca.49727: Flags [P.], seq 23444:23480, ack 1, win 501, length 36
22:48:43.731055 IP 142.93.146.161.ssh > bras-base-toroon2638w-grc-51-142-114-112-45.dsl.bell.ca.49727: Flags [P.], seq 23480:23676, ack 1, win 501, length 196
22:48:43.731119 IP 142.93.146.161.ssh > bras-base-toroon2638w-grc-51-142-114-112-45.dsl.bell.ca.49727: Flags [P.], seq 23676:23712, ack 1, win 501, length 36
22:48:43.731170 IP 142.93.146.161.ssh > bras-base-toroon2638w-grc-51-142-114-112-45.dsl.bell.ca.49727: Flags [P.], seq 23712:23908, ack 1, win 501, length 196
22:48:43.731207 IP 142.93.146.161.ssh > bras-base-toroon2638w-grc-51-142-114-112-45.dsl.bell.ca.49727: Flags [P.], seq 23908:23944, ack 1, win 501, length 36
22:48:43.731256 IP 142.93.146.161.ssh > bras-base-toroon2638w-grc-51-142-114-112-45.dsl.bell.ca.49727: Flags [P.], seq 23944:24140, ack 1, win 501, length 196
22:48:43.731293 IP 142.93.146.161.ssh > bras-base-toroon2638w-grc-51-142-114-112-45.dsl.bell.ca.49727: Flags [P.], seq 24140:24176, ack 1, win 501, length 36
22:48:43.731341 IP 142.93.146.161.ssh > bras-base-toroon2638w-grc-51-142-114-112-45.dsl.bell.ca.49727: Flags [P.], seq 24176:24372, ack 1, win 501, length 196
22:48:43.731390 IP 142.93.146.161.ssh > bras-base-toroon2638w-grc-51-142-114-112-45.dsl.bell.ca.49727: Flags [P.], seq 24372:24408, ack 1, win 501, length 36
22:48:43.731438 IP 142.93.146.161.ssh > bras-base-toroon2638w-grc-51-142-114-112-45.dsl.bell.ca.49727: Flags [P.], seq 24408:24604, ack 1, win 501, length 196
22:48:43.731477 IP 142.93.146.161.ssh > bras-base-toroon2638w-grc-51-142-114-112-45.dsl.bell.ca.49727: Flags [P.], seq 24604:24640, ack 1, win 501, length 36
22:48:43.731525 IP 142.93.146.161.ssh > bras-base-toroon2638w-grc-51-142-114-112-45.dsl.bell.ca.49727: Flags [P.], seq 24640:24836, ack 1, win 501, length 196
22:48:43.731563 IP 142.93.146.161.ssh > bras-base-toroon2638w-grc-51-142-114-112-45.dsl.bell.ca.49727: Flags [P.], seq 24836:24872, ack 1, win 501, length 36
22:48:43.731616 IP 142.93.146.161.ssh > bras-base-toroon2638w-grc-51-142-114-112-45.dsl.bell.ca.49727: Flags [P.], seq 24872:25068, ack 1, win 501, length 196
22:48:43.731690 IP 142.93.146.161.ssh > bras-base-toroon2638w-grc-51-142-114-112-45.dsl.bell.ca.49727: Flags [P.], seq 25068:25104, ack 1, win 501, length 36
22:48:43.731745 IP 142.93.146.161.ssh > bras-base-toroon2638w-grc-51-142-114-112-45.dsl.bell.ca.49727: Flags [P.], seq 25104:25300, ack 1, win 501, length 196
22:48:43.731784 IP 142.93.146.161.ssh > bras-base-toroon2638w-grc-51-142-114-112-45.dsl.bell.ca.49727: Flags [P.], seq 25300:25336, ack 1, win 501, length 36
22:48:43.731829 IP 142.93.146.161.ssh > bras-base-toroon2638w-grc-51-142-114-112-45.dsl.bell.ca.49727: Flags [P.], seq 25336:25532, ack 1, win 501, length 196
22:48:43.731882 IP 142.93.146.161.ssh > bras-base-toroon2638w-grc-51-142-114-112-45.dsl.bell.ca.49727: Flags [P.], seq 25532:25728, ack 1, win 501, length 196
22:48:43.731933 IP 142.93.146.161.ssh > bras-base-toroon2638w-grc-51-142-114-112-45.dsl.bell.ca.49727: Flags [P.], seq 25728:25924, ack 1, win 501, length 196
22:48:43.732032 IP 142.93.146.161.ssh > bras-base-toroon2638w-grc-51-142-114-112-45.dsl.bell.ca.49727: Flags [P.], seq 25924:26920, ack 1, win 501, length 996
22:48:43.732116 IP 142.93.146.161.ssh > bras-base-toroon2638w-grc-51-142-114-112-45.dsl.bell.ca.49727: Flags [P.], seq 26920:27756, ack 1, win 501, length 836
22:48:43.732193 IP 142.93.146.161.ssh > bras-base-toroon2638w-grc-51-142-114-112-45.dsl.bell.ca.49727: Flags [P.], seq 27756:28432, ack 1, win 501, length 676
22:48:43.732269 IP 142.93.146.161.ssh > bras-base-toroon2638w-grc-51-142-114-112-45.dsl.bell.ca.49727: Flags [P.], seq 28432:29108, ack 1, win 501, length 676
22:48:43.732345 IP 142.93.146.161.ssh > bras-base-toroon2638w-grc-51-142-114-112-45.dsl.bell.ca.49727: Flags [P.], seq 29108:29784, ack 1, win 501, length 676
22:48:43.732421 IP 142.93.146.161.ssh > bras-base-toroon2638w-grc-51-142-114-112-45.dsl.bell.ca.49727: Flags [P.], seq 29784:30460, ack 1, win 501, length 676
22:48:43.732497 IP 142.93.146.161.ssh > bras-base-toroon2638w-grc-51-142-114-112-45.dsl.bell.ca.49727: Flags [P.], seq 30460:31136, ack 1, win 501, length 676
22:48:43.732575 IP 142.93.146.161.ssh > bras-base-toroon2638w-grc-51-142-114-112-45.dsl.bell.ca.49727: Flags [P.], seq 31136:31812, ack 1, win 501, length 676
22:48:43.732644 IP 142.93.146.161.ssh > bras-base-toroon2638w-grc-51-142-114-112-45.dsl.bell.ca.49727: Flags [P.], seq 31812:32168, ack 1, win 501, length 356
22:48:43.732702 IP 142.93.146.161.ssh > bras-base-toroon2638w-grc-51-142-114-112-45.dsl.bell.ca.49727: Flags [P.], seq 32168:32364, ack 1, win 501, length 196
22:48:43.732758 IP 142.93.146.161.ssh > bras-base-toroon2638w-grc-51-142-114-112-45.dsl.bell.ca.49727: Flags [P.], seq 32364:32560, ack 1, win 501, length 196
22:48:43.732814 IP 142.93.146.161.ssh > bras-base-toroon2638w-grc-51-142-114-112-45.dsl.bell.ca.49727: Flags [P.], seq 32560:32756, ack 1, win 501, length 196
22:48:43.732890 IP 142.93.146.161.ssh > bras-base-toroon2638w-grc-51-142-114-112-45.dsl.bell.ca.49727: Flags [P.], seq 32756:32952, ack 1, win 501, length 196
22:48:43.732967 IP 142.93.146.161.ssh > bras-base-toroon2638w-grc-51-142-114-112-45.dsl.bell.ca.49727: Flags [P.], seq 32952:33148, ack 1, win 501, length 196
22:48:43.733052 IP 142.93.146.161.ssh > bras-base-toroon2638w-grc-51-142-114-112-45.dsl.bell.ca.49727: Flags [P.], seq 33148:33344, ack 1, win 501, length 196
22:48:43.733112 IP 142.93.146.161.ssh > bras-base-toroon2638w-grc-51-142-114-112-45.dsl.bell.ca.49727: Flags [P.], seq 33344:33540, ack 1, win 501, length 196
22:48:43.733167 IP 142.93.146.161.ssh > bras-base-toroon2638w-grc-51-142-114-112-45.dsl.bell.ca.49727: Flags [P.], seq 33540:33736, ack 1, win 501, length 196
22:48:43.733289 IP 142.93.146.161.ssh > bras-base-toroon2638w-grc-51-142-114-112-45.dsl.bell.ca.49727: Flags [P.], seq 33736:33932, ack 1, win 501, length 196
22:48:43.733357 IP 142.93.146.161.ssh > bras-base-toroon2638w-grc-51-142-114-112-45.dsl.bell.ca.49727: Flags [P.], seq 33932:34128, ack 1, win 501, length 196
22:48:43.733413 IP 142.93.146.161.ssh > bras-base-toroon2638w-grc-51-142-114-112-45.dsl.bell.ca.49727: Flags [P.], seq 34128:34324, ack 1, win 501, length 196
22:48:43.733471 IP 142.93.146.161.ssh > bras-base-toroon2638w-grc-51-142-114-112-45.dsl.bell.ca.49727: Flags [P.], seq 34324:34520, ack 1, win 501, length 196
22:48:43.734357 IP bras-base-toroon2638w-grc-51-142-114-112-45.dsl.bell.ca.49727 > 142.93.146.161.ssh: Flags [.], ack 15416, win 516, options [nop,nop,sack 1 {16868:18320}], length 0
22:48:43.734382 IP 142.93.146.161.ssh > bras-base-toroon2638w-grc-51-142-114-112-45.dsl.bell.ca.49727: Flags [P.], seq 34520:34716, ack 1, win 501, length 196
22:48:43.734395 IP bras-base-toroon2638w-grc-51-142-114-112-45.dsl.bell.ca.49727 > 142.93.146.161.ssh: Flags [.], ack 18320, win 516, length 0
22:48:43.734401 IP bras-base-toroon2638w-grc-51-142-114-112-45.dsl.bell.ca.49727 > 142.93.146.161.ssh: Flags [.], ack 21176, win 516, length 0
22:48:43.734540 IP 142.93.146.161.ssh > bras-base-toroon2638w-grc-51-142-114-112-45.dsl.bell.ca.49727: Flags [P.], seq 34716:35384, ack 1, win 501, length 668
22:48:43.734604 IP 142.93.146.161.ssh > bras-base-toroon2638w-grc-51-142-114-112-45.dsl.bell.ca.49727: Flags [P.], seq 35384:35580, ack 1, win 501, length 196
22:48:43.734666 IP 142.93.146.161.ssh > bras-base-toroon2638w-grc-51-142-114-112-45.dsl.bell.ca.49727: Flags [P.], seq 35580:35776, ack 1, win 501, length 196
22:48:43.734723 IP 142.93.146.161.ssh > bras-base-toroon2638w-grc-51-142-114-112-45.dsl.bell.ca.49727: Flags [P.], seq 35776:35972, ack 1, win 501, length 196
22:48:43.734780 IP 142.93.146.161.ssh > bras-base-toroon2638w-grc-51-142-114-112-45.dsl.bell.ca.49727: Flags [P.], seq 35972:36168, ack 1, win 501, length 196
22:48:43.734834 IP 142.93.146.161.ssh > bras-base-toroon2638w-grc-51-142-114-112-45.dsl.bell.ca.49727: Flags [P.], seq 36168:36364, ack 1, win 501, length 196
22:48:43.734890 IP 142.93.146.161.ssh > bras-base-toroon2638w-grc-51-142-114-112-45.dsl.bell.ca.49727: Flags [P.], seq 36364:36560, ack 1, win 501, length 196
22:48:43.734960 IP 142.93.146.161.ssh > bras-base-toroon2638w-grc-51-142-114-112-45.dsl.bell.ca.49727: Flags [P.], seq 36560:36756, ack 1, win 501, length 196
22:48:43.735018 IP 142.93.146.161.ssh > bras-base-toroon2638w-grc-51-142-114-112-45.dsl.bell.ca.49727: Flags [P.], seq 36756:36952, ack 1, win 501, length 196
22:48:43.735073 IP 142.93.146.161.ssh > bras-base-toroon2638w-grc-51-142-114-112-45.dsl.bell.ca.49727: Flags [P.], seq 36952:37148, ack 1, win 501, length 196
22:48:43.735127 IP 142.93.146.161.ssh > bras-base-toroon2638w-grc-51-142-114-112-45.dsl.bell.ca.49727: Flags [P.], seq 37148:37344, ack 1, win 501, length 196
22:48:43.735183 IP 142.93.146.161.ssh > bras-base-toroon2638w-grc-51-142-114-112-45.dsl.bell.ca.49727: Flags [P.], seq 37344:37540, ack 1, win 501, length 196
22:48:43.735246 IP 142.93.146.161.ssh > bras-base-toroon2638w-grc-51-142-114-112-45.dsl.bell.ca.49727: Flags [P.], seq 37540:37736, ack 1, win 501, length 196
22:48:43.735306 IP 142.93.146.161.ssh > bras-base-toroon2638w-grc-51-142-114-112-45.dsl.bell.ca.49727: Flags [P.], seq 37736:37932, ack 1, win 501, length 196
22:48:43.735373 IP 142.93.146.161.ssh > bras-base-toroon2638w-grc-51-142-114-112-45.dsl.bell.ca.49727: Flags [P.], seq 37932:38128, ack 1, win 501, length 196
22:48:43.735430 IP 142.93.146.161.ssh > bras-base-toroon2638w-grc-51-142-114-112-45.dsl.bell.ca.49727: Flags [P.], seq 38128:38324, ack 1, win 501, length 196
22:48:43.735484 IP 142.93.146.161.ssh > bras-base-toroon2638w-grc-51-142-114-112-45.dsl.bell.ca.49727: Flags [P.], seq 38324:38520, ack 1, win 501, length 196
22:48:43.735538 IP 142.93.146.161.ssh > bras-base-toroon2638w-grc-51-142-114-112-45.dsl.bell.ca.49727: Flags [P.], seq 38520:38716, ack 1, win 501, length 196
22:48:43.735594 IP 142.93.146.161.ssh > bras-base-toroon2638w-grc-51-142-114-112-45.dsl.bell.ca.49727: Flags [P.], seq 38716:38912, ack 1, win 501, length 196
22:48:43.735649 IP 142.93.146.161.ssh > bras-base-toroon2638w-grc-51-142-114-112-45.dsl.bell.ca.49727: Flags [P.], seq 38912:39108, ack 1, win 501, length 196
22:48:43.735706 IP 142.93.146.161.ssh > bras-base-toroon2638w-grc-51-142-114-112-45.dsl.bell.ca.49727: Flags [P.], seq 39108:39304, ack 1, win 501, length 196
22:48:43.735760 IP 142.93.146.161.ssh > bras-base-toroon2638w-grc-51-142-114-112-45.dsl.bell.ca.49727: Flags [P.], seq 39304:39500, ack 1, win 501, length 196
22:48:43.735813 IP 142.93.146.161.ssh > bras-base-toroon2638w-grc-51-142-114-112-45.dsl.bell.ca.49727: Flags [P.], seq 39500:39696, ack 1, win 501, length 196
22:48:43.735869 IP 142.93.146.161.ssh > bras-base-toroon2638w-grc-51-142-114-112-45.dsl.bell.ca.49727: Flags [P.], seq 39696:39892, ack 1, win 501, length 196
22:48:43.735924 IP 142.93.146.161.ssh > bras-base-toroon2638w-grc-51-142-114-112-45.dsl.bell.ca.49727: Flags [P.], seq 39892:40088, ack 1, win 501, length 196
22:48:43.736014 IP 142.93.146.161.ssh > bras-base-toroon2638w-grc-51-142-114-112-45.dsl.bell.ca.49727: Flags [P.], seq 40088:40284, ack 1, win 501, length 196
22:48:43.736081 IP 142.93.146.161.ssh > bras-base-toroon2638w-grc-51-142-114-112-45.dsl.bell.ca.49727: Flags [P.], seq 40284:40480, ack 1, win 501, length 196
22:48:43.736140 IP 142.93.146.161.ssh > bras-base-toroon2638w-grc-51-142-114-112-45.dsl.bell.ca.49727: Flags [P.], seq 40480:40676, ack 1, win 501, length 196
22:48:43.736197 IP 142.93.146.161.ssh > bras-base-toroon2638w-grc-51-142-114-112-45.dsl.bell.ca.49727: Flags [P.], seq 40676:40872, ack 1, win 501, length 196
22:48:43.736253 IP 142.93.146.161.ssh > bras-base-toroon2638w-grc-51-142-114-112-45.dsl.bell.ca.49727: Flags [P.], seq 40872:41068, ack 1, win 501, length 196
22:48:43.736308 IP 142.93.146.161.ssh > bras-base-toroon2638w-grc-51-142-114-112-45.dsl.bell.ca.49727: Flags [P.], seq 41068:41264, ack 1, win 501, length 196
22:48:43.736364 IP 142.93.146.161.ssh > bras-base-toroon2638w-grc-51-142-114-112-45.dsl.bell.ca.49727: Flags [P.], seq 41264:41460, ack 1, win 501, length 196
22:48:43.736435 IP 142.93.146.161.ssh > bras-base-toroon2638w-grc-51-142-114-112-45.dsl.bell.ca.49727: Flags [P.], seq 41460:41656, ack 1, win 501, length 196
22:48:43.736496 IP 142.93.146.161.ssh > bras-base-toroon2638w-grc-51-142-114-112-45.dsl.bell.ca.49727: Flags [P.], seq 41656:41852, ack 1, win 501, length 196
22:48:43.736553 IP 142.93.146.161.ssh > bras-base-toroon2638w-grc-51-142-114-112-45.dsl.bell.ca.49727: Flags [P.], seq 41852:42048, ack 1, win 501, length 196
22:48:43.736606 IP 142.93.146.161.ssh > bras-base-toroon2638w-grc-51-142-114-112-45.dsl.bell.ca.49727: Flags [P.], seq 42048:42244, ack 1, win 501, length 196
22:48:43.736660 IP 142.93.146.161.ssh > bras-base-toroon2638w-grc-51-142-114-112-45.dsl.bell.ca.49727: Flags [P.], seq 42244:42440, ack 1, win 501, length 196
22:48:43.736677 IP bras-base-toroon2638w-grc-51-142-114-112-45.dsl.bell.ca.49727 > 142.93.146.161.ssh: Flags [.], ack 24872, win 516, length 0
22:48:43.736795 IP 142.93.146.161.ssh > bras-base-toroon2638w-grc-51-142-114-112-45.dsl.bell.ca.49727: Flags [P.], seq 42440:42780, ack 1, win 501, length 340
22:48:43.736890 IP 142.93.146.161.ssh > bras-base-toroon2638w-grc-51-142-114-112-45.dsl.bell.ca.49727: Flags [P.], seq 42780:42976, ack 1, win 501, length 196
22:48:43.736983 IP 142.93.146.161.ssh > bras-base-toroon2638w-grc-51-142-114-112-45.dsl.bell.ca.49727: Flags [P.], seq 42976:43172, ack 1, win 501, length 196
22:48:43.737045 IP 142.93.146.161.ssh > bras-base-toroon2638w-grc-51-142-114-112-45.dsl.bell.ca.49727: Flags [P.], seq 43172:43368, ack 1, win 501, length 196
22:48:43.737100 IP 142.93.146.161.ssh > bras-base-toroon2638w-grc-51-142-114-112-45.dsl.bell.ca.49727: Flags [P.], seq 43368:43564, ack 1, win 501, length 196
22:48:43.737181 IP 142.93.146.161.ssh > bras-base-toroon2638w-grc-51-142-114-112-45.dsl.bell.ca.49727: Flags [P.], seq 43564:43760, ack 1, win 501, length 196
22:48:43.737255 IP 142.93.146.161.ssh > bras-base-toroon2638w-grc-51-142-114-112-45.dsl.bell.ca.49727: Flags [P.], seq 43760:43956, ack 1, win 501, length 196
22:48:43.737314 IP 142.93.146.161.ssh > bras-base-toroon2638w-grc-51-142-114-112-45.dsl.bell.ca.49727: Flags [P.], seq 43956:44152, ack 1, win 501, length 196
22:48:43.737373 IP 142.93.146.161.ssh > bras-base-toroon2638w-grc-51-142-114-112-45.dsl.bell.ca.49727: Flags [P.], seq 44152:44348, ack 1, win 501, length 196
22:48:43.737430 IP 142.93.146.161.ssh > bras-base-toroon2638w-grc-51-142-114-112-45.dsl.bell.ca.49727: Flags [P.], seq 44348:44544, ack 1, win 501, length 196
22:48:43.737482 IP 142.93.146.161.ssh > bras-base-toroon2638w-grc-51-142-114-112-45.dsl.bell.ca.49727: Flags [P.], seq 44544:44740, ack 1, win 501, length 196
22:48:43.737542 IP 142.93.146.161.ssh > bras-base-toroon2638w-grc-51-142-114-112-45.dsl.bell.ca.49727: Flags [P.], seq 44740:44936, ack 1, win 501, length 196
22:48:43.737599 IP 142.93.146.161.ssh > bras-base-toroon2638w-grc-51-142-114-112-45.dsl.bell.ca.49727: Flags [P.], seq 44936:45132, ack 1, win 501, length 196
22:48:43.737655 IP 142.93.146.161.ssh > bras-base-toroon2638w-grc-51-142-114-112-45.dsl.bell.ca.49727: Flags [P.], seq 45132:45328, ack 1, win 501, length 196
22:48:43.737681 IP bras-base-toroon2638w-grc-51-142-114-112-45.dsl.bell.ca.49727 > 142.93.146.161.ssh: Flags [.], ack 29784, win 516, length 0
22:48:43.737739 IP 142.93.146.161.ssh > bras-base-toroon2638w-grc-51-142-114-112-45.dsl.bell.ca.49727: Flags [P.], seq 45328:45668, ack 1, win 501, length 340
22:48:43.737799 IP 142.93.146.161.ssh > bras-base-toroon2638w-grc-51-142-114-112-45.dsl.bell.ca.49727: Flags [P.], seq 45668:45864, ack 1, win 501, length 196
22:48:43.737851 IP 142.93.146.161.ssh > bras-base-toroon2638w-grc-51-142-114-112-45.dsl.bell.ca.49727: Flags [P.], seq 45864:46060, ack 1, win 501, length 196
22:48:43.737906 IP 142.93.146.161.ssh > bras-base-toroon2638w-grc-51-142-114-112-45.dsl.bell.ca.49727: Flags [P.], seq 46060:46256, ack 1, win 501, length 196
22:48:43.737959 IP 142.93.146.161.ssh > bras-base-toroon2638w-grc-51-142-114-112-45.dsl.bell.ca.49727: Flags [P.], seq 46256:46452, ack 1, win 501, length 196
22:48:43.738014 IP 142.93.146.161.ssh > bras-base-toroon2638w-grc-51-142-114-112-45.dsl.bell.ca.49727: Flags [P.], seq 46452:46648, ack 1, win 501, length 196
22:48:43.738075 IP 142.93.146.161.ssh > bras-base-toroon2638w-grc-51-142-114-112-45.dsl.bell.ca.49727: Flags [P.], seq 46648:46844, ack 1, win 501, length 196
22:48:43.738140 IP 142.93.146.161.ssh > bras-base-toroon2638w-grc-51-142-114-112-45.dsl.bell.ca.49727: Flags [P.], seq 46844:47040, ack 1, win 501, length 196
22:48:43.738212 IP 142.93.146.161.ssh > bras-base-toroon2638w-grc-51-142-114-112-45.dsl.bell.ca.49727: Flags [P.], seq 47040:47236, ack 1, win 501, length 196
22:48:43.738269 IP 142.93.146.161.ssh > bras-base-toroon2638w-grc-51-142-114-112-45.dsl.bell.ca.49727: Flags [P.], seq 47236:47432, ack 1, win 501, length 196
22:48:43.738322 IP 142.93.146.161.ssh > bras-base-toroon2638w-grc-51-142-114-112-45.dsl.bell.ca.49727: Flags [P.], seq 47432:47628, ack 1, win 501, length 196
22:48:43.738373 IP 142.93.146.161.ssh > bras-base-toroon2638w-grc-51-142-114-112-45.dsl.bell.ca.49727: Flags [P.], seq 47628:47824, ack 1, win 501, length 196
22:48:43.738425 IP 142.93.146.161.ssh > bras-base-toroon2638w-grc-51-142-114-112-45.dsl.bell.ca.49727: Flags [P.], seq 47824:48020, ack 1, win 501, length 196
22:48:43.738478 IP 142.93.146.161.ssh > bras-base-toroon2638w-grc-51-142-114-112-45.dsl.bell.ca.49727: Flags [P.], seq 48020:48216, ack 1, win 501, length 196
22:48:43.738531 IP 142.93.146.161.ssh > bras-base-toroon2638w-grc-51-142-114-112-45.dsl.bell.ca.49727: Flags [P.], seq 48216:48412, ack 1, win 501, length 196
22:48:43.738572 IP bras-base-toroon2638w-grc-51-142-114-112-45.dsl.bell.ca.49727 > 142.93.146.161.ssh: Flags [.], ack 35384, win 516, length 0
22:48:43.738605 IP 142.93.146.161.ssh > bras-base-toroon2638w-grc-51-142-114-112-45.dsl.bell.ca.49727: Flags [P.], seq 48412:48608, ack 1, win 501, length 196
22:48:43.738671 IP 142.93.146.161.ssh > bras-base-toroon2638w-grc-51-142-114-112-45.dsl.bell.ca.49727: Flags [P.], seq 48608:48948, ack 1, win 501, length 340
22:48:43.738724 IP 142.93.146.161.ssh > bras-base-toroon2638w-grc-51-142-114-112-45.dsl.bell.ca.49727: Flags [P.], seq 48948:49144, ack 1, win 501, length 196
22:48:43.738775 IP 142.93.146.161.ssh > bras-base-toroon2638w-grc-51-142-114-112-45.dsl.bell.ca.49727: Flags [P.], seq 49144:49340, ack 1, win 501, length 196
22:48:43.738828 IP 142.93.146.161.ssh > bras-base-toroon2638w-grc-51-142-114-112-45.dsl.bell.ca.49727: Flags [P.], seq 49340:49536, ack 1, win 501, length 196
22:48:43.738879 IP 142.93.146.161.ssh > bras-base-toroon2638w-grc-51-142-114-112-45.dsl.bell.ca.49727: Flags [P.], seq 49536:49732, ack 1, win 501, length 196
22:48:43.738934 IP 142.93.146.161.ssh > bras-base-toroon2638w-grc-51-142-114-112-45.dsl.bell.ca.49727: Flags [P.], seq 49732:49928, ack 1, win 501, length 196
22:48:43.738986 IP 142.93.146.161.ssh > bras-base-toroon2638w-grc-51-142-114-112-45.dsl.bell.ca.49727: Flags [P.], seq 49928:50124, ack 1, win 501, length 196
22:48:43.739042 IP 142.93.146.161.ssh > bras-base-toroon2638w-grc-51-142-114-112-45.dsl.bell.ca.49727: Flags [P.], seq 50124:50320, ack 1, win 501, length 196
22:48:43.739093 IP 142.93.146.161.ssh > bras-base-toroon2638w-grc-51-142-114-112-45.dsl.bell.ca.49727: Flags [P.], seq 50320:50516, ack 1, win 501, length 196
22:48:43.739149 IP 142.93.146.161.ssh > bras-base-toroon2638w-grc-51-142-114-112-45.dsl.bell.ca.49727: Flags [P.], seq 50516:50712, ack 1, win 501, length 196
22:48:43.739201 IP 142.93.146.161.ssh > bras-base-toroon2638w-grc-51-142-114-112-45.dsl.bell.ca.49727: Flags [P.], seq 50712:50908, ack 1, win 501, length 196
22:48:43.739253 IP 142.93.146.161.ssh > bras-base-toroon2638w-grc-51-142-114-112-45.dsl.bell.ca.49727: Flags [P.], seq 50908:51104, ack 1, win 501, length 196
22:48:43.739308 IP 142.93.146.161.ssh > bras-base-toroon2638w-grc-51-142-114-112-45.dsl.bell.ca.49727: Flags [P.], seq 51104:51300, ack 1, win 501, length 196
22:48:43.739384 IP 142.93.146.161.ssh > bras-base-toroon2638w-grc-51-142-114-112-45.dsl.bell.ca.49727: Flags [P.], seq 51300:51496, ack 1, win 501, length 196
22:48:43.739442 IP 142.93.146.161.ssh > bras-base-toroon2638w-grc-51-142-114-112-45.dsl.bell.ca.49727: Flags [P.], seq 51496:51692, ack 1, win 501, length 196
22:48:43.739494 IP 142.93.146.161.ssh > bras-base-toroon2638w-grc-51-142-114-112-45.dsl.bell.ca.49727: Flags [P.], seq 51692:51888, ack 1, win 501, length 196
22:48:43.739549 IP 142.93.146.161.ssh > bras-base-toroon2638w-grc-51-142-114-112-45.dsl.bell.ca.49727: Flags [P.], seq 51888:52084, ack 1, win 501, length 196
