root@lamp-ubuntu-s-1vcpu-1gb-tor1-01:~# tcpdump -r 0001.pcap
reading from file 0001.pcap, link-type EN10MB (Ethernet)
23:00:48.590271 IP 142.93.146.161.ssh > bras-base-toroon2638w-grc-51-142-114-112-45.dsl.bell.ca.49727: Flags [P.], seq 536232763:536232807, ack 2132226275, win 501, length 44
23:00:48.590323 IP 142.93.146.161.ssh > bras-base-toroon2638w-grc-51-142-114-112-45.dsl.bell.ca.49727: Flags [P.], seq 44:152, ack 1, win 501, length 108
23:00:48.590361 IP 142.93.146.161.ssh > bras-base-toroon2638w-grc-51-142-114-112-45.dsl.bell.ca.49727: Flags [P.], seq 152:188, ack 1, win 501, length 36
23:00:48.594435 IP bras-base-toroon2638w-grc-51-142-114-112-45.dsl.bell.ca.49727 > 142.93.146.161.ssh: Flags [.], ack 0, win 2480, options [nop,nop,sack 1 {44:152}], length 0
23:00:48.594461 IP bras-base-toroon2638w-grc-51-142-114-112-45.dsl.bell.ca.49727 > 142.93.146.161.ssh: Flags [.], ack 152, win 2479, length 0
23:00:48.594465 IP bras-base-toroon2638w-grc-51-142-114-112-45.dsl.bell.ca.49727 > 142.93.146.161.ssh: Flags [.], ack 188, win 2479, length 0