root@lamp-ubuntu-s-1vcpu-1gb-tor1-01:~# tcpdump -i eth0 port 22
tcpdump: verbose output suppressed, use -v or -vv for full protocol decode
listening on eth0, link-type EN10MB (Ethernet), capture size 262144 bytes
23:07:13.861984 IP 142.93.146.161.ssh > bras-base-toroon2638w-grc-51-142-114-112-45.dsl.bell.ca.49727: Flags [P.], seq 546887751:546887859, ack 2132243803, win 501, length 108
23:07:13.862042 IP 142.93.146.161.ssh > bras-base-toroon2638w-grc-51-142-114-112-45.dsl.bell.ca.49727: Flags [P.], seq 108:144, ack 1, win 501, length 36
23:07:13.862093 IP 142.93.146.161.ssh > bras-base-toroon2638w-grc-51-142-114-112-45.dsl.bell.ca.49727: Flags [P.], seq 144:252, ack 1, win 501, length 108
23:07:13.862133 IP 142.93.146.161.ssh > bras-base-toroon2638w-grc-51-142-114-112-45.dsl.bell.ca.49727: Flags [P.], seq 252:288, ack 1, win 501, length 36
23:07:13.865689 IP bras-base-toroon2638w-grc-51-142-114-112-45.dsl.bell.ca.49727 > 142.93.146.161.ssh: Flags [.], ack 288, win 2481, length 0
23:07:13.880837 IP 142.93.146.161.ssh > bras-base-toroon2638w-grc-51-142-114-112-45.dsl.bell.ca.49727: Flags [P.], seq 288:500, ack 1, win 501, length 212
23:07:13.880920 IP 142.93.146.161.ssh > bras-base-toroon2638w-grc-51-142-114-112-45.dsl.bell.ca.49727: Flags [P.], seq 500:536, ack 1, win 501, length 36
23:07:13.880959 IP 142.93.146.161.ssh > bras-base-toroon2638w-grc-51-142-114-112-45.dsl.bell.ca.49727: Flags [P.], seq 536:724, ack 1, win 501, length 188
23:07:13.880999 IP 142.93.146.161.ssh > bras-base-toroon2638w-grc-51-142-114-112-45.dsl.bell.ca.49727: Flags [P.], seq 724:760, ack 1, win 501, length 36
23:07:13.881052 IP 142.93.146.161.ssh > bras-base-toroon2638w-grc-51-142-114-112-45.dsl.bell.ca.49727: Flags [P.], seq 760:948, ack 1, win 501, length 188
23:07:13.881093 IP 142.93.146.161.ssh > bras-base-toroon2638w-grc-51-142-114-112-45.dsl.bell.ca.49727: Flags [P.], seq 948:984, ack 1, win 501, length 36
23:07:13.881148 IP 142.93.146.161.ssh > bras-base-toroon2638w-grc-51-142-114-112-45.dsl.bell.ca.49727: Flags [P.], seq 984:1172, ack 1, win 501, length 188
23:07:13.881193 IP 142.93.146.161.ssh > bras-base-toroon2638w-grc-51-142-114-112-45.dsl.bell.ca.49727: Flags [P.], seq 1172:1208, ack 1, win 501, length 36
23:07:13.881245 IP 142.93.146.161.ssh > bras-base-toroon2638w-grc-51-142-114-112-45.dsl.bell.ca.49727: Flags [P.], seq 1208:1388, ack 1, win 501, length 180
23:07:13.881284 IP 142.93.146.161.ssh > bras-base-toroon2638w-grc-51-142-114-112-45.dsl.bell.ca.49727: Flags [P.], seq 1388:1424, ack 1, win 501, length 36
23:07:13.885004 IP bras-base-toroon2638w-grc-51-142-114-112-45.dsl.bell.ca.49727 > 142.93.146.161.ssh: Flags [.], ack 1424, win 2484, length 0
23:07:13.885029 IP 142.93.146.161.ssh > bras-base-toroon2638w-grc-51-142-114-112-45.dsl.bell.ca.49727: Flags [P.], seq 1424:3696, ack 1, win 501, length 2272
23:07:13.885104 IP 142.93.146.161.ssh > bras-base-toroon2638w-grc-51-142-114-112-45.dsl.bell.ca.49727: Flags [P.], seq 3696:3876, ack 1, win 501, length 180
23:07:13.885145 IP 142.93.146.161.ssh > bras-base-toroon2638w-grc-51-142-114-112-45.dsl.bell.ca.49727: Flags [P.], seq 3876:3912, ack 1, win 501, length 36
23:07:13.885196 IP 142.93.146.161.ssh > bras-base-toroon2638w-grc-51-142-114-112-45.dsl.bell.ca.49727: Flags [P.], seq 3912:4108, ack 1, win 501, length 196
23:07:13.885235 IP 142.93.146.161.ssh > bras-base-toroon2638w-grc-51-142-114-112-45.dsl.bell.ca.49727: Flags [P.], seq 4108:4144, ack 1, win 501, length 36
23:07:13.885283 IP 142.93.146.161.ssh > bras-base-toroon2638w-grc-51-142-114-112-45.dsl.bell.ca.49727: Flags [P.], seq 4144:4340, ack 1, win 501, length 196
23:07:13.885321 IP 142.93.146.161.ssh > bras-base-toroon2638w-grc-51-142-114-112-45.dsl.bell.ca.49727: Flags [P.], seq 4340:4376, ack 1, win 501, length 36
23:07:13.885369 IP 142.93.146.161.ssh > bras-base-toroon2638w-grc-51-142-114-112-45.dsl.bell.ca.49727: Flags [P.], seq 4376:4572, ack 1, win 501, length 196
23:07:13.885407 IP 142.93.146.161.ssh > bras-base-toroon2638w-grc-51-142-114-112-45.dsl.bell.ca.49727: Flags [P.], seq 4572:4608, ack 1, win 501, length 36
23:07:13.885454 IP 142.93.146.161.ssh > bras-base-toroon2638w-grc-51-142-114-112-45.dsl.bell.ca.49727: Flags [P.], seq 4608:4804, ack 1, win 501, length 196
23:07:13.885509 IP 142.93.146.161.ssh > bras-base-toroon2638w-grc-51-142-114-112-45.dsl.bell.ca.49727: Flags [P.], seq 4804:4840, ack 1, win 501, length 36
23:07:13.885569 IP 142.93.146.161.ssh > bras-base-toroon2638w-grc-51-142-114-112-45.dsl.bell.ca.49727: Flags [P.], seq 4840:5036, ack 1, win 501, length 196
23:07:13.885610 IP 142.93.146.161.ssh > bras-base-toroon2638w-grc-51-142-114-112-45.dsl.bell.ca.49727: Flags [P.], seq 5036:5072, ack 1, win 501, length 36
23:07:13.885670 IP 142.93.146.161.ssh > bras-base-toroon2638w-grc-51-142-114-112-45.dsl.bell.ca.49727: Flags [P.], seq 5072:5268, ack 1, win 501, length 196
23:07:13.885711 IP 142.93.146.161.ssh > bras-base-toroon2638w-grc-51-142-114-112-45.dsl.bell.ca.49727: Flags [P.], seq 5268:5304, ack 1, win 501, length 36
23:07:13.885761 IP 142.93.146.161.ssh > bras-base-toroon2638w-grc-51-142-114-112-45.dsl.bell.ca.49727: Flags [P.], seq 5304:5500, ack 1, win 501, length 196
23:07:13.885804 IP 142.93.146.161.ssh > bras-base-toroon2638w-grc-51-142-114-112-45.dsl.bell.ca.49727: Flags [P.], seq 5500:5536, ack 1, win 501, length 36
23:07:13.885858 IP 142.93.146.161.ssh > bras-base-toroon2638w-grc-51-142-114-112-45.dsl.bell.ca.49727: Flags [P.], seq 5536:5732, ack 1, win 501, length 196
23:07:13.885898 IP 142.93.146.161.ssh > bras-base-toroon2638w-grc-51-142-114-112-45.dsl.bell.ca.49727: Flags [P.], seq 5732:5768, ack 1, win 501, length 36
23:07:13.889518 IP bras-base-toroon2638w-grc-51-142-114-112-45.dsl.bell.ca.49727 > 142.93.146.161.ssh: Flags [.], ack 5304, win 2484, length 0
23:07:13.889541 IP 142.93.146.161.ssh > bras-base-toroon2638w-grc-51-142-114-112-45.dsl.bell.ca.49727: Flags [P.], seq 5768:8320, ack 1, win 501, length 2552
23:07:13.889625 IP 142.93.146.161.ssh > bras-base-toroon2638w-grc-51-142-114-112-45.dsl.bell.ca.49727: Flags [P.], seq 8320:8500, ack 1, win 501, length 180
23:07:13.889669 IP 142.93.146.161.ssh > bras-base-toroon2638w-grc-51-142-114-112-45.dsl.bell.ca.49727: Flags [P.], seq 8500:8536, ack 1, win 501, length 36
23:07:13.889711 IP 142.93.146.161.ssh > bras-base-toroon2638w-grc-51-142-114-112-45.dsl.bell.ca.49727: Flags [P.], seq 8536:8732, ack 1, win 501, length 196
23:07:13.889744 IP 142.93.146.161.ssh > bras-base-toroon2638w-grc-51-142-114-112-45.dsl.bell.ca.49727: Flags [P.], seq 8732:8768, ack 1, win 501, length 36
23:07:13.889820 IP 142.93.146.161.ssh > bras-base-toroon2638w-grc-51-142-114-112-45.dsl.bell.ca.49727: Flags [P.], seq 8768:8964, ack 1, win 501, length 196
23:07:13.889878 IP 142.93.146.161.ssh > bras-base-toroon2638w-grc-51-142-114-112-45.dsl.bell.ca.49727: Flags [P.], seq 8964:9196, ack 1, win 501, length 232
23:07:13.889921 IP 142.93.146.161.ssh > bras-base-toroon2638w-grc-51-142-114-112-45.dsl.bell.ca.49727: Flags [P.], seq 9196:9232, ack 1, win 501, length 36
23:07:13.889970 IP 142.93.146.161.ssh > bras-base-toroon2638w-grc-51-142-114-112-45.dsl.bell.ca.49727: Flags [P.], seq 9232:9428, ack 1, win 501, length 196
23:07:13.890008 IP 142.93.146.161.ssh > bras-base-toroon2638w-grc-51-142-114-112-45.dsl.bell.ca.49727: Flags [P.], seq 9428:9464, ack 1, win 501, length 36
23:07:13.890057 IP 142.93.146.161.ssh > bras-base-toroon2638w-grc-51-142-114-112-45.dsl.bell.ca.49727: Flags [P.], seq 9464:9660, ack 1, win 501, length 196
23:07:13.890075 IP bras-base-toroon2638w-grc-51-142-114-112-45.dsl.bell.ca.49727 > 142.93.146.161.ssh: Flags [.], ack 5768, win 2482, length 0
23:07:13.890109 IP 142.93.146.161.ssh > bras-base-toroon2638w-grc-51-142-114-112-45.dsl.bell.ca.49727: Flags [P.], seq 9660:9696, ack 1, win 501, length 36
23:07:13.890157 IP 142.93.146.161.ssh > bras-base-toroon2638w-grc-51-142-114-112-45.dsl.bell.ca.49727: Flags [P.], seq 9696:9892, ack 1, win 501, length 196
23:07:13.890196 IP 142.93.146.161.ssh > bras-base-toroon2638w-grc-51-142-114-112-45.dsl.bell.ca.49727: Flags [P.], seq 9892:9928, ack 1, win 501, length 36
23:07:13.890247 IP 142.93.146.161.ssh > bras-base-toroon2638w-grc-51-142-114-112-45.dsl.bell.ca.49727: Flags [P.], seq 9928:10124, ack 1, win 501, length 196
23:07:13.890360 IP 142.93.146.161.ssh > bras-base-toroon2638w-grc-51-142-114-112-45.dsl.bell.ca.49727: Flags [P.], seq 10124:10160, ack 1, win 501, length 36
23:07:13.890411 IP 142.93.146.161.ssh > bras-base-toroon2638w-grc-51-142-114-112-45.dsl.bell.ca.49727: Flags [P.], seq 10160:10356, ack 1, win 501, length 196
23:07:13.890450 IP 142.93.146.161.ssh > bras-base-toroon2638w-grc-51-142-114-112-45.dsl.bell.ca.49727: Flags [P.], seq 10356:10392, ack 1, win 501, length 36
23:07:13.890497 IP 142.93.146.161.ssh > bras-base-toroon2638w-grc-51-142-114-112-45.dsl.bell.ca.49727: Flags [P.], seq 10392:10588, ack 1, win 501, length 196
23:07:13.890534 IP 142.93.146.161.ssh > bras-base-toroon2638w-grc-51-142-114-112-45.dsl.bell.ca.49727: Flags [P.], seq 10588:10624, ack 1, win 501, length 36
23:07:13.890580 IP 142.93.146.161.ssh > bras-base-toroon2638w-grc-51-142-114-112-45.dsl.bell.ca.49727: Flags [P.], seq 10624:10820, ack 1, win 501, length 196
23:07:13.890620 IP 142.93.146.161.ssh > bras-base-toroon2638w-grc-51-142-114-112-45.dsl.bell.ca.49727: Flags [P.], seq 10820:10856, ack 1, win 501, length 36
23:07:13.890694 IP 142.93.146.161.ssh > bras-base-toroon2638w-grc-51-142-114-112-45.dsl.bell.ca.49727: Flags [P.], seq 10856:11052, ack 1, win 501, length 196
23:07:13.890749 IP 142.93.146.161.ssh > bras-base-toroon2638w-grc-51-142-114-112-45.dsl.bell.ca.49727: Flags [P.], seq 11052:11088, ack 1, win 501, length 36
23:07:13.890803 IP 142.93.146.161.ssh > bras-base-toroon2638w-grc-51-142-114-112-45.dsl.bell.ca.49727: Flags [P.], seq 11088:11268, ack 1, win 501, length 180
23:07:13.890842 IP 142.93.146.161.ssh > bras-base-toroon2638w-grc-51-142-114-112-45.dsl.bell.ca.49727: Flags [P.], seq 11268:11304, ack 1, win 501, length 36
23:07:13.890890 IP 142.93.146.161.ssh > bras-base-toroon2638w-grc-51-142-114-112-45.dsl.bell.ca.49727: Flags [P.], seq 11304:11500, ack 1, win 501, length 196
23:07:13.890927 IP 142.93.146.161.ssh > bras-base-toroon2638w-grc-51-142-114-112-45.dsl.bell.ca.49727: Flags [P.], seq 11500:11536, ack 1, win 501, length 36
23:07:13.890974 IP 142.93.146.161.ssh > bras-base-toroon2638w-grc-51-142-114-112-45.dsl.bell.ca.49727: Flags [P.], seq 11536:11732, ack 1, win 501, length 196
23:07:13.891013 IP 142.93.146.161.ssh > bras-base-toroon2638w-grc-51-142-114-112-45.dsl.bell.ca.49727: Flags [P.], seq 11732:11768, ack 1, win 501, length 36
23:07:13.891060 IP 142.93.146.161.ssh > bras-base-toroon2638w-grc-51-142-114-112-45.dsl.bell.ca.49727: Flags [P.], seq 11768:11964, ack 1, win 501, length 196
23:07:13.891099 IP 142.93.146.161.ssh > bras-base-toroon2638w-grc-51-142-114-112-45.dsl.bell.ca.49727: Flags [P.], seq 11964:12000, ack 1, win 501, length 36
23:07:13.891147 IP 142.93.146.161.ssh > bras-base-toroon2638w-grc-51-142-114-112-45.dsl.bell.ca.49727: Flags [P.], seq 12000:12196, ack 1, win 501, length 196
23:07:13.891186 IP 142.93.146.161.ssh > bras-base-toroon2638w-grc-51-142-114-112-45.dsl.bell.ca.49727: Flags [P.], seq 12196:12232, ack 1, win 501, length 36
23:07:13.891233 IP 142.93.146.161.ssh > bras-base-toroon2638w-grc-51-142-114-112-45.dsl.bell.ca.49727: Flags [P.], seq 12232:12428, ack 1, win 501, length 196
23:07:13.891270 IP 142.93.146.161.ssh > bras-base-toroon2638w-grc-51-142-114-112-45.dsl.bell.ca.49727: Flags [P.], seq 12428:12464, ack 1, win 501, length 36
23:07:13.891317 IP 142.93.146.161.ssh > bras-base-toroon2638w-grc-51-142-114-112-45.dsl.bell.ca.49727: Flags [P.], seq 12464:12660, ack 1, win 501, length 196
23:07:13.891378 IP 142.93.146.161.ssh > bras-base-toroon2638w-grc-51-142-114-112-45.dsl.bell.ca.49727: Flags [P.], seq 12660:12696, ack 1, win 501, length 36
23:07:13.891461 IP 142.93.146.161.ssh > bras-base-toroon2638w-grc-51-142-114-112-45.dsl.bell.ca.49727: Flags [P.], seq 12696:12892, ack 1, win 501, length 196
23:07:13.893158 IP bras-base-toroon2638w-grc-51-142-114-112-45.dsl.bell.ca.49727 > 142.93.146.161.ssh: Flags [.], ack 9928, win 2484, length 0
23:07:13.893181 IP 142.93.146.161.ssh > bras-base-toroon2638w-grc-51-142-114-112-45.dsl.bell.ca.49727: Flags [P.], seq 12892:17800, ack 1, win 501, length 4908
23:07:13.893260 IP 142.93.146.161.ssh > bras-base-toroon2638w-grc-51-142-114-112-45.dsl.bell.ca.49727: Flags [P.], seq 17800:17980, ack 1, win 501, length 180
23:07:13.893306 IP 142.93.146.161.ssh > bras-base-toroon2638w-grc-51-142-114-112-45.dsl.bell.ca.49727: Flags [P.], seq 17980:18016, ack 1, win 501, length 36
23:07:13.893358 IP 142.93.146.161.ssh > bras-base-toroon2638w-grc-51-142-114-112-45.dsl.bell.ca.49727: Flags [P.], seq 18016:18212, ack 1, win 501, length 196
23:07:13.893397 IP 142.93.146.161.ssh > bras-base-toroon2638w-grc-51-142-114-112-45.dsl.bell.ca.49727: Flags [P.], seq 18212:18248, ack 1, win 501, length 36
23:07:13.893445 IP 142.93.146.161.ssh > bras-base-toroon2638w-grc-51-142-114-112-45.dsl.bell.ca.49727: Flags [P.], seq 18248:18444, ack 1, win 501, length 196
23:07:13.893483 IP 142.93.146.161.ssh > bras-base-toroon2638w-grc-51-142-114-112-45.dsl.bell.ca.49727: Flags [P.], seq 18444:18480, ack 1, win 501, length 36
23:07:13.893530 IP 142.93.146.161.ssh > bras-base-toroon2638w-grc-51-142-114-112-45.dsl.bell.ca.49727: Flags [P.], seq 18480:18676, ack 1, win 501, length 196
23:07:13.893568 IP 142.93.146.161.ssh > bras-base-toroon2638w-grc-51-142-114-112-45.dsl.bell.ca.49727: Flags [P.], seq 18676:18712, ack 1, win 501, length 36
23:07:13.893613 IP 142.93.146.161.ssh > bras-base-toroon2638w-grc-51-142-114-112-45.dsl.bell.ca.49727: Flags [P.], seq 18712:18908, ack 1, win 501, length 196
23:07:13.893651 IP 142.93.146.161.ssh > bras-base-toroon2638w-grc-51-142-114-112-45.dsl.bell.ca.49727: Flags [P.], seq 18908:18944, ack 1, win 501, length 36
23:07:13.893697 IP 142.93.146.161.ssh > bras-base-toroon2638w-grc-51-142-114-112-45.dsl.bell.ca.49727: Flags [P.], seq 18944:19140, ack 1, win 501, length 196
23:07:13.893735 IP 142.93.146.161.ssh > bras-base-toroon2638w-grc-51-142-114-112-45.dsl.bell.ca.49727: Flags [P.], seq 19140:19176, ack 1, win 501, length 36
23:07:13.893782 IP 142.93.146.161.ssh > bras-base-toroon2638w-grc-51-142-114-112-45.dsl.bell.ca.49727: Flags [P.], seq 19176:19372, ack 1, win 501, length 196
23:07:13.893820 IP 142.93.146.161.ssh > bras-base-toroon2638w-grc-51-142-114-112-45.dsl.bell.ca.49727: Flags [P.], seq 19372:19408, ack 1, win 501, length 36
23:07:13.893860 IP 142.93.146.161.ssh > bras-base-toroon2638w-grc-51-142-114-112-45.dsl.bell.ca.49727: Flags [P.], seq 19408:19604, ack 1, win 501, length 196
23:07:13.893893 IP 142.93.146.161.ssh > bras-base-toroon2638w-grc-51-142-114-112-45.dsl.bell.ca.49727: Flags [P.], seq 19604:19640, ack 1, win 501, length 36
23:07:13.893940 IP 142.93.146.161.ssh > bras-base-toroon2638w-grc-51-142-114-112-45.dsl.bell.ca.49727: Flags [P.], seq 19640:19836, ack 1, win 501, length 196
23:07:13.893979 IP 142.93.146.161.ssh > bras-base-toroon2638w-grc-51-142-114-112-45.dsl.bell.ca.49727: Flags [P.], seq 19836:19872, ack 1, win 501, length 36
23:07:13.894027 IP 142.93.146.161.ssh > bras-base-toroon2638w-grc-51-142-114-112-45.dsl.bell.ca.49727: Flags [P.], seq 19872:20068, ack 1, win 501, length 196
23:07:13.894065 IP 142.93.146.161.ssh > bras-base-toroon2638w-grc-51-142-114-112-45.dsl.bell.ca.49727: Flags [P.], seq 20068:20104, ack 1, win 501, length 36
23:07:13.894111 IP 142.93.146.161.ssh > bras-base-toroon2638w-grc-51-142-114-112-45.dsl.bell.ca.49727: Flags [P.], seq 20104:20300, ack 1, win 501, length 196
23:07:13.894149 IP 142.93.146.161.ssh > bras-base-toroon2638w-grc-51-142-114-112-45.dsl.bell.ca.49727: Flags [P.], seq 20300:20336, ack 1, win 501, length 36
23:07:13.894196 IP 142.93.146.161.ssh > bras-base-toroon2638w-grc-51-142-114-112-45.dsl.bell.ca.49727: Flags [P.], seq 20336:20532, ack 1, win 501, length 196
23:07:13.894234 IP 142.93.146.161.ssh > bras-base-toroon2638w-grc-51-142-114-112-45.dsl.bell.ca.49727: Flags [P.], seq 20532:20568, ack 1, win 501, length 36
23:07:13.894281 IP 142.93.146.161.ssh > bras-base-toroon2638w-grc-51-142-114-112-45.dsl.bell.ca.49727: Flags [P.], seq 20568:20764, ack 1, win 501, length 196
23:07:13.894323 IP 142.93.146.161.ssh > bras-base-toroon2638w-grc-51-142-114-112-45.dsl.bell.ca.49727: Flags [P.], seq 20764:20800, ack 1, win 501, length 36
23:07:13.896006 IP bras-base-toroon2638w-grc-51-142-114-112-45.dsl.bell.ca.49727 > 142.93.146.161.ssh: Flags [.], ack 12892, win 2484, length 0
23:07:13.896032 IP 142.93.146.161.ssh > bras-base-toroon2638w-grc-51-142-114-112-45.dsl.bell.ca.49727: Flags [P.], seq 20800:24280, ack 1, win 501, length 3480
23:07:13.896132 IP 142.93.146.161.ssh > bras-base-toroon2638w-grc-51-142-114-112-45.dsl.bell.ca.49727: Flags [P.], seq 24280:24460, ack 1, win 501, length 180
23:07:13.896189 IP 142.93.146.161.ssh > bras-base-toroon2638w-grc-51-142-114-112-45.dsl.bell.ca.49727: Flags [P.], seq 24460:24496, ack 1, win 501, length 36
23:07:13.896245 IP 142.93.146.161.ssh > bras-base-toroon2638w-grc-51-142-114-112-45.dsl.bell.ca.49727: Flags [P.], seq 24496:24692, ack 1, win 501, length 196
23:07:13.896305 IP 142.93.146.161.ssh > bras-base-toroon2638w-grc-51-142-114-112-45.dsl.bell.ca.49727: Flags [P.], seq 24692:24924, ack 1, win 501, length 232
23:07:13.896350 IP 142.93.146.161.ssh > bras-base-toroon2638w-grc-51-142-114-112-45.dsl.bell.ca.49727: Flags [P.], seq 24924:24960, ack 1, win 501, length 36
23:07:13.896399 IP 142.93.146.161.ssh > bras-base-toroon2638w-grc-51-142-114-112-45.dsl.bell.ca.49727: Flags [P.], seq 24960:25156, ack 1, win 501, length 196
23:07:13.896437 IP 142.93.146.161.ssh > bras-base-toroon2638w-grc-51-142-114-112-45.dsl.bell.ca.49727: Flags [P.], seq 25156:25192, ack 1, win 501, length 36
23:07:13.896483 IP 142.93.146.161.ssh > bras-base-toroon2638w-grc-51-142-114-112-45.dsl.bell.ca.49727: Flags [P.], seq 25192:25388, ack 1, win 501, length 196
23:07:13.896521 IP 142.93.146.161.ssh > bras-base-toroon2638w-grc-51-142-114-112-45.dsl.bell.ca.49727: Flags [P.], seq 25388:25424, ack 1, win 501, length 36
23:07:13.896568 IP 142.93.146.161.ssh > bras-base-toroon2638w-grc-51-142-114-112-45.dsl.bell.ca.49727: Flags [P.], seq 25424:25620, ack 1, win 501, length 196
23:07:13.896606 IP 142.93.146.161.ssh > bras-base-toroon2638w-grc-51-142-114-112-45.dsl.bell.ca.49727: Flags [P.], seq 25620:25656, ack 1, win 501, length 36
23:07:13.896652 IP 142.93.146.161.ssh > bras-base-toroon2638w-grc-51-142-114-112-45.dsl.bell.ca.49727: Flags [P.], seq 25656:25852, ack 1, win 501, length 196
23:07:13.896690 IP 142.93.146.161.ssh > bras-base-toroon2638w-grc-51-142-114-112-45.dsl.bell.ca.49727: Flags [P.], seq 25852:25888, ack 1, win 501, length 36
23:07:13.896737 IP 142.93.146.161.ssh > bras-base-toroon2638w-grc-51-142-114-112-45.dsl.bell.ca.49727: Flags [P.], seq 25888:26084, ack 1, win 501, length 196
23:07:13.896776 IP 142.93.146.161.ssh > bras-base-toroon2638w-grc-51-142-114-112-45.dsl.bell.ca.49727: Flags [P.], seq 26084:26120, ack 1, win 501, length 36
23:07:13.896849 IP 142.93.146.161.ssh > bras-base-toroon2638w-grc-51-142-114-112-45.dsl.bell.ca.49727: Flags [P.], seq 26120:26316, ack 1, win 501, length 196
23:07:13.896890 IP 142.93.146.161.ssh > bras-base-toroon2638w-grc-51-142-114-112-45.dsl.bell.ca.49727: Flags [P.], seq 26316:26352, ack 1, win 501, length 36
23:07:13.896938 IP 142.93.146.161.ssh > bras-base-toroon2638w-grc-51-142-114-112-45.dsl.bell.ca.49727: Flags [P.], seq 26352:26548, ack 1, win 501, length 196
23:07:13.896976 IP 142.93.146.161.ssh > bras-base-toroon2638w-grc-51-142-114-112-45.dsl.bell.ca.49727: Flags [P.], seq 26548:26584, ack 1, win 501, length 36
23:07:13.897024 IP 142.93.146.161.ssh > bras-base-toroon2638w-grc-51-142-114-112-45.dsl.bell.ca.49727: Flags [P.], seq 26584:26780, ack 1, win 501, length 196
23:07:13.897062 IP 142.93.146.161.ssh > bras-base-toroon2638w-grc-51-142-114-112-45.dsl.bell.ca.49727: Flags [P.], seq 26780:26816, ack 1, win 501, length 36
23:07:13.897109 IP 142.93.146.161.ssh > bras-base-toroon2638w-grc-51-142-114-112-45.dsl.bell.ca.49727: Flags [P.], seq 26816:27012, ack 1, win 501, length 196
23:07:13.897123 IP bras-base-toroon2638w-grc-51-142-114-112-45.dsl.bell.ca.49727 > 142.93.146.161.ssh: Flags [.], ack 14344, win 2484, options [nop,nop,sack 1 {15796:17248}], length 0
23:07:13.897129 IP bras-base-toroon2638w-grc-51-142-114-112-45.dsl.bell.ca.49727 > 142.93.146.161.ssh: Flags [.], ack 17248, win 2484, length 0
23:07:13.897240 IP 142.93.146.161.ssh > bras-base-toroon2638w-grc-51-142-114-112-45.dsl.bell.ca.49727: Flags [P.], seq 27012:28168, ack 1, win 501, length 1156
23:07:13.897329 IP 142.93.146.161.ssh > bras-base-toroon2638w-grc-51-142-114-112-45.dsl.bell.ca.49727: Flags [P.], seq 28168:29004, ack 1, win 501, length 836
23:07:13.897414 IP 142.93.146.161.ssh > bras-base-toroon2638w-grc-51-142-114-112-45.dsl.bell.ca.49727: Flags [P.], seq 29004:29696, ack 1, win 501, length 692
23:07:13.897474 IP 142.93.146.161.ssh > bras-base-toroon2638w-grc-51-142-114-112-45.dsl.bell.ca.49727: Flags [P.], seq 29696:29892, ack 1, win 501, length 196
23:07:13.897531 IP 142.93.146.161.ssh > bras-base-toroon2638w-grc-51-142-114-112-45.dsl.bell.ca.49727: Flags [P.], seq 29892:30088, ack 1, win 501, length 196
23:07:13.897588 IP 142.93.146.161.ssh > bras-base-toroon2638w-grc-51-142-114-112-45.dsl.bell.ca.49727: Flags [P.], seq 30088:30284, ack 1, win 501, length 196
23:07:13.897645 IP 142.93.146.161.ssh > bras-base-toroon2638w-grc-51-142-114-112-45.dsl.bell.ca.49727: Flags [P.], seq 30284:30480, ack 1, win 501, length 196
23:07:13.897702 IP 142.93.146.161.ssh > bras-base-toroon2638w-grc-51-142-114-112-45.dsl.bell.ca.49727: Flags [P.], seq 30480:30676, ack 1, win 501, length 196
23:07:13.897758 IP 142.93.146.161.ssh > bras-base-toroon2638w-grc-51-142-114-112-45.dsl.bell.ca.49727: Flags [P.], seq 30676:30872, ack 1, win 501, length 196
23:07:13.897817 IP 142.93.146.161.ssh > bras-base-toroon2638w-grc-51-142-114-112-45.dsl.bell.ca.49727: Flags [P.], seq 30872:31068, ack 1, win 501, length 196
23:07:13.897858 IP bras-base-toroon2638w-grc-51-142-114-112-45.dsl.bell.ca.49727 > 142.93.146.161.ssh: Flags [.], ack 18016, win 2481, length 0
23:07:13.897906 IP 142.93.146.161.ssh > bras-base-toroon2638w-grc-51-142-114-112-45.dsl.bell.ca.49727: Flags [P.], seq 31068:31408, ack 1, win 501, length 340
23:07:13.897965 IP 142.93.146.161.ssh > bras-base-toroon2638w-grc-51-142-114-112-45.dsl.bell.ca.49727: Flags [P.], seq 31408:31604, ack 1, win 501, length 196
23:07:13.897994 IP bras-base-toroon2638w-grc-51-142-114-112-45.dsl.bell.ca.49727 > 142.93.146.161.ssh: Flags [.], ack 20800, win 2484, length 0
23:07:13.898055 IP 142.93.146.161.ssh > bras-base-toroon2638w-grc-51-142-114-112-45.dsl.bell.ca.49727: Flags [P.], seq 31604:31944, ack 1, win 501, length 340
23:07:13.898114 IP 142.93.146.161.ssh > bras-base-toroon2638w-grc-51-142-114-112-45.dsl.bell.ca.49727: Flags [P.], seq 31944:32140, ack 1, win 501, length 196
23:07:13.898170 IP 142.93.146.161.ssh > bras-base-toroon2638w-grc-51-142-114-112-45.dsl.bell.ca.49727: Flags [P.], seq 32140:32336, ack 1, win 501, length 196
23:07:13.898246 IP 142.93.146.161.ssh > bras-base-toroon2638w-grc-51-142-114-112-45.dsl.bell.ca.49727: Flags [P.], seq 32336:32532, ack 1, win 501, length 196
23:07:13.898304 IP 142.93.146.161.ssh > bras-base-toroon2638w-grc-51-142-114-112-45.dsl.bell.ca.49727: Flags [P.], seq 32532:32728, ack 1, win 501, length 196
23:07:13.898360 IP 142.93.146.161.ssh > bras-base-toroon2638w-grc-51-142-114-112-45.dsl.bell.ca.49727: Flags [P.], seq 32728:32924, ack 1, win 501, length 196
23:07:13.898426 IP 142.93.146.161.ssh > bras-base-toroon2638w-grc-51-142-114-112-45.dsl.bell.ca.49727: Flags [P.], seq 32924:33120, ack 1, win 501, length 196
23:07:13.898486 IP 142.93.146.161.ssh > bras-base-toroon2638w-grc-51-142-114-112-45.dsl.bell.ca.49727: Flags [P.], seq 33120:33316, ack 1, win 501, length 196
23:07:13.898563 IP 142.93.146.161.ssh > bras-base-toroon2638w-grc-51-142-114-112-45.dsl.bell.ca.49727: Flags [P.], seq 33316:33512, ack 1, win 501, length 196
23:07:13.898622 IP 142.93.146.161.ssh > bras-base-toroon2638w-grc-51-142-114-112-45.dsl.bell.ca.49727: Flags [P.], seq 33512:33708, ack 1, win 501, length 196
23:07:13.898680 IP 142.93.146.161.ssh > bras-base-toroon2638w-grc-51-142-114-112-45.dsl.bell.ca.49727: Flags [P.], seq 33708:33904, ack 1, win 501, length 196
23:07:13.898745 IP 142.93.146.161.ssh > bras-base-toroon2638w-grc-51-142-114-112-45.dsl.bell.ca.49727: Flags [P.], seq 33904:34100, ack 1, win 501, length 196
23:07:13.898824 IP 142.93.146.161.ssh > bras-base-toroon2638w-grc-51-142-114-112-45.dsl.bell.ca.49727: Flags [P.], seq 34100:34296, ack 1, win 501, length 196
23:07:13.898886 IP 142.93.146.161.ssh > bras-base-toroon2638w-grc-51-142-114-112-45.dsl.bell.ca.49727: Flags [P.], seq 34296:34492, ack 1, win 501, length 196
23:07:13.898944 IP 142.93.146.161.ssh > bras-base-toroon2638w-grc-51-142-114-112-45.dsl.bell.ca.49727: Flags [P.], seq 34492:34688, ack 1, win 501, length 196
23:07:13.899004 IP 142.93.146.161.ssh > bras-base-toroon2638w-grc-51-142-114-112-45.dsl.bell.ca.49727: Flags [P.], seq 34688:34884, ack 1, win 501, length 196
23:07:13.899060 IP 142.93.146.161.ssh > bras-base-toroon2638w-grc-51-142-114-112-45.dsl.bell.ca.49727: Flags [P.], seq 34884:35080, ack 1, win 501, length 196
23:07:13.899118 IP 142.93.146.161.ssh > bras-base-toroon2638w-grc-51-142-114-112-45.dsl.bell.ca.49727: Flags [P.], seq 35080:35276, ack 1, win 501, length 196
23:07:13.899174 IP 142.93.146.161.ssh > bras-base-toroon2638w-grc-51-142-114-112-45.dsl.bell.ca.49727: Flags [P.], seq 35276:35472, ack 1, win 501, length 196
23:07:13.899229 IP 142.93.146.161.ssh > bras-base-toroon2638w-grc-51-142-114-112-45.dsl.bell.ca.49727: Flags [P.], seq 35472:35668, ack 1, win 501, length 196
23:07:13.899291 IP 142.93.146.161.ssh > bras-base-toroon2638w-grc-51-142-114-112-45.dsl.bell.ca.49727: Flags [P.], seq 35668:35864, ack 1, win 501, length 196
23:07:13.899349 IP 142.93.146.161.ssh > bras-base-toroon2638w-grc-51-142-114-112-45.dsl.bell.ca.49727: Flags [P.], seq 35864:36060, ack 1, win 501, length 196
23:07:13.899376 IP bras-base-toroon2638w-grc-51-142-114-112-45.dsl.bell.ca.49727 > 142.93.146.161.ssh: Flags [.], ack 22252, win 2484, options [nop,nop,sack 1 {23704:24280}], length 0
23:07:13.899381 IP bras-base-toroon2638w-grc-51-142-114-112-45.dsl.bell.ca.49727 > 142.93.146.161.ssh: Flags [.], ack 24280, win 2484, length 0
23:07:13.899460 IP 142.93.146.161.ssh > bras-base-toroon2638w-grc-51-142-114-112-45.dsl.bell.ca.49727: Flags [P.], seq 36060:36584, ack 1, win 501, length 524
23:07:13.899597 IP 142.93.146.161.ssh > bras-base-toroon2638w-grc-51-142-114-112-45.dsl.bell.ca.49727: Flags [P.], seq 36584:36780, ack 1, win 501, length 196
23:07:13.899657 IP 142.93.146.161.ssh > bras-base-toroon2638w-grc-51-142-114-112-45.dsl.bell.ca.49727: Flags [P.], seq 36780:36976, ack 1, win 501, length 196
23:07:13.899715 IP 142.93.146.161.ssh > bras-base-toroon2638w-grc-51-142-114-112-45.dsl.bell.ca.49727: Flags [P.], seq 36976:37172, ack 1, win 501, length 196
23:07:13.899775 IP 142.93.146.161.ssh > bras-base-toroon2638w-grc-51-142-114-112-45.dsl.bell.ca.49727: Flags [P.], seq 37172:37368, ack 1, win 501, length 196
23:07:13.899833 IP 142.93.146.161.ssh > bras-base-toroon2638w-grc-51-142-114-112-45.dsl.bell.ca.49727: Flags [P.], seq 37368:37564, ack 1, win 501, length 196
23:07:13.899893 IP 142.93.146.161.ssh > bras-base-toroon2638w-grc-51-142-114-112-45.dsl.bell.ca.49727: Flags [P.], seq 37564:37760, ack 1, win 501, length 196
23:07:13.899949 IP 142.93.146.161.ssh > bras-base-toroon2638w-grc-51-142-114-112-45.dsl.bell.ca.49727: Flags [P.], seq 37760:37956, ack 1, win 501, length 196
23:07:13.900010 IP 142.93.146.161.ssh > bras-base-toroon2638w-grc-51-142-114-112-45.dsl.bell.ca.49727: Flags [P.], seq 37956:38152, ack 1, win 501, length 196
23:07:13.900072 IP 142.93.146.161.ssh > bras-base-toroon2638w-grc-51-142-114-112-45.dsl.bell.ca.49727: Flags [P.], seq 38152:38348, ack 1, win 501, length 196
23:07:13.900130 IP 142.93.146.161.ssh > bras-base-toroon2638w-grc-51-142-114-112-45.dsl.bell.ca.49727: Flags [P.], seq 38348:38544, ack 1, win 501, length 196
23:07:13.900186 IP 142.93.146.161.ssh > bras-base-toroon2638w-grc-51-142-114-112-45.dsl.bell.ca.49727: Flags [P.], seq 38544:38740, ack 1, win 501, length 196
23:07:13.900244 IP 142.93.146.161.ssh > bras-base-toroon2638w-grc-51-142-114-112-45.dsl.bell.ca.49727: Flags [P.], seq 38740:38936, ack 1, win 501, length 196
23:07:13.900301 IP 142.93.146.161.ssh > bras-base-toroon2638w-grc-51-142-114-112-45.dsl.bell.ca.49727: Flags [P.], seq 38936:39132, ack 1, win 501, length 196
23:07:13.900359 IP 142.93.146.161.ssh > bras-base-toroon2638w-grc-51-142-114-112-45.dsl.bell.ca.49727: Flags [P.], seq 39132:39328, ack 1, win 501, length 196
23:07:13.900415 IP 142.93.146.161.ssh > bras-base-toroon2638w-grc-51-142-114-112-45.dsl.bell.ca.49727: Flags [P.], seq 39328:39524, ack 1, win 501, length 196
23:07:13.900471 IP 142.93.146.161.ssh > bras-base-toroon2638w-grc-51-142-114-112-45.dsl.bell.ca.49727: Flags [P.], seq 39524:39720, ack 1, win 501, length 196
23:07:13.900528 IP 142.93.146.161.ssh > bras-base-toroon2638w-grc-51-142-114-112-45.dsl.bell.ca.49727: Flags [P.], seq 39720:39916, ack 1, win 501, length 196
23:07:13.900585 IP 142.93.146.161.ssh > bras-base-toroon2638w-grc-51-142-114-112-45.dsl.bell.ca.49727: Flags [P.], seq 39916:40112, ack 1, win 501, length 196
23:07:13.900642 IP 142.93.146.161.ssh > bras-base-toroon2638w-grc-51-142-114-112-45.dsl.bell.ca.49727: Flags [P.], seq 40112:40308, ack 1, win 501, length 196
23:07:13.900699 IP 142.93.146.161.ssh > bras-base-toroon2638w-grc-51-142-114-112-45.dsl.bell.ca.49727: Flags [P.], seq 40308:40504, ack 1, win 501, length 196
23:07:13.900756 IP 142.93.146.161.ssh > bras-base-toroon2638w-grc-51-142-114-112-45.dsl.bell.ca.49727: Flags [P.], seq 40504:40700, ack 1, win 501, length 196
23:07:13.900827 IP 142.93.146.161.ssh > bras-base-toroon2638w-grc-51-142-114-112-45.dsl.bell.ca.49727: Flags [P.], seq 40700:40896, ack 1, win 501, length 196
23:07:13.900886 IP 142.93.146.161.ssh > bras-base-toroon2638w-grc-51-142-114-112-45.dsl.bell.ca.49727: Flags [P.], seq 40896:41092, ack 1, win 501, length 196
23:07:13.900945 IP 142.93.146.161.ssh > bras-base-toroon2638w-grc-51-142-114-112-45.dsl.bell.ca.49727: Flags [P.], seq 41092:41288, ack 1, win 501, length 196
23:07:13.901001 IP 142.93.146.161.ssh > bras-base-toroon2638w-grc-51-142-114-112-45.dsl.bell.ca.49727: Flags [P.], seq 41288:41484, ack 1, win 501, length 196
23:07:13.901056 IP 142.93.146.161.ssh > bras-base-toroon2638w-grc-51-142-114-112-45.dsl.bell.ca.49727: Flags [P.], seq 41484:41680, ack 1, win 501, length 196
23:07:13.901112 IP 142.93.146.161.ssh > bras-base-toroon2638w-grc-51-142-114-112-45.dsl.bell.ca.49727: Flags [P.], seq 41680:41876, ack 1, win 501, length 196
23:07:13.901170 IP 142.93.146.161.ssh > bras-base-toroon2638w-grc-51-142-114-112-45.dsl.bell.ca.49727: Flags [P.], seq 41876:42072, ack 1, win 501, length 196
23:07:13.901228 IP 142.93.146.161.ssh > bras-base-toroon2638w-grc-51-142-114-112-45.dsl.bell.ca.49727: Flags [P.], seq 42072:42268, ack 1, win 501, length 196
23:07:13.901285 IP 142.93.146.161.ssh > bras-base-toroon2638w-grc-51-142-114-112-45.dsl.bell.ca.49727: Flags [P.], seq 42268:42464, ack 1, win 501, length 196
23:07:13.901342 IP 142.93.146.161.ssh > bras-base-toroon2638w-grc-51-142-114-112-45.dsl.bell.ca.49727: Flags [P.], seq 42464:42660, ack 1, win 501, length 196
23:07:13.901396 IP 142.93.146.161.ssh > bras-base-toroon2638w-grc-51-142-114-112-45.dsl.bell.ca.49727: Flags [P.], seq 42660:42856, ack 1, win 501, length 196
23:07:13.901450 IP 142.93.146.161.ssh > bras-base-toroon2638w-grc-51-142-114-112-45.dsl.bell.ca.49727: Flags [P.], seq 42856:43052, ack 1, win 501, length 196
23:07:13.901503 IP 142.93.146.161.ssh > bras-base-toroon2638w-grc-51-142-114-112-45.dsl.bell.ca.49727: Flags [P.], seq 43052:43248, ack 1, win 501, length 196
23:07:13.901556 IP 142.93.146.161.ssh > bras-base-toroon2638w-grc-51-142-114-112-45.dsl.bell.ca.49727: Flags [P.], seq 43248:43444, ack 1, win 501, length 196
23:07:13.901613 IP 142.93.146.161.ssh > bras-base-toroon2638w-grc-51-142-114-112-45.dsl.bell.ca.49727: Flags [P.], seq 43444:43640, ack 1, win 501, length 196
23:07:13.901667 IP 142.93.146.161.ssh > bras-base-toroon2638w-grc-51-142-114-112-45.dsl.bell.ca.49727: Flags [P.], seq 43640:43836, ack 1, win 501, length 196
23:07:13.901723 IP 142.93.146.161.ssh > bras-base-toroon2638w-grc-51-142-114-112-45.dsl.bell.ca.49727: Flags [P.], seq 43836:44032, ack 1, win 501, length 196
23:07:13.901778 IP 142.93.146.161.ssh > bras-base-toroon2638w-grc-51-142-114-112-45.dsl.bell.ca.49727: Flags [P.], seq 44032:44228, ack 1, win 501, length 196
23:07:13.901835 IP 142.93.146.161.ssh > bras-base-toroon2638w-grc-51-142-114-112-45.dsl.bell.ca.49727: Flags [P.], seq 44228:44424, ack 1, win 501, length 196
23:07:13.901889 IP 142.93.146.161.ssh > bras-base-toroon2638w-grc-51-142-114-112-45.dsl.bell.ca.49727: Flags [P.], seq 44424:44620, ack 1, win 501, length 196
23:07:13.901941 IP 142.93.146.161.ssh > bras-base-toroon2638w-grc-51-142-114-112-45.dsl.bell.ca.49727: Flags [P.], seq 44620:44816, ack 1, win 501, length 196
23:07:13.901999 IP 142.93.146.161.ssh > bras-base-toroon2638w-grc-51-142-114-112-45.dsl.bell.ca.49727: Flags [P.], seq 44816:45012, ack 1, win 501, length 196
23:07:13.902053 IP 142.93.146.161.ssh > bras-base-toroon2638w-grc-51-142-114-112-45.dsl.bell.ca.49727: Flags [P.], seq 45012:45208, ack 1, win 501, length 196
23:07:13.902107 IP 142.93.146.161.ssh > bras-base-toroon2638w-grc-51-142-114-112-45.dsl.bell.ca.49727: Flags [P.], seq 45208:45404, ack 1, win 501, length 196
23:07:13.902162 IP 142.93.146.161.ssh > bras-base-toroon2638w-grc-51-142-114-112-45.dsl.bell.ca.49727: Flags [P.], seq 45404:45600, ack 1, win 501, length 196
23:07:13.902217 IP 142.93.146.161.ssh > bras-base-toroon2638w-grc-51-142-114-112-45.dsl.bell.ca.49727: Flags [P.], seq 45600:45796, ack 1, win 501, length 196
23:07:13.902270 IP 142.93.146.161.ssh > bras-base-toroon2638w-grc-51-142-114-112-45.dsl.bell.ca.49727: Flags [P.], seq 45796:45992, ack 1, win 501, length 196
23:07:13.902323 IP 142.93.146.161.ssh > bras-base-toroon2638w-grc-51-142-114-112-45.dsl.bell.ca.49727: Flags [P.], seq 45992:46188, ack 1, win 501, length 196
23:07:13.902375 IP 142.93.146.161.ssh > bras-base-toroon2638w-grc-51-142-114-112-45.dsl.bell.ca.49727: Flags [P.], seq 46188:46384, ack 1, win 501, length 196
23:07:13.902430 IP 142.93.146.161.ssh > bras-base-toroon2638w-grc-51-142-114-112-45.dsl.bell.ca.49727: Flags [P.], seq 46384:46580, ack 1, win 501, length 196
23:07:13.902484 IP 142.93.146.161.ssh > bras-base-toroon2638w-grc-51-142-114-112-45.dsl.bell.ca.49727: Flags [P.], seq 46580:46776, ack 1, win 501, length 196
23:07:13.902539 IP 142.93.146.161.ssh > bras-base-toroon2638w-grc-51-142-114-112-45.dsl.bell.ca.49727: Flags [P.], seq 46776:46972, ack 1, win 501, length 196
23:07:13.902595 IP 142.93.146.161.ssh > bras-base-toroon2638w-grc-51-142-114-112-45.dsl.bell.ca.49727: Flags [P.], seq 46972:47168, ack 1, win 501, length 196
23:07:13.902653 IP 142.93.146.161.ssh > bras-base-toroon2638w-grc-51-142-114-112-45.dsl.bell.ca.49727: Flags [P.], seq 47168:47364, ack 1, win 501, length 196
23:07:13.902706 IP 142.93.146.161.ssh > bras-base-toroon2638w-grc-51-142-114-112-45.dsl.bell.ca.49727: Flags [P.], seq 47364:47560, ack 1, win 501, length 196
23:07:13.904003 IP bras-base-toroon2638w-grc-51-142-114-112-45.dsl.bell.ca.49727 > 142.93.146.161.ssh: Flags [.], ack 31068, win 2484, length 0
23:07:13.904032 IP 142.93.146.161.ssh > bras-base-toroon2638w-grc-51-142-114-112-45.dsl.bell.ca.49727: Flags [P.], seq 47560:47756, ack 1, win 501, length 196
23:07:13.904044 IP bras-base-toroon2638w-grc-51-142-114-112-45.dsl.bell.ca.49727 > 142.93.146.161.ssh: Flags [.], ack 32336, win 2479, length 0
23:07:13.904136 IP 142.93.146.161.ssh > bras-base-toroon2638w-grc-51-142-114-112-45.dsl.bell.ca.49727: Flags [P.], seq 47756:48240, ack 1, win 501, length 484
23:07:13.904199 IP 142.93.146.161.ssh > bras-base-toroon2638w-grc-51-142-114-112-45.dsl.bell.ca.49727: Flags [P.], seq 48240:48436, ack 1, win 501, length 196
23:07:13.904257 IP 142.93.146.161.ssh > bras-base-toroon2638w-grc-51-142-114-112-45.dsl.bell.ca.49727: Flags [P.], seq 48436:48632, ack 1, win 501, length 196
23:07:13.904320 IP 142.93.146.161.ssh > bras-base-toroon2638w-grc-51-142-114-112-45.dsl.bell.ca.49727: Flags [P.], seq 48632:48828, ack 1, win 501, length 196
23:07:13.904375 IP 142.93.146.161.ssh > bras-base-toroon2638w-grc-51-142-114-112-45.dsl.bell.ca.49727: Flags [P.], seq 48828:49024, ack 1, win 501, length 196
23:07:13.904431 IP 142.93.146.161.ssh > bras-base-toroon2638w-grc-51-142-114-112-45.dsl.bell.ca.49727: Flags [P.], seq 49024:49220, ack 1, win 501, length 196
23:07:13.904485 IP 142.93.146.161.ssh > bras-base-toroon2638w-grc-51-142-114-112-45.dsl.bell.ca.49727: Flags [P.], seq 49220:49416, ack 1, win 501, length 196
23:07:13.904539 IP 142.93.146.161.ssh > bras-base-toroon2638w-grc-51-142-114-112-45.dsl.bell.ca.49727: Flags [P.], seq 49416:49612, ack 1, win 501, length 196
23:07:13.904592 IP 142.93.146.161.ssh > bras-base-toroon2638w-grc-51-142-114-112-45.dsl.bell.ca.49727: Flags [P.], seq 49612:49808, ack 1, win 501, length 196
23:07:13.904684 IP 142.93.146.161.ssh > bras-base-toroon2638w-grc-51-142-114-112-45.dsl.bell.ca.49727: Flags [P.], seq 49808:50004, ack 1, win 501, length 196
23:07:13.904751 IP 142.93.146.161.ssh > bras-base-toroon2638w-grc-51-142-114-112-45.dsl.bell.ca.49727: Flags [P.], seq 50004:50200, ack 1, win 501, length 196
23:07:13.904824 IP 142.93.146.161.ssh > bras-base-toroon2638w-grc-51-142-114-112-45.dsl.bell.ca.49727: Flags [P.], seq 50200:50396, ack 1, win 501, length 196
23:07:13.904924 IP 142.93.146.161.ssh > bras-base-toroon2638w-grc-51-142-114-112-45.dsl.bell.ca.49727: Flags [P.], seq 50396:50592, ack 1, win 501, length 196
23:07:13.904988 IP 142.93.146.161.ssh > bras-base-toroon2638w-grc-51-142-114-112-45.dsl.bell.ca.49727: Flags [P.], seq 50592:50788, ack 1, win 501, length 196
23:07:13.905042 IP 142.93.146.161.ssh > bras-base-toroon2638w-grc-51-142-114-112-45.dsl.bell.ca.49727: Flags [P.], seq 50788:50984, ack 1, win 501, length 196
23:07:13.905104 IP 142.93.146.161.ssh > bras-base-toroon2638w-grc-51-142-114-112-45.dsl.bell.ca.49727: Flags [P.], seq 50984:51180, ack 1, win 501, length 196
23:07:13.905158 IP 142.93.146.161.ssh > bras-base-toroon2638w-grc-51-142-114-112-45.dsl.bell.ca.49727: Flags [P.], seq 51180:51376, ack 1, win 501, length 196
23:07:13.905213 IP 142.93.146.161.ssh > bras-base-toroon2638w-grc-51-142-114-112-45.dsl.bell.ca.49727: Flags [P.], seq 51376:51572, ack 1, win 501, length 196
23:07:13.905269 IP 142.93.146.161.ssh > bras-base-toroon2638w-grc-51-142-114-112-45.dsl.bell.ca.49727: Flags [P.], seq 51572:51768, ack 1, win 501, length 196
23:07:13.905322 IP 142.93.146.161.ssh > bras-base-toroon2638w-grc-51-142-114-112-45.dsl.bell.ca.49727: Flags [P.], seq 51768:51964, ack 1, win 501, length 196
23:07:13.905378 IP 142.93.146.161.ssh > bras-base-toroon2638w-grc-51-142-114-112-45.dsl.bell.ca.49727: Flags [P.], seq 51964:52160, ack 1, win 501, length 196
23:07:13.905432 IP 142.93.146.161.ssh > bras-base-toroon2638w-grc-51-142-114-112-45.dsl.bell.ca.49727: Flags [P.], seq 52160:52356, ack 1, win 501, length 196
23:07:13.905487 IP 142.93.146.161.ssh > bras-base-toroon2638w-grc-51-142-114-112-45.dsl.bell.ca.49727: Flags [P.], seq 52356:52552, ack 1, win 501, length 196
23:07:13.905543 IP 142.93.146.161.ssh > bras-base-toroon2638w-grc-51-142-114-112-45.dsl.bell.ca.49727: Flags [P.], seq 52552:52748, ack 1, win 501, length 196
