root@lamp-ubuntu-s-1vcpu-1gb-tor1-01:~# tcpdump -n -i eth0
tcpdump: verbose output suppressed, use -v or -vv for full protocol decode
listening on eth0, link-type EN10MB (Ethernet), capture size 262144 bytes
23:04:21.230654 IP 142.93.146.161.22 > 142.114.112.45.49727: Flags [P.], seq 542719455:542719563, ack 2132238795, win 501, length 108
23:04:21.230720 IP 142.93.146.161.22 > 142.114.112.45.49727: Flags [P.], seq 108:144, ack 1, win 501, length 36
23:04:21.230776 IP 142.93.146.161.22 > 142.114.112.45.49727: Flags [P.], seq 144:252, ack 1, win 501, length 108
23:04:21.230820 IP 142.93.146.161.22 > 142.114.112.45.49727: Flags [P.], seq 252:288, ack 1, win 501, length 36
23:04:21.230944 IP 142.93.146.161.22 > 142.114.112.45.49727: Flags [P.], seq 288:460, ack 1, win 501, length 172
23:04:21.231006 IP 142.93.146.161.22 > 142.114.112.45.49727: Flags [P.], seq 460:496, ack 1, win 501, length 36
23:04:21.231057 IP 142.93.146.161.22 > 142.114.112.45.49727: Flags [P.], seq 496:644, ack 1, win 501, length 148
23:04:21.231094 IP 142.93.146.161.22 > 142.114.112.45.49727: Flags [P.], seq 644:680, ack 1, win 501, length 36
23:04:21.231144 IP 142.93.146.161.22 > 142.114.112.45.49727: Flags [P.], seq 680:828, ack 1, win 501, length 148
23:04:21.234186 IP 142.114.112.45.49727 > 142.93.146.161.22: Flags [.], ack 828, win 2484, length 0
23:04:21.234213 IP 142.93.146.161.22 > 142.114.112.45.49727: Flags [P.], seq 828:1968, ack 1, win 501, length 1140
23:04:21.234296 IP 142.93.146.161.22 > 142.114.112.45.49727: Flags [P.], seq 1968:2108, ack 1, win 501, length 140
23:04:21.234340 IP 142.93.146.161.22 > 142.114.112.45.49727: Flags [P.], seq 2108:2144, ack 1, win 501, length 36
23:04:21.234392 IP 142.93.146.161.22 > 142.114.112.45.49727: Flags [P.], seq 2144:2292, ack 1, win 501, length 148
23:04:21.234430 IP 142.93.146.161.22 > 142.114.112.45.49727: Flags [P.], seq 2292:2328, ack 1, win 501, length 36
23:04:21.234479 IP 142.93.146.161.22 > 142.114.112.45.49727: Flags [P.], seq 2328:2476, ack 1, win 501, length 148
23:04:21.234517 IP 142.93.146.161.22 > 142.114.112.45.49727: Flags [P.], seq 2476:2512, ack 1, win 501, length 36
23:04:21.234563 IP 142.93.146.161.22 > 142.114.112.45.49727: Flags [P.], seq 2512:2660, ack 1, win 501, length 148
23:04:21.234601 IP 142.93.146.161.22 > 142.114.112.45.49727: Flags [P.], seq 2660:2696, ack 1, win 501, length 36
23:04:21.234647 IP 142.93.146.161.22 > 142.114.112.45.49727: Flags [P.], seq 2696:2844, ack 1, win 501, length 148
23:04:21.234683 IP 142.93.146.161.22 > 142.114.112.45.49727: Flags [P.], seq 2844:2880, ack 1, win 501, length 36
23:04:21.234729 IP 142.93.146.161.22 > 142.114.112.45.49727: Flags [P.], seq 2880:3028, ack 1, win 501, length 148
23:04:21.234766 IP 142.93.146.161.22 > 142.114.112.45.49727: Flags [P.], seq 3028:3064, ack 1, win 501, length 36
23:04:21.234812 IP 142.93.146.161.22 > 142.114.112.45.49727: Flags [P.], seq 3064:3212, ack 1, win 501, length 148
23:04:21.234863 IP 142.93.146.161.22 > 142.114.112.45.49727: Flags [P.], seq 3212:3248, ack 1, win 501, length 36
23:04:21.234913 IP 142.93.146.161.22 > 142.114.112.45.49727: Flags [P.], seq 3248:3396, ack 1, win 501, length 148
23:04:21.234953 IP 142.93.146.161.22 > 142.114.112.45.49727: Flags [P.], seq 3396:3432, ack 1, win 501, length 36
23:04:21.234999 IP 142.93.146.161.22 > 142.114.112.45.49727: Flags [P.], seq 3432:3580, ack 1, win 501, length 148
23:04:21.235038 IP 142.93.146.161.22 > 142.114.112.45.49727: Flags [P.], seq 3580:3616, ack 1, win 501, length 36
23:04:21.235084 IP 142.93.146.161.22 > 142.114.112.45.49727: Flags [P.], seq 3616:3764, ack 1, win 501, length 148
23:04:21.237777 IP 142.114.112.45.49727 > 142.93.146.161.22: Flags [.], ack 2660, win 2484, length 0
23:04:21.237799 IP 142.93.146.161.22 > 142.114.112.45.49727: Flags [P.], seq 3764:5824, ack 1, win 501, length 2060
23:04:21.237877 IP 142.93.146.161.22 > 142.114.112.45.49727: Flags [P.], seq 5824:5964, ack 1, win 501, length 140
23:04:21.237922 IP 142.93.146.161.22 > 142.114.112.45.49727: Flags [P.], seq 5964:6000, ack 1, win 501, length 36
23:04:21.238056 IP 142.93.146.161.22 > 142.114.112.45.49727: Flags [P.], seq 6000:6156, ack 1, win 501, length 156
23:04:21.238105 IP 142.93.146.161.22 > 142.114.112.45.49727: Flags [P.], seq 6156:6192, ack 1, win 501, length 36
23:04:21.238165 IP 142.93.146.161.22 > 142.114.112.45.49727: Flags [P.], seq 6192:6340, ack 1, win 501, length 148
23:04:21.238205 IP 142.93.146.161.22 > 142.114.112.45.49727: Flags [P.], seq 6340:6376, ack 1, win 501, length 36
23:04:21.238253 IP 142.93.146.161.22 > 142.114.112.45.49727: Flags [P.], seq 6376:6524, ack 1, win 501, length 148
23:04:21.238291 IP 142.93.146.161.22 > 142.114.112.45.49727: Flags [P.], seq 6524:6560, ack 1, win 501, length 36
23:04:21.238338 IP 142.93.146.161.22 > 142.114.112.45.49727: Flags [P.], seq 6560:6708, ack 1, win 501, length 148
23:04:21.238376 IP 142.93.146.161.22 > 142.114.112.45.49727: Flags [P.], seq 6708:6744, ack 1, win 501, length 36
23:04:21.238428 IP 142.93.146.161.22 > 142.114.112.45.49727: Flags [P.], seq 6744:6892, ack 1, win 501, length 148
23:04:21.238469 IP 142.93.146.161.22 > 142.114.112.45.49727: Flags [P.], seq 6892:6928, ack 1, win 501, length 36
23:04:21.238517 IP 142.93.146.161.22 > 142.114.112.45.49727: Flags [P.], seq 6928:7076, ack 1, win 501, length 148
23:04:21.238556 IP 142.93.146.161.22 > 142.114.112.45.49727: Flags [P.], seq 7076:7112, ack 1, win 501, length 36
23:04:21.239139 IP 142.114.112.45.49727 > 142.93.146.161.22: Flags [.], ack 3764, win 2479, length 0
23:04:21.239156 IP 142.93.146.161.22 > 142.114.112.45.49727: Flags [P.], seq 7112:8768, ack 1, win 501, length 1656
23:04:21.239220 IP 142.93.146.161.22 > 142.114.112.45.49727: Flags [P.], seq 8768:8908, ack 1, win 501, length 140
23:04:21.239261 IP 142.93.146.161.22 > 142.114.112.45.49727: Flags [P.], seq 8908:8944, ack 1, win 501, length 36
23:04:21.239310 IP 142.93.146.161.22 > 142.114.112.45.49727: Flags [P.], seq 8944:9100, ack 1, win 501, length 156
23:04:21.239373 IP 142.93.146.161.22 > 142.114.112.45.49727: Flags [P.], seq 9100:9136, ack 1, win 501, length 36
23:04:21.239469 IP 142.93.146.161.22 > 142.114.112.45.49727: Flags [P.], seq 9136:9284, ack 1, win 501, length 148
23:04:21.239509 IP 142.93.146.161.22 > 142.114.112.45.49727: Flags [P.], seq 9284:9320, ack 1, win 501, length 36
23:04:21.239558 IP 142.93.146.161.22 > 142.114.112.45.49727: Flags [P.], seq 9320:9468, ack 1, win 501, length 148
23:04:21.239607 IP 142.93.146.161.22 > 142.114.112.45.49727: Flags [P.], seq 9468:9504, ack 1, win 501, length 36
23:04:21.239654 IP 142.93.146.161.22 > 142.114.112.45.49727: Flags [P.], seq 9504:9652, ack 1, win 501, length 148
23:04:21.239692 IP 142.93.146.161.22 > 142.114.112.45.49727: Flags [P.], seq 9652:9688, ack 1, win 501, length 36
23:04:21.239739 IP 142.93.146.161.22 > 142.114.112.45.49727: Flags [P.], seq 9688:9836, ack 1, win 501, length 148
23:04:21.239776 IP 142.93.146.161.22 > 142.114.112.45.49727: Flags [P.], seq 9836:9872, ack 1, win 501, length 36
23:04:21.239822 IP 142.93.146.161.22 > 142.114.112.45.49727: Flags [P.], seq 9872:10020, ack 1, win 501, length 148
23:04:21.239862 IP 142.93.146.161.22 > 142.114.112.45.49727: Flags [P.], seq 10020:10056, ack 1, win 501, length 36
23:04:21.239914 IP 142.93.146.161.22 > 142.114.112.45.49727: Flags [P.], seq 10056:10204, ack 1, win 501, length 148
23:04:21.239954 IP 142.93.146.161.22 > 142.114.112.45.49727: Flags [P.], seq 10204:10240, ack 1, win 501, length 36
23:04:21.240002 IP 142.93.146.161.22 > 142.114.112.45.49727: Flags [P.], seq 10240:10388, ack 1, win 501, length 148
23:04:21.240040 IP 142.93.146.161.22 > 142.114.112.45.49727: Flags [P.], seq 10388:10424, ack 1, win 501, length 36
23:04:21.240086 IP 142.93.146.161.22 > 142.114.112.45.49727: Flags [P.], seq 10424:10572, ack 1, win 501, length 148
23:04:21.240124 IP 142.93.146.161.22 > 142.114.112.45.49727: Flags [P.], seq 10572:10608, ack 1, win 501, length 36
23:04:21.240170 IP 142.93.146.161.22 > 142.114.112.45.49727: Flags [P.], seq 10608:10756, ack 1, win 501, length 148
23:04:21.240207 IP 142.93.146.161.22 > 142.114.112.45.49727: Flags [P.], seq 10756:10792, ack 1, win 501, length 36
23:04:21.241401 IP 142.114.112.45.49727 > 142.93.146.161.22: Flags [.], ack 6000, win 2484, length 0
23:04:21.241418 IP 142.93.146.161.22 > 142.114.112.45.49727: Flags [P.], seq 10792:13264, ack 1, win 501, length 2472
23:04:21.241484 IP 142.93.146.161.22 > 142.114.112.45.49727: Flags [P.], seq 13264:13404, ack 1, win 501, length 140
23:04:21.241527 IP 142.93.146.161.22 > 142.114.112.45.49727: Flags [P.], seq 13404:13440, ack 1, win 501, length 36
23:04:21.241574 IP 142.93.146.161.22 > 142.114.112.45.49727: Flags [P.], seq 13440:13596, ack 1, win 501, length 156
23:04:21.241612 IP 142.93.146.161.22 > 142.114.112.45.49727: Flags [P.], seq 13596:13632, ack 1, win 501, length 36
23:04:21.241666 IP 142.93.146.161.22 > 142.114.112.45.49727: Flags [P.], seq 13632:13788, ack 1, win 501, length 156
23:04:21.241704 IP 142.93.146.161.22 > 142.114.112.45.49727: Flags [P.], seq 13788:13824, ack 1, win 501, length 36
23:04:21.244330 IP 142.114.112.45.49727 > 142.93.146.161.22: Flags [.], ack 10424, win 2484, length 0
23:04:21.244358 IP 142.93.146.161.22 > 142.114.112.45.49727: Flags [P.], seq 13824:14784, ack 1, win 501, length 960
23:04:21.244439 IP 142.93.146.161.22 > 142.114.112.45.49727: Flags [P.], seq 14784:14924, ack 1, win 501, length 140
23:04:21.244484 IP 142.93.146.161.22 > 142.114.112.45.49727: Flags [P.], seq 14924:14960, ack 1, win 501, length 36
23:04:21.244537 IP 142.93.146.161.22 > 142.114.112.45.49727: Flags [P.], seq 14960:15116, ack 1, win 501, length 156
23:04:21.244577 IP 142.93.146.161.22 > 142.114.112.45.49727: Flags [P.], seq 15116:15152, ack 1, win 501, length 36
23:04:21.244624 IP 142.93.146.161.22 > 142.114.112.45.49727: Flags [P.], seq 15152:15308, ack 1, win 501, length 156
23:04:21.244663 IP 142.93.146.161.22 > 142.114.112.45.49727: Flags [P.], seq 15308:15344, ack 1, win 501, length 36
23:04:21.244737 IP 142.93.146.161.22 > 142.114.112.45.49727: Flags [P.], seq 15344:15500, ack 1, win 501, length 156
23:04:21.244779 IP 142.93.146.161.22 > 142.114.112.45.49727: Flags [P.], seq 15500:15536, ack 1, win 501, length 36
23:04:21.244844 IP 142.93.146.161.22 > 142.114.112.45.49727: Flags [P.], seq 15536:15692, ack 1, win 501, length 156
23:04:21.244884 IP 142.93.146.161.22 > 142.114.112.45.49727: Flags [P.], seq 15692:15728, ack 1, win 501, length 36
23:04:21.244932 IP 142.93.146.161.22 > 142.114.112.45.49727: Flags [P.], seq 15728:15884, ack 1, win 501, length 156
23:04:21.244970 IP 142.93.146.161.22 > 142.114.112.45.49727: Flags [P.], seq 15884:15920, ack 1, win 501, length 36
23:04:21.245010 IP 142.93.146.161.22 > 142.114.112.45.49727: Flags [P.], seq 15920:16076, ack 1, win 501, length 156
23:04:21.245040 IP 142.114.112.45.49727 > 142.93.146.161.22: Flags [.], ack 10792, win 2482, length 0
23:04:21.245058 IP 142.93.146.161.22 > 142.114.112.45.49727: Flags [P.], seq 16076:16112, ack 1, win 501, length 36
23:04:21.245109 IP 142.93.146.161.22 > 142.114.112.45.49727: Flags [P.], seq 16112:16268, ack 1, win 501, length 156
23:04:21.245146 IP 142.93.146.161.22 > 142.114.112.45.49727: Flags [P.], seq 16268:16304, ack 1, win 501, length 36
23:04:21.245192 IP 142.93.146.161.22 > 142.114.112.45.49727: Flags [P.], seq 16304:16460, ack 1, win 501, length 156
23:04:21.245243 IP 142.93.146.161.22 > 142.114.112.45.49727: Flags [P.], seq 16460:16496, ack 1, win 501, length 36
23:04:21.245295 IP 142.93.146.161.22 > 142.114.112.45.49727: Flags [P.], seq 16496:16652, ack 1, win 501, length 156
23:04:21.245348 IP 142.93.146.161.22 > 142.114.112.45.49727: Flags [P.], seq 16652:16688, ack 1, win 501, length 36
23:04:21.245403 IP 142.93.146.161.22 > 142.114.112.45.49727: Flags [P.], seq 16688:16844, ack 1, win 501, length 156
23:04:21.245442 IP 142.93.146.161.22 > 142.114.112.45.49727: Flags [P.], seq 16844:16880, ack 1, win 501, length 36
23:04:21.245488 IP 142.93.146.161.22 > 142.114.112.45.49727: Flags [P.], seq 16880:17036, ack 1, win 501, length 156
23:04:21.245525 IP 142.93.146.161.22 > 142.114.112.45.49727: Flags [P.], seq 17036:17072, ack 1, win 501, length 36
23:04:21.245571 IP 142.93.146.161.22 > 142.114.112.45.49727: Flags [P.], seq 17072:17228, ack 1, win 501, length 156
23:04:21.245634 IP 142.93.146.161.22 > 142.114.112.45.49727: Flags [P.], seq 17228:17264, ack 1, win 501, length 36
23:04:21.245641 IP 142.93.146.161.22 > 142.114.112.45.49727: Flags [P.], seq 17264:17420, ack 1, win 501, length 156
23:04:21.245693 IP 142.93.146.161.22 > 142.114.112.45.49727: Flags [P.], seq 17420:17456, ack 1, win 501, length 36
23:04:21.245715 IP 142.93.146.161.22 > 142.114.112.45.49727: Flags [P.], seq 17456:17612, ack 1, win 501, length 156
23:04:21.245750 IP 142.93.146.161.22 > 142.114.112.45.49727: Flags [P.], seq 17612:17648, ack 1, win 501, length 36
23:04:21.245797 IP 142.93.146.161.22 > 142.114.112.45.49727: Flags [P.], seq 17648:17788, ack 1, win 501, length 140
23:04:21.245834 IP 142.93.146.161.22 > 142.114.112.45.49727: Flags [P.], seq 17788:17824, ack 1, win 501, length 36
23:04:21.245897 IP 142.93.146.161.22 > 142.114.112.45.49727: Flags [P.], seq 17824:17980, ack 1, win 501, length 156
23:04:21.245941 IP 142.93.146.161.22 > 142.114.112.45.49727: Flags [P.], seq 17980:18016, ack 1, win 501, length 36
23:04:21.245995 IP 142.93.146.161.22 > 142.114.112.45.49727: Flags [P.], seq 18016:18172, ack 1, win 501, length 156
23:04:21.246059 IP 142.93.146.161.22 > 142.114.112.45.49727: Flags [P.], seq 18172:18364, ack 1, win 501, length 192
23:04:21.246098 IP 142.93.146.161.22 > 142.114.112.45.49727: Flags [P.], seq 18364:18400, ack 1, win 501, length 36
23:04:21.246141 IP 142.114.112.45.49727 > 142.93.146.161.22: Flags [.], ack 13824, win 2484, length 0
23:04:21.246164 IP 142.93.146.161.22 > 142.114.112.45.49727: Flags [P.], seq 18400:18556, ack 1, win 501, length 156
23:04:21.246204 IP 142.93.146.161.22 > 142.114.112.45.49727: Flags [P.], seq 18556:18592, ack 1, win 501, length 36
23:04:21.246252 IP 142.93.146.161.22 > 142.114.112.45.49727: Flags [P.], seq 18592:18748, ack 1, win 501, length 156
23:04:21.246289 IP 142.93.146.161.22 > 142.114.112.45.49727: Flags [P.], seq 18748:18784, ack 1, win 501, length 36
23:04:21.246336 IP 142.93.146.161.22 > 142.114.112.45.49727: Flags [P.], seq 18784:18940, ack 1, win 501, length 156
23:04:21.246374 IP 142.93.146.161.22 > 142.114.112.45.49727: Flags [P.], seq 18940:18976, ack 1, win 501, length 36
23:04:21.246420 IP 142.93.146.161.22 > 142.114.112.45.49727: Flags [P.], seq 18976:19132, ack 1, win 501, length 156
23:04:21.246457 IP 142.93.146.161.22 > 142.114.112.45.49727: Flags [P.], seq 19132:19168, ack 1, win 501, length 36
23:04:21.246558 IP 142.93.146.161.22 > 142.114.112.45.49727: Flags [P.], seq 19168:19324, ack 1, win 501, length 156
23:04:21.246599 IP 142.93.146.161.22 > 142.114.112.45.49727: Flags [P.], seq 19324:19360, ack 1, win 501, length 36
23:04:21.246650 IP 142.93.146.161.22 > 142.114.112.45.49727: Flags [P.], seq 19360:19516, ack 1, win 501, length 156
23:04:21.246693 IP 142.93.146.161.22 > 142.114.112.45.49727: Flags [P.], seq 19516:19552, ack 1, win 501, length 36
23:04:21.246743 IP 142.93.146.161.22 > 142.114.112.45.49727: Flags [P.], seq 19552:19708, ack 1, win 501, length 156
23:04:21.246782 IP 142.93.146.161.22 > 142.114.112.45.49727: Flags [P.], seq 19708:19744, ack 1, win 501, length 36
23:04:21.246837 IP 142.93.146.161.22 > 142.114.112.45.49727: Flags [P.], seq 19744:19900, ack 1, win 501, length 156
23:04:21.246874 IP 142.93.146.161.22 > 142.114.112.45.49727: Flags [P.], seq 19900:19936, ack 1, win 501, length 36
23:04:21.246921 IP 142.93.146.161.22 > 142.114.112.45.49727: Flags [P.], seq 19936:20092, ack 1, win 501, length 156
23:04:21.246959 IP 142.93.146.161.22 > 142.114.112.45.49727: Flags [P.], seq 20092:20128, ack 1, win 501, length 36
23:04:21.247005 IP 142.93.146.161.22 > 142.114.112.45.49727: Flags [P.], seq 20128:20284, ack 1, win 501, length 156
23:04:21.247057 IP 142.93.146.161.22 > 142.114.112.45.49727: Flags [P.], seq 20284:20440, ack 1, win 501, length 156
23:04:21.247129 IP 142.93.146.161.22 > 142.114.112.45.49727: Flags [P.], seq 20440:20828, ack 1, win 501, length 388
23:04:21.247214 IP 142.93.146.161.22 > 142.114.112.45.49727: Flags [P.], seq 20828:21456, ack 1, win 501, length 628
23:04:21.247291 IP 142.93.146.161.22 > 142.114.112.45.49727: Flags [P.], seq 21456:21948, ack 1, win 501, length 492
23:04:21.247392 IP 142.93.146.161.22 > 142.114.112.45.49727: Flags [P.], seq 21948:22224, ack 1, win 501, length 276
23:04:21.247451 IP 142.93.146.161.22 > 142.114.112.45.49727: Flags [P.], seq 22224:22492, ack 1, win 501, length 268
23:04:21.247523 IP 142.93.146.161.22 > 142.114.112.45.49727: Flags [P.], seq 22492:22880, ack 1, win 501, length 388
23:04:21.247600 IP 142.93.146.161.22 > 142.114.112.45.49727: Flags [P.], seq 22880:23388, ack 1, win 501, length 508
23:04:21.247685 IP 142.93.146.161.22 > 142.114.112.45.49727: Flags [P.], seq 23388:24016, ack 1, win 501, length 628
23:04:21.247759 IP 142.93.146.161.22 > 142.114.112.45.49727: Flags [P.], seq 24016:24524, ack 1, win 501, length 508
23:04:21.247836 IP 142.93.146.161.22 > 142.114.112.45.49727: Flags [P.], seq 24524:25032, ack 1, win 501, length 508
23:04:21.247912 IP 142.93.146.161.22 > 142.114.112.45.49727: Flags [P.], seq 25032:25540, ack 1, win 501, length 508
23:04:21.247988 IP 142.93.146.161.22 > 142.114.112.45.49727: Flags [P.], seq 25540:25816, ack 1, win 501, length 276
23:04:21.248049 IP 142.93.146.161.22 > 142.114.112.45.49727: Flags [P.], seq 25816:25972, ack 1, win 501, length 156
23:04:21.248123 IP 142.93.146.161.22 > 142.114.112.45.49727: Flags [P.], seq 25972:26128, ack 1, win 501, length 156
23:04:21.248182 IP 142.93.146.161.22 > 142.114.112.45.49727: Flags [P.], seq 26128:26284, ack 1, win 501, length 156
23:04:21.248240 IP 142.93.146.161.22 > 142.114.112.45.49727: Flags [P.], seq 26284:26440, ack 1, win 501, length 156
23:04:21.248299 IP 142.93.146.161.22 > 142.114.112.45.49727: Flags [P.], seq 26440:26596, ack 1, win 501, length 156
23:04:21.248354 IP 142.93.146.161.22 > 142.114.112.45.49727: Flags [P.], seq 26596:26752, ack 1, win 501, length 156
23:04:21.248410 IP 142.93.146.161.22 > 142.114.112.45.49727: Flags [P.], seq 26752:26908, ack 1, win 501, length 156
23:04:21.248464 IP 142.93.146.161.22 > 142.114.112.45.49727: Flags [P.], seq 26908:27064, ack 1, win 501, length 156
23:04:21.248523 IP 142.93.146.161.22 > 142.114.112.45.49727: Flags [P.], seq 27064:27220, ack 1, win 501, length 156
23:04:21.248578 IP 142.93.146.161.22 > 142.114.112.45.49727: Flags [P.], seq 27220:27376, ack 1, win 501, length 156
23:04:21.248670 IP 142.93.146.161.22 > 142.114.112.45.49727: Flags [P.], seq 27376:27532, ack 1, win 501, length 156
23:04:21.248734 IP 142.93.146.161.22 > 142.114.112.45.49727: Flags [P.], seq 27532:27688, ack 1, win 501, length 156
23:04:21.248806 IP 142.93.146.161.22 > 142.114.112.45.49727: Flags [P.], seq 27688:27844, ack 1, win 501, length 156
23:04:21.248865 IP 142.93.146.161.22 > 142.114.112.45.49727: Flags [P.], seq 27844:28000, ack 1, win 501, length 156
23:04:21.248921 IP 142.93.146.161.22 > 142.114.112.45.49727: Flags [P.], seq 28000:28156, ack 1, win 501, length 156
23:04:21.248979 IP 142.93.146.161.22 > 142.114.112.45.49727: Flags [P.], seq 28156:28312, ack 1, win 501, length 156
23:04:21.249034 IP 142.93.146.161.22 > 142.114.112.45.49727: Flags [P.], seq 28312:28468, ack 1, win 501, length 156
23:04:21.249090 IP 142.93.146.161.22 > 142.114.112.45.49727: Flags [P.], seq 28468:28624, ack 1, win 501, length 156
23:04:21.251536 IP 142.114.112.45.49727 > 142.93.146.161.22: Flags [.], ack 17788, win 2484, length 0
23:04:21.251570 IP 142.93.146.161.22 > 142.114.112.45.49727: Flags [P.], seq 28624:28780, ack 1, win 501, length 156
23:04:21.251583 IP 142.114.112.45.49727 > 142.93.146.161.22: Flags [.], ack 18400, win 2481, length 0
23:04:21.251703 IP 142.93.146.161.22 > 142.114.112.45.49727: Flags [P.], seq 28780:29144, ack 1, win 501, length 364
23:04:21.251767 IP 142.93.146.161.22 > 142.114.112.45.49727: Flags [P.], seq 29144:29300, ack 1, win 501, length 156
23:04:21.251828 IP 142.93.146.161.22 > 142.114.112.45.49727: Flags [P.], seq 29300:29456, ack 1, win 501, length 156
23:04:21.251886 IP 142.93.146.161.22 > 142.114.112.45.49727: Flags [P.], seq 29456:29612, ack 1, win 501, length 156
23:04:21.251953 IP 142.93.146.161.22 > 142.114.112.45.49727: Flags [P.], seq 29612:29768, ack 1, win 501, length 156
23:04:21.252009 IP 142.93.146.161.22 > 142.114.112.45.49727: Flags [P.], seq 29768:29924, ack 1, win 501, length 156
23:04:21.252067 IP 142.93.146.161.22 > 142.114.112.45.49727: Flags [P.], seq 29924:30080, ack 1, win 501, length 156
23:04:21.252133 IP 142.93.146.161.22 > 142.114.112.45.49727: Flags [P.], seq 30080:30236, ack 1, win 501, length 156
23:04:21.252192 IP 142.93.146.161.22 > 142.114.112.45.49727: Flags [P.], seq 30236:30392, ack 1, win 501, length 156
23:04:21.252258 IP 142.93.146.161.22 > 142.114.112.45.49727: Flags [P.], seq 30392:30548, ack 1, win 501, length 156
23:04:21.252317 IP 142.93.146.161.22 > 142.114.112.45.49727: Flags [P.], seq 30548:30704, ack 1, win 501, length 156
23:04:21.252372 IP 142.93.146.161.22 > 142.114.112.45.49727: Flags [P.], seq 30704:30860, ack 1, win 501, length 156
23:04:21.252434 IP 142.93.146.161.22 > 142.114.112.45.49727: Flags [P.], seq 30860:31016, ack 1, win 501, length 156
23:04:21.252490 IP 142.93.146.161.22 > 142.114.112.45.49727: Flags [P.], seq 31016:31172, ack 1, win 501, length 156
23:04:21.252547 IP 142.93.146.161.22 > 142.114.112.45.49727: Flags [P.], seq 31172:31328, ack 1, win 501, length 156
23:04:21.252603 IP 142.93.146.161.22 > 142.114.112.45.49727: Flags [P.], seq 31328:31484, ack 1, win 501, length 156
23:04:21.252663 IP 142.93.146.161.22 > 142.114.112.45.49727: Flags [P.], seq 31484:31640, ack 1, win 501, length 156
23:04:21.252725 IP 142.93.146.161.22 > 142.114.112.45.49727: Flags [P.], seq 31640:31796, ack 1, win 501, length 156
23:04:21.252784 IP 142.93.146.161.22 > 142.114.112.45.49727: Flags [P.], seq 31796:31952, ack 1, win 501, length 156
23:04:21.252854 IP 142.93.146.161.22 > 142.114.112.45.49727: Flags [P.], seq 31952:32108, ack 1, win 501, length 156
23:04:21.252922 IP 142.93.146.161.22 > 142.114.112.45.49727: Flags [P.], seq 32108:32264, ack 1, win 501, length 156
23:04:21.252988 IP 142.93.146.161.22 > 142.114.112.45.49727: Flags [P.], seq 32264:32420, ack 1, win 501, length 156
23:04:21.253046 IP 142.93.146.161.22 > 142.114.112.45.49727: Flags [P.], seq 32420:32576, ack 1, win 501, length 156
23:04:21.253103 IP 142.93.146.161.22 > 142.114.112.45.49727: Flags [P.], seq 32576:32732, ack 1, win 501, length 156
23:04:21.253175 IP 142.93.146.161.22 > 142.114.112.45.49727: Flags [P.], seq 32732:32888, ack 1, win 501, length 156
23:04:21.253234 IP 142.93.146.161.22 > 142.114.112.45.49727: Flags [P.], seq 32888:33044, ack 1, win 501, length 156
23:04:21.253300 IP 142.93.146.161.22 > 142.114.112.45.49727: Flags [P.], seq 33044:33200, ack 1, win 501, length 156
23:04:21.253357 IP 142.93.146.161.22 > 142.114.112.45.49727: Flags [P.], seq 33200:33356, ack 1, win 501, length 156
23:04:21.253414 IP 142.93.146.161.22 > 142.114.112.45.49727: Flags [P.], seq 33356:33512, ack 1, win 501, length 156
23:04:21.253482 IP 142.93.146.161.22 > 142.114.112.45.49727: Flags [P.], seq 33512:33668, ack 1, win 501, length 156
23:04:21.253548 IP 142.93.146.161.22 > 142.114.112.45.49727: Flags [P.], seq 33668:33824, ack 1, win 501, length 156
23:04:21.253705 IP 142.93.146.161.22 > 142.114.112.45.49727: Flags [P.], seq 33824:33980, ack 1, win 501, length 156
23:04:21.253779 IP 142.93.146.161.22 > 142.114.112.45.49727: Flags [P.], seq 33980:34136, ack 1, win 501, length 156
23:04:21.253848 IP 142.93.146.161.22 > 142.114.112.45.49727: Flags [P.], seq 34136:34292, ack 1, win 501, length 156
23:04:21.253963 IP 142.114.112.45.49727 > 142.93.146.161.22: Flags [.], ack 22224, win 2484, length 0
23:04:21.253984 IP 142.93.146.161.22 > 142.114.112.45.49727: Flags [P.], seq 34292:34448, ack 1, win 501, length 156
23:04:21.254008 IP 142.114.112.45.49727 > 142.93.146.161.22: Flags [.], ack 28624, win 2484, length 0
23:04:21.254088 IP 142.93.146.161.22 > 142.114.112.45.49727: Flags [P.], seq 34448:34812, ack 1, win 501, length 364
23:04:21.254156 IP 142.93.146.161.22 > 142.114.112.45.49727: Flags [P.], seq 34812:34968, ack 1, win 501, length 156
23:04:21.254214 IP 142.93.146.161.22 > 142.114.112.45.49727: Flags [P.], seq 34968:35124, ack 1, win 501, length 156
23:04:21.254275 IP 142.93.146.161.22 > 142.114.112.45.49727: Flags [P.], seq 35124:35280, ack 1, win 501, length 156
23:04:21.254356 IP 142.93.146.161.22 > 142.114.112.45.49727: Flags [P.], seq 35280:35436, ack 1, win 501, length 156
23:04:21.254422 IP 142.93.146.161.22 > 142.114.112.45.49727: Flags [P.], seq 35436:35592, ack 1, win 501, length 156
23:04:21.254498 IP 142.93.146.161.22 > 142.114.112.45.49727: Flags [P.], seq 35592:35748, ack 1, win 501, length 156
23:04:21.254577 IP 142.93.146.161.22 > 142.114.112.45.49727: Flags [P.], seq 35748:35904, ack 1, win 501, length 156
23:04:21.254674 IP 142.93.146.161.22 > 142.114.112.45.49727: Flags [P.], seq 35904:36060, ack 1, win 501, length 156
23:04:21.254765 IP 142.93.146.161.22 > 142.114.112.45.49727: Flags [P.], seq 36060:36216, ack 1, win 501, length 156
23:04:21.254834 IP 142.93.146.161.22 > 142.114.112.45.49727: Flags [P.], seq 36216:36372, ack 1, win 501, length 156
23:04:21.254891 IP 142.93.146.161.22 > 142.114.112.45.49727: Flags [P.], seq 36372:36528, ack 1, win 501, length 156
23:04:21.254953 IP 142.93.146.161.22 > 142.114.112.45.49727: Flags [P.], seq 36528:36684, ack 1, win 501, length 156
23:04:21.255016 IP 142.93.146.161.22 > 142.114.112.45.49727: Flags [P.], seq 36684:36840, ack 1, win 501, length 156
23:04:21.255074 IP 142.93.146.161.22 > 142.114.112.45.49727: Flags [P.], seq 36840:36996, ack 1, win 501, length 156
23:04:21.255128 IP 142.93.146.161.22 > 142.114.112.45.49727: Flags [P.], seq 36996:37152, ack 1, win 501, length 156
23:04:21.255184 IP 142.93.146.161.22 > 142.114.112.45.49727: Flags [P.], seq 37152:37308, ack 1, win 501, length 156
23:04:21.255246 IP 142.93.146.161.22 > 142.114.112.45.49727: Flags [P.], seq 37308:37464, ack 1, win 501, length 156
23:04:21.255301 IP 142.93.146.161.22 > 142.114.112.45.49727: Flags [P.], seq 37464:37620, ack 1, win 501, length 156
23:04:21.255373 IP 142.93.146.161.22 > 142.114.112.45.49727: Flags [P.], seq 37620:37776, ack 1, win 501, length 156
23:04:21.255426 IP 142.93.146.161.22 > 142.114.112.45.49727: Flags [P.], seq 37776:37932, ack 1, win 501, length 156
23:04:21.255487 IP 142.93.146.161.22 > 142.114.112.45.49727: Flags [P.], seq 37932:38088, ack 1, win 501, length 156
23:04:21.255556 IP 142.93.146.161.22 > 142.114.112.45.49727: Flags [P.], seq 38088:38244, ack 1, win 501, length 156
23:04:21.255661 IP 142.93.146.161.22 > 142.114.112.45.49727: Flags [P.], seq 38244:38400, ack 1, win 501, length 156
23:04:21.255740 IP 142.93.146.161.22 > 142.114.112.45.49727: Flags [P.], seq 38400:38556, ack 1, win 501, length 156
23:04:21.255822 IP 142.93.146.161.22 > 142.114.112.45.49727: Flags [P.], seq 38556:38712, ack 1, win 501, length 156
23:04:21.255941 IP 142.93.146.161.22 > 142.114.112.45.49727: Flags [P.], seq 38712:38868, ack 1, win 501, length 156
23:04:21.256030 IP 142.93.146.161.22 > 142.114.112.45.49727: Flags [P.], seq 38868:39024, ack 1, win 501, length 156
23:04:21.256120 IP 142.93.146.161.22 > 142.114.112.45.49727: Flags [P.], seq 39024:39180, ack 1, win 501, length 156
23:04:21.256189 IP 142.93.146.161.22 > 142.114.112.45.49727: Flags [P.], seq 39180:39336, ack 1, win 501, length 156
23:04:21.256255 IP 142.93.146.161.22 > 142.114.112.45.49727: Flags [P.], seq 39336:39492, ack 1, win 501, length 156
23:04:21.256320 IP 142.93.146.161.22 > 142.114.112.45.49727: Flags [P.], seq 39492:39648, ack 1, win 501, length 156
23:04:21.256377 IP 142.93.146.161.22 > 142.114.112.45.49727: Flags [P.], seq 39648:39804, ack 1, win 501, length 156
23:04:21.256430 IP 142.93.146.161.22 > 142.114.112.45.49727: Flags [P.], seq 39804:39960, ack 1, win 501, length 156
23:04:21.256486 IP 142.93.146.161.22 > 142.114.112.45.49727: Flags [P.], seq 39960:40116, ack 1, win 501, length 156
23:04:21.256538 IP 142.93.146.161.22 > 142.114.112.45.49727: Flags [P.], seq 40116:40272, ack 1, win 501, length 156
23:04:21.256590 IP 142.93.146.161.22 > 142.114.112.45.49727: Flags [P.], seq 40272:40428, ack 1, win 501, length 156
23:04:21.256644 IP 142.93.146.161.22 > 142.114.112.45.49727: Flags [P.], seq 40428:40584, ack 1, win 501, length 156
23:04:21.256696 IP 142.93.146.161.22 > 142.114.112.45.49727: Flags [P.], seq 40584:40740, ack 1, win 501, length 156
23:04:21.256748 IP 142.93.146.161.22 > 142.114.112.45.49727: Flags [P.], seq 40740:40896, ack 1, win 501, length 156
23:04:21.256837 IP 142.93.146.161.22 > 142.114.112.45.49727: Flags [P.], seq 40896:41052, ack 1, win 501, length 156
23:04:21.256905 IP 142.93.146.161.22 > 142.114.112.45.49727: Flags [P.], seq 41052:41208, ack 1, win 501, length 156
23:04:21.256961 IP 142.93.146.161.22 > 142.114.112.45.49727: Flags [P.], seq 41208:41364, ack 1, win 501, length 156
23:04:21.257013 IP 142.93.146.161.22 > 142.114.112.45.49727: Flags [P.], seq 41364:41520, ack 1, win 501, length 156
23:04:21.257076 IP 142.93.146.161.22 > 142.114.112.45.49727: Flags [P.], seq 41520:41676, ack 1, win 501, length 156
23:04:21.257131 IP 142.93.146.161.22 > 142.114.112.45.49727: Flags [P.], seq 41676:41832, ack 1, win 501, length 156
23:04:21.257184 IP 142.93.146.161.22 > 142.114.112.45.49727: Flags [P.], seq 41832:41988, ack 1, win 501, length 156
23:04:21.257251 IP 142.93.146.161.22 > 142.114.112.45.49727: Flags [P.], seq 41988:42144, ack 1, win 501, length 156
23:04:21.257317 IP 142.93.146.161.22 > 142.114.112.45.49727: Flags [P.], seq 42144:42300, ack 1, win 501, length 156
23:04:21.257386 IP 142.93.146.161.22 > 142.114.112.45.49727: Flags [P.], seq 42300:42456, ack 1, win 501, length 156
23:04:21.257441 IP 142.93.146.161.22 > 142.114.112.45.49727: Flags [P.], seq 42456:42612, ack 1, win 501, length 156
23:04:21.257494 IP 142.93.146.161.22 > 142.114.112.45.49727: Flags [P.], seq 42612:42768, ack 1, win 501, length 156
23:04:21.257552 IP 142.93.146.161.22 > 142.114.112.45.49727: Flags [P.], seq 42768:42924, ack 1, win 501, length 156
23:04:21.257606 IP 142.93.146.161.22 > 142.114.112.45.49727: Flags [P.], seq 42924:43080, ack 1, win 501, length 156
23:04:21.257662 IP 142.93.146.161.22 > 142.114.112.45.49727: Flags [P.], seq 43080:43236, ack 1, win 501, length 156
23:04:21.257719 IP 142.93.146.161.22 > 142.114.112.45.49727: Flags [P.], seq 43236:43392, ack 1, win 501, length 156
23:04:21.257776 IP 142.114.112.45.49727 > 142.93.146.161.22: Flags [.], ack 33824, win 2484, length 0
23:04:21.257793 IP 142.114.112.45.49727 > 142.93.146.161.22: Flags [.], ack 36996, win 2484, length 0
23:04:21.257834 IP 142.93.146.161.22 > 142.114.112.45.49727: Flags [P.], seq 43392:43548, ack 1, win 501, length 156
23:04:21.257869 IP 142.93.146.161.22 > 142.114.112.45.49727: Flags [P.], seq 43548:43792, ack 1, win 501, length 244
23:04:21.257932 IP 142.93.146.161.22 > 142.114.112.45.49727: Flags [P.], seq 43792:44068, ack 1, win 501, length 276
23:04:21.257985 IP 142.93.146.161.22 > 142.114.112.45.49727: Flags [P.], seq 44068:44224, ack 1, win 501, length 156
23:04:21.258036 IP 142.93.146.161.22 > 142.114.112.45.49727: Flags [P.], seq 44224:44380, ack 1, win 501, length 156
23:04:21.258092 IP 142.93.146.161.22 > 142.114.112.45.49727: Flags [P.], seq 44380:44536, ack 1, win 501, length 156
23:04:21.258154 IP 142.93.146.161.22 > 142.114.112.45.49727: Flags [P.], seq 44536:44692, ack 1, win 501, length 156
23:04:21.258205 IP 142.93.146.161.22 > 142.114.112.45.49727: Flags [P.], seq 44692:44848, ack 1, win 501, length 156
23:04:21.258258 IP 142.93.146.161.22 > 142.114.112.45.49727: Flags [P.], seq 44848:45004, ack 1, win 501, length 156
23:04:21.258313 IP 142.93.146.161.22 > 142.114.112.45.49727: Flags [P.], seq 45004:45160, ack 1, win 501, length 156
23:04:21.258364 IP 142.93.146.161.22 > 142.114.112.45.49727: Flags [P.], seq 45160:45316, ack 1, win 501, length 156
23:04:21.258418 IP 142.93.146.161.22 > 142.114.112.45.49727: Flags [P.], seq 45316:45472, ack 1, win 501, length 156
23:04:21.258469 IP 142.93.146.161.22 > 142.114.112.45.49727: Flags [P.], seq 45472:45628, ack 1, win 501, length 156
23:04:21.258524 IP 142.93.146.161.22 > 142.114.112.45.49727: Flags [P.], seq 45628:45784, ack 1, win 501, length 156
23:04:21.258577 IP 142.93.146.161.22 > 142.114.112.45.49727: Flags [P.], seq 45784:45940, ack 1, win 501, length 156
23:04:21.258628 IP 142.93.146.161.22 > 142.114.112.45.49727: Flags [P.], seq 45940:46096, ack 1, win 501, length 156
23:04:21.258682 IP 142.93.146.161.22 > 142.114.112.45.49727: Flags [P.], seq 46096:46252, ack 1, win 501, length 156
23:04:21.258733 IP 142.93.146.161.22 > 142.114.112.45.49727: Flags [P.], seq 46252:46408, ack 1, win 501, length 156
23:04:21.258785 IP 142.93.146.161.22 > 142.114.112.45.49727: Flags [P.], seq 46408:46564, ack 1, win 501, length 156
23:04:21.258842 IP 142.93.146.161.22 > 142.114.112.45.49727: Flags [P.], seq 46564:46720, ack 1, win 501, length 156
23:04:21.258902 IP 142.93.146.161.22 > 142.114.112.45.49727: Flags [P.], seq 46720:46876, ack 1, win 501, length 156
23:04:21.258970 IP 142.93.146.161.22 > 142.114.112.45.49727: Flags [P.], seq 46876:47032, ack 1, win 501, length 156
23:04:21.259030 IP 142.93.146.161.22 > 142.114.112.45.49727: Flags [P.], seq 47032:47188, ack 1, win 501, length 156
23:04:21.259088 IP 142.93.146.161.22 > 142.114.112.45.49727: Flags [P.], seq 47188:47344, ack 1, win 501, length 156
23:04:21.259140 IP 142.93.146.161.22 > 142.114.112.45.49727: Flags [P.], seq 47344:47500, ack 1, win 501, length 156
23:04:21.259194 IP 142.93.146.161.22 > 142.114.112.45.49727: Flags [P.], seq 47500:47656, ack 1, win 501, length 156
23:04:21.259246 IP 142.93.146.161.22 > 142.114.112.45.49727: Flags [P.], seq 47656:47812, ack 1, win 501, length 156
23:04:21.259310 IP 142.93.146.161.22 > 142.114.112.45.49727: Flags [P.], seq 47812:47968, ack 1, win 501, length 156
23:04:21.259379 IP 142.93.146.161.22 > 142.114.112.45.49727: Flags [P.], seq 47968:48124, ack 1, win 501, length 156
23:04:21.259431 IP 142.93.146.161.22 > 142.114.112.45.49727: Flags [P.], seq 48124:48280, ack 1, win 501, length 156
23:04:21.259488 IP 142.93.146.161.22 > 142.114.112.45.49727: Flags [P.], seq 48280:48436, ack 1, win 501, length 156
23:04:21.259540 IP 142.93.146.161.22 > 142.114.112.45.49727: Flags [P.], seq 48436:48592, ack 1, win 501, length 156
23:04:21.259592 IP 142.93.146.161.22 > 142.114.112.45.49727: Flags [P.], seq 48592:48748, ack 1, win 501, length 156
23:04:21.259647 IP 142.93.146.161.22 > 142.114.112.45.49727: Flags [P.], seq 48748:48904, ack 1, win 501, length 156
23:04:21.259699 IP 142.93.146.161.22 > 142.114.112.45.49727: Flags [P.], seq 48904:49060, ack 1, win 501, length 156
23:04:21.259773 IP 142.93.146.161.22 > 142.114.112.45.49727: Flags [P.], seq 49060:49216, ack 1, win 501, length 156
23:04:21.259808 IP 142.114.112.45.49727 > 142.93.146.161.22: Flags [.], ack 37932, win 2480, length 0
23:04:21.259877 IP 142.93.146.161.22 > 142.114.112.45.49727: Flags [P.], seq 49216:49476, ack 1, win 501, length 260
23:04:21.259935 IP 142.93.146.161.22 > 142.114.112.45.49727: Flags [P.], seq 49476:49632, ack 1, win 501, length 156
23:04:21.259993 IP 142.93.146.161.22 > 142.114.112.45.49727: Flags [P.], seq 49632:49788, ack 1, win 501, length 156
23:04:21.260046 IP 142.93.146.161.22 > 142.114.112.45.49727: Flags [P.], seq 49788:49944, ack 1, win 501, length 156
23:04:21.260102 IP 142.93.146.161.22 > 142.114.112.45.49727: Flags [P.], seq 49944:50100, ack 1, win 501, length 156
23:04:21.260153 IP 142.93.146.161.22 > 142.114.112.45.49727: Flags [P.], seq 50100:50256, ack 1, win 501, length 156
23:04:21.260205 IP 142.93.146.161.22 > 142.114.112.45.49727: Flags [P.], seq 50256:50412, ack 1, win 501, length 156
23:04:21.260261 IP 142.93.146.161.22 > 142.114.112.45.49727: Flags [P.], seq 50412:50568, ack 1, win 501, length 156
23:04:21.260313 IP 142.93.146.161.22 > 142.114.112.45.49727: Flags [P.], seq 50568:50724, ack 1, win 501, length 156
23:04:21.260368 IP 142.93.146.161.22 > 142.114.112.45.49727: Flags [P.], seq 50724:50880, ack 1, win 501, length 156
23:04:21.260420 IP 142.93.146.161.22 > 142.114.112.45.49727: Flags [P.], seq 50880:51036, ack 1, win 501, length 156
23:04:21.260478 IP 142.93.146.161.22 > 142.114.112.45.49727: Flags [P.], seq 51036:51192, ack 1, win 501, length 156
23:04:21.260530 IP 142.93.146.161.22 > 142.114.112.45.49727: Flags [P.], seq 51192:51348, ack 1, win 501, length 156
23:04:21.260588 IP 142.93.146.161.22 > 142.114.112.45.49727: Flags [P.], seq 51348:51504, ack 1, win 501, length 156
23:04:21.260673 IP 142.93.146.161.22 > 142.114.112.45.49727: Flags [P.], seq 51504:51660, ack 1, win 501, length 156
23:04:21.260742 IP 142.93.146.161.22 > 142.114.112.45.49727: Flags [P.], seq 51660:51816, ack 1, win 501, length 156
23:04:21.260819 IP 142.93.146.161.22 > 142.114.112.45.49727: Flags [P.], seq 51816:51972, ack 1, win 501, length 156
23:04:21.260876 IP 142.93.146.161.22 > 142.114.112.45.49727: Flags [P.], seq 51972:52128, ack 1, win 501, length 156
23:04:21.260929 IP 142.93.146.161.22 > 142.114.112.45.49727: Flags [P.], seq 52128:52284, ack 1, win 501, length 156
23:04:21.260986 IP 142.93.146.161.22 > 142.114.112.45.49727: Flags [P.], seq 52284:52440, ack 1, win 501, length 156
23:04:21.261018 IP 142.114.112.45.49727 > 142.93.146.161.22: Flags [.], ack 40896, win 2484, length 0
23:04:21.261071 IP 142.93.146.161.22 > 142.114.112.45.49727: Flags [P.], seq 52440:52700, ack 1, win 501, length 260
23:04:21.261132 IP 142.93.146.161.22 > 142.114.112.45.49727: Flags [P.], seq 52700:52856, ack 1, win 501, length 156
23:04:21.261188 IP 142.93.146.161.22 > 142.114.112.45.49727: Flags [P.], seq 52856:53012, ack 1, win 501, length 156
23:04:21.261254 IP 142.93.146.161.22 > 142.114.112.45.49727: Flags [P.], seq 53012:53168, ack 1, win 501, length 156
23:04:21.261322 IP 142.93.146.161.22 > 142.114.112.45.49727: Flags [P.], seq 53168:53324, ack 1, win 501, length 156
23:04:21.261390 IP 142.93.146.161.22 > 142.114.112.45.49727: Flags [P.], seq 53324:53480, ack 1, win 501, length 156
23:04:21.261446 IP 142.93.146.161.22 > 142.114.112.45.49727: Flags [P.], seq 53480:53636, ack 1, win 501, length 156
23:04:21.261502 IP 142.93.146.161.22 > 142.114.112.45.49727: Flags [P.], seq 53636:53792, ack 1, win 501, length 156
23:04:21.261555 IP 142.93.146.161.22 > 142.114.112.45.49727: Flags [P.], seq 53792:53948, ack 1, win 501, length 156
23:04:21.261607 IP 142.93.146.161.22 > 142.114.112.45.49727: Flags [P.], seq 53948:54104, ack 1, win 501, length 156
23:04:21.261662 IP 142.93.146.161.22 > 142.114.112.45.49727: Flags [P.], seq 54104:54260, ack 1, win 501, length 156
23:04:21.261715 IP 142.93.146.161.22 > 142.114.112.45.49727: Flags [P.], seq 54260:54416, ack 1, win 501, length 156
23:04:21.261772 IP 142.93.146.161.22 > 142.114.112.45.49727: Flags [P.], seq 54416:54572, ack 1, win 501, length 156
23:04:21.261824 IP 142.93.146.161.22 > 142.114.112.45.49727: Flags [P.], seq 54572:54728, ack 1, win 501, length 156
23:04:21.261886 IP 142.93.146.161.22 > 142.114.112.45.49727: Flags [P.], seq 54728:54884, ack 1, win 501, length 156
23:04:21.262014 IP 142.93.146.161.22 > 142.114.112.45.49727: Flags [P.], seq 54884:55040, ack 1, win 501, length 156
23:04:21.262072 IP 142.93.146.161.22 > 142.114.112.45.49727: Flags [P.], seq 55040:55196, ack 1, win 501, length 156
23:04:21.262131 IP 142.93.146.161.22 > 142.114.112.45.49727: Flags [P.], seq 55196:55352, ack 1, win 501, length 156
